Unnamed: 0,Song_ID,Artist,Artist_diskografija,Song_tekstovinet,Views_tekstovinet,Lyrics_tekstovinet,Url_tekstovinet,Writer_lyricstranslate,Song_lyricstranslate,EngTitle_lyricstranslate,Album_lyricstranslate,Lyrics_lyricstranslate,EngLyrics_lyricstranslate,Url_lyricstranslate,Skladba_diskografija,Stihovi_diskografija,Aranžman_diskografija,Izvedba_diskografija,Album_1_diskografija,Album_2_diskografija,Url_diskografija,Song_diskografija,Album_3_diskografija,Album_4_diskografija,Album_5_diskografija,Album_6_diskografija,Album_7_diskografija,Lyrics_cuspajz,Song_cuspajz,Url_cuspajz,Artist_discogs,Song_discogs,Song_duration_discogs,Album_title_discogs,Album_year_discogs,Lyrics By_discogs,Music By_discogs,Featuring_discogs,All_albums_discogs
77,QUgrhjBj_1_77,Colonia,Colonia,Nedodirljiva,28143,"Svasta cujem o tebi
a ti nisi tako los
ljubim, ljubim te, znam
da svaki put bih jos

Ne trebam ja svijet
samo za nas
ne trebam ja ljubav
utjehu, spas
 
Neka gore kreveti
a za drugo ne brini
bice bolje za oboje
dobro znam, vjeruj mi

Ne trebam ja nikog
da bude mi san
ne trebam ja nikog
za svaki dan

Ref. 2x
Ja sam ne ne nedodirljiva
moje srce nikom ne pripada
moj je zivot brodolom
nema povratka

Dosta je slatkih
lazi i patetitike
dosta je maskarade
daj, razumi me

Ljubav je za druge
nije za nas
neka nekom drugom
bude spas

Ref. 3x","https://tekstovi.net/2,140,29608.html",,,,,,,https://lyricstranslate.com/en/language/english-artists,,,,['Colonia'],,,https://diskografija.com/pjesma/nedodirljiva-14887.htm,Nedodirljiva,,,,,,"Svasta cujem o tebi
A ti nisi tako los
Ljubim, ljubim te, znam
Da svaki put bih jos

Ne trebam ja svijet
Samo za nas
Ne trebam ja ljubav,
Utjehu, spas

Neka gore kreveti
A za drugo ne brini
Bice bolje za oboje
Dobro znam, vjeruj mi

Ne trebam ja nikog
Da bude mi san
Ne trebam ja nikog
Za svaki dan

Ja sam ne-ne-nedodirljiva
Moje srce nikom ne pripada
Moj je zivot brodolom
Nema povratka

Dosta je slatkih lazi i patetitike
Dosta je maskarade,
Daj, razumi me
Ljubav je za druge,
Nije za nas
Neka nekom drugom bude spas",Nedodirljiva,https://cuspajz.com//tekstovi-pjesama/pjesma/colonia/nedodirljiva.html,Colonia,Nedodirljiva,3:27,X (Deset),,,,,nan-X (Deset)
78,QUgrhjBj_1_78,Colonia,Colonia,Nedostajes mi,52424,"Jos uvijek volim te
a proslo je dugo vremena
osjecam prazninu
gledam na tvoju stranu kreveta

I malo po malo
a sve mi se cini zastrasujuce
u zrcalo gledam to netko je drugi
ne prepoznajem se
 
Ref. 2x
Moje tijelo treba te ruke
traze te nedostajes mi
moje srce treba te usne
jos ljube te nedostajes mi

Jos uvijek volim te
odavdje pa sve do neba
i svaka mala stvar
krije miliun uspomena

I malo po malo
a sve mi se cini zastrasujuce
u zrcalo gledam to netko je drugi
ne prepoznajem se

Ref. 2x

Ref. 2x","https://tekstovi.net/2,140,22201.html",,,,,,,,,,,['Colonia'],,,https://diskografija.com/pjesma/nedostajes-mi-10476.htm,Nedostaješ mi,,,,,,"Jos uvijek volim te
A proslo je dugo vremena
Osjecam prazninu
Gledam na tvoju stranu kreveta

I malo po malo
A sve mi se cini zastrasujuce
U zrcalo gledam to netko je drugi
Ne prepoznajem se

Moje tijelo treba te ruke
Traze te nedostajes mi
Moje srce treba te usne
Jos ljube te nedostajes mi

Jos uvijek volim te
Odavdje pa sve do neba
I svaka mala stvar
Krije miliun uspomena

I malo po malo
A sve mi se cini zastrasujuce
U zrcalo gledam to netko je drugi
Ne prepoznajem se",Nedostaješ mi,https://cuspajz.com//tekstovi-pjesama/pjesma/colonia/nedostajes-mi.html,Colonia,Nedostaješ Mi,4:09,Do Kraja,,,,,nan-Do Kraja
79,QUgrhjBj_1_79,Colonia,Colonia,Nek vatre gore sve,22933,"Ti imas ritam kao nitko kog znam
korake tvoje u srcu osjecam
ti, baby, ljubis kao niko do sad
zagrli me i ljubi me

Kao munja tvoj dodir je
trese i ljulja, razvaljuje
budi mi nocas, budi utjeha
zagrli me i ljubi me
 
Ref.
Nocas budi mi san
nek tijela govore nam
ugasi svjetla da ne smetaju nam
sapni mi rijeci tiho, reci mi sve
nek ova noc bude kao zadnja
nek vatre gore sve

Nek druge pate, bices samo moj
koraci tvoji, sav ritam tvoj
ja znam sto zelim
ja sam ona sto zna
da bez utjehe u noci
nema ni sna

Ref.","https://tekstovi.net/2,140,6300.html",,Nek vatre gore sve,Let all the fires burn,,"Ti imaš ritam kao nitko kog znam
Korake tvoje u srcu osjećam
Ti baby ljubiš kao nitko do sad
Zagrli me i ljubi me. Kao munja tvoj dodir je
Trese i ljulja, razvaljuje
Budi mi noćas, budi utjeha
Zagrli me i ljubi me. Noćas budi mi san
Nek tijela govore nam
Ugasi svjetla da ne smetaju nam
Šapni mi riječi tihe, reci mi sve
Nek ova noć bude kao zadnja
Nek vatre gore sve. Nek druge pate, bit ćeš samo moj
Koraci tvoji, sav ritam tvoj
Ja znam što želim, ja sam ona što zna
Da bez utjehe u noci nema ni sna. Noćas budi mi san
Nek tijela govore nam
Ugasi svjetla da ne smetaju nam
Šapni mi riječi tihe, reci mi sve
Nek ova noć bude kao zadnja
Nek vatre gore sve. The night is near, do you hear what I hear
A thousand drums playing in my heart
Bring back the magic, bring back the joy
I wanna be your favorite toy
Just wanna touch in the night, just, just one touch. I've been sad for along it's too much
Do you know how it feels?
Alone at the boulevard of the broken dreams
My heart is yours and yours is mine
Kiss me and hold me till the end of time
Baby, do you know how it feels?
Don't close the door leave the light on for me
All I need is love I hope you'll see
And lady I wanna be your dream","You've got a rhythm like nobody that I know
I feel your steps in my heart
Baby you kiss like no one before
Hug me and kiss me. Your touch is like lightning
It shakes, swings, demolishes
Be tonight, be my comfort
Hug me and kiss me. Be my dream tonight
Let the bodies speak to us
Turn off the lights so they don't bother us
Whisper me the silent words, tell me everything
Let this night be like the last one
Let all the fires burn. Let the other (girls) suffer, you'll be only mine
Your steps, all your rhythm
I know what I want, I am the one who knows
That without the comfort, there's neither sleeping. Be my dream tonight
Let the bodies speak to us
Turn off the lights so they don't bother us
Whisper me the silent words, tell me everything
Let this night be like the last one
Let all the fires burn. (The rest is in English)",https://lyricstranslate.com/en/nek-vatre-gore-sve-let-all-fires-burn.html,['Boris Đurđević'],['Boris Đurđević'],"['Tomislav Jelić', 'Boris Đurđević']",['Colonia'],1997 - Vatra i led,2002 - The best of volume 1,https://diskografija.com/pjesma/nek-vatre-gore-sve-4361.htm,Nek' vatre gore sve,,,,,,"Ti imaš ritam kao nitko kog' znam
Korake tvoje u srcu osjećam
Ti baby ljubiš kao nitko dosad
Zagrli me i ljubi me

Kao munja tvoj dodir je
Trese i ljulja, razvaljuje
Budi mi noćas, budi utjeha
Zagrli me i ljubi me

Noćas budi mi san
Nek' tijela govore nam
Ugasi svjetla da ne smetaju nam
Šapni mi riječi tihe, reci mi sve
Nek' ova noć bude kao zadnja
Nek' vatre gore sve

Nek' druge pate, bit ćeš samo moj
Koraci tvoji, sav ritam tvoj
Ja znam što želim, ja sam ona što zna
Da bez utjehe u noci nema ni sna

Noćas budi mi san
Nek' tijela govore nam
Ugasi svjetla da ne smetaju nam
Šapni mi riječi tihe, reci mi sve
Nek' ova noć bude kao zadnja
Nek' vatre gore sve

The night is near, do you hear what I hear
A thousand drums playing in my heart
Bring back the magic, bring back the joy
I wanna be your favorite toy
Just wanna touch in the night, just, just one touch

I've been sad for along it's too much
Do you know how it feels?
Alone at the boulevard of the broken dreams
My heart is yours and yours is mine
Kiss me and hold me till the end of time
Baby, do you know how it feels?
Don't close the door leave the light on for me
All I need is love I hope you'll see
And lady I wanna be your dream",Nek' vatre gore sve,https://cuspajz.com//tekstovi-pjesama/pjesma/colonia/nek-vatre-gore-sve.html,Colonia,Nek Vatre Gore Sve,,The Best Of Volume 1,,,,,nan-The Best Of Volume 1/nan-Retroactive Early Years
80,QUgrhjBj_1_80,Colonia,Colonia,Nema nade (duet Harem),26530,"Bump, don't stop
let me see your body rock
bump, don't stop
let me see your hands up

Prepoznam te u svakom nemirnom jutru
kad mi zapocne dan
prepoznam te na svakoj stranici knjige
sto me prati u san
 
Kao siluete u tami
nestaju i slike i misli na nas
predugo drzim sve u sebi
i dodje mi da vrisnem na sav glas

Ref.
I nema, nema, nema nade
bez dodira tvog ni zdrave pameti
kada me zateknu suze
nedostaje mi malo tvoje radosti

I nema, nema nade
bez dodira tvog ni zdrave pameti
kada me zateknu suze
nedostaje mi malo tvoje ljubavi

Prepoznam te u svakoj kapljici kise
na svakom koraku
danima sama sebe varam a znam znam da je uzalud

Kao krugovi u pjesku
nestaju i slike i misli na nas
predugo drzim sve u sebi
dodje mi da vrisnem na sav glas

Ref.","https://tekstovi.net/2,140,9493.html",,,,,,,,['Boris Đurđević'],['Boris Đurđević'],['Boris Đurđević'],"['Colonia', 'Harem']",2005 - Hrvatski Radijski Festival 2005,2005 - Hrvatski Radijski Festival 2005 - 24 najbolja,https://diskografija.com/pjesma/nema-nade-4393.htm,Nema nade,2005 - Najbolje od svega - Colonia,2005 - Hitomanija 2 - Colonia,"2005 - Najbolje od svega - remix - Colonia
Aranžman: Harem",,,"Bump, don't stop
let me see your body rock
bump, don't stop
let me see your hands up

Prepoznam te u svakom nemirnom jutru
kad mi zapocne dan
prepoznam te na svakoj stranici knjige
sto me prati u san

Kao siluete u tami
nestaju i slike i misli na nas
predugo drzim sve u sebi
i dodje mi da vrisnem na sav glas

I nema, nema, nema nade
bez dodira tvog ni zdrave pameti
kada me zateknu suze
nedostaje mi malo tvoje radosti

I nema, nema nade
bez dodira tvog ni zdrave pameti
kada me zateknu suze
nedostaje mi malo tvoje ljubavi

Prepoznam te u svakoj kapljici kise
na svakom koraku
danima sama sebe varam a znam znam da je uzalud

Kao krugovi u pjesku
nestaju i slike i misli na nas
predugo drzim sve u sebi
dodje mi da vrisnem na sav glas",Nema nade,https://cuspajz.com//tekstovi-pjesama/pjesma/colonia/nema-nade.html,Colonia,Nema Nade (Harem RMX),,Najbolje Od Svega,,,,,nan-Najbolje Od Svega
81,QUgrhjBj_1_81,Colonia,Colonia,Nevidljiva zena,1696,"Imali smo sve, al’ tebi to
nije dovoljno bilo
trazio si me da budem ta
kakvu si oduvijek htio
savrsena, nacrtana

Moj je zivot prije tebe bio lom
svi oni krugovi pakla
borila sam se da sacuvam
ovo srce od stakla
tebi sam ga poklonila
 
Ref.
Nakon svega, nakon sveg' sto dala sam
za mene mjesta nema
tu kraj tebe ja se osjecam
kao nevidljiva zena

Nakon svega ti si pustio
da ovo lagano tone
jer ti nisi ni dopustio
da bude bolje i bolje

I da ti pokazem
kako voljet znam

Ref. 2x","https://tekstovi.net/2,140,57381.html",,,,,,,https://lyricstranslate.com/en/language/english-artists,,,,,,,,,,,,,,,,,Colonia,Nevidljiva Žena,3:37,Nova Era,,,,,nan-Nova Era
82,QUgrhjBj_1_82,Colonia,Colonia,Nevjera,38334,"Sve su ove godine 
ostavile trag na licu mom
svaka tvoja nevjera 
odnijela je srecu sa sobom

Ref.
Za tebe sam bila ko lutka 
bez osjecaja dala ti sve 
i tvojim lazima vjerovala
pred tvojim putem 
ruze ti prosipala
zivot sam svoj tebi 
besramno darovala

A gdje smo sad 
a gdje si sad
drugu ljubis znam

Dovoljno je bilo 
vise necu zalit' za tobom
zelim biti slobodna
i zelim biti svoja napokon

Ref.","https://tekstovi.net/2,140,2538.html",,,,,,,,['Boris Đurđević'],['Boris Đurđević'],['Boris Đurđević'],['Colonia'],2001 - Milijun milja od nigdje,2005 - Gold edition,https://diskografija.com/pjesma/nevjera-272.htm,Nevjera,,,,,,"Sve su ove godine ostavile trag na licu mom
Svaka tvoja nevjera odnjela je srecu za sobom
Za tebe sam bila ko' lutka bez osjecaja
Dala ti sve i tvojim lažima vjerovala

Pred tvojim putem ruže ti prosipala
Život sam svoj tebi besramno darovala
A gdje smo sad?
A gdje si sad?
Drugu ljubiš, znam!

Dovoljno je bilo više necu žalit' za tobom
Želim biti slobodna i želim biti svoja napokon
Jer za tebe sam bila ko' lutka bez osjecaja
Dala ti sve i tvojim lažima vjerovala

Pred tvojim putem ruže ti prosipala
Život sam svoj tebi besramno darovala
A gdje smo sad?
A gdje si sad?
Drugu ljubiš, znam!",Nevjera,https://cuspajz.com//tekstovi-pjesama/pjesma/colonia/nevjera.html,Colonia,Nevjera,4:17,Milijun Milja Od Nigdje,,,,,nan-Milijun Milja Od Nigdje/2003.0-The Best Of/2005.0-Gold Edition/2011.0-Gold Edition/2013.0-Komplet 4 CDa/2014.0-The Best Of Collection
83,QUgrhjBj_1_83,Colonia,Colonia,"Ni traga, ni glasa",16637,"Nikad posumnjala nisam
u tvoje lose namjere
odmahnula bih rukom
kad bi nesto lose rekli za tebe

Vjerovala sam u ljubav
u bezuvjetni zajednicki san
a nasla se negdje i nigdje
ni sama ne znam kako ni kad
 
Ref.
Ni traga, ni glasa
ne zelim vise cuti o tebi
i nema ni dana
da te zbog nje ne proklinjem

Bila sam tako slijepa
lakse je pogled skrenuti
da si mi priznao odmah
bila bih ti spremna sve oprostiti

Vjerovala sam u ljubav
u bezuvjetni zajednicki san
a nasla se negdje i nigdje
ni sama ne znam kako ni kad

Ref. 4x","https://tekstovi.net/2,140,11015.html",,,,,,,https://lyricstranslate.com/en/language/english-artists,,,,['Colonia'],,,https://diskografija.com/pjesma/ni-traga-ni-glasa-5493.htm,Ni traga ni glasa,,,,,,"Nikad posumnjala nisam
u tvoje lose namjere
odmahnula bih rukom
kad bi nesto lose rekli za tebe

Vjerovala sam u ljubav
u bezuvjetni zajednicki san
a nasla se negdje i nigdje
ni sama ne znam kako ni kad

Ni traga, ni glasa
ne zelim vise cuti o tebi
i nema ni dana
da te zbog nje ne proklinjem

Bila sam tako slijepa
lakse je pogled skrenuti
da si mi priznao odmah
bila bih ti spremna sve oprostiti

Vjerovala sam u ljubav
u bezuvjetni zajednicki san
a nasla se negdje i nigdje
ni sama ne znam kako ni kad","Ni traga, ni glasa",https://cuspajz.com//tekstovi-pjesama/pjesma/colonia/ni-traga-ni-glasa.html,Colonia,Ni Traga Ni Glasa,,Nema Nade,2004.0,,,,2004.0-Nema Nade/nan-Najbolje Od Svega
84,QUgrhjBj_1_84,Colonia,Colonia,Nijansa crvene,461,"Vise ne brojim dane
malo krene, pa stane
kao neki zacaran krug

Opet izlazim van
pitam se da l´ si sam
dok na usne stavljam ruz
 
Nijansa crvene boje
da se osjecam bolje
skupljam poglede

I spremna na greske
iz ocaja teske
u ovaj kasni sat

Ref.
To je od vina
sama sebi se svetim
zaustavi me

Kao mekana svila
meni fali tvoj dodir
zaustavi me

Pronadji me, la la la
ispod rusevina
tu sam negdje, samo sanjam

Pronadji me, la la la
malo izgubljena
tu sam negdje, samo sanjam

Ref. 2x","https://tekstovi.net/2,140,64559.html",,,,,,,,,,,,,,,,,,,,,,,,,,,,,,,,
85,QUgrhjBj_1_85,Colonia,Colonia,Nikad vise (feat. Jaqcues),29995,"Srce je moje zagrlio muk
sa violina vise ne dolazi zvuk
tama je prekrila potonuli grad

Time has become my worst enemy
all through the years 
there was nobody to set me free
for this pain, captured me forever
 
Ref.
Nikad vise moje oci nece jutra vidjeti
bez tebe nikad vise necu disati
loosing our sacred love 
is what I'll never forgive myself
and I will never, never be the same

You are the bliss of my memory
when I close my eyes 
the only thing that I see
now I know that you were kissin' a fool

Siva je boja moje ljubavi
u meni sreca vec odavno ne postoji
zadnji si osmijeh u meni slomio ti

Loosing our sacred love is 
what I'll never forgive myself
'cause there is no one 
that could ever take your place

Ref.

Nikad vise moje oci nece jutra vidjeti
bez tebe nikad vise necu disati

Ref.","https://tekstovi.net/2,140,2515.html",,,,,,,,['Boris Đurđević'],['Boris Đurđević'],,"['Colonia', 'Jacques']",2001 - Milijun milja od nigdje,"2005 - Gold edition
Aranžman: Boris Đurđević",https://diskografija.com/pjesma/nikad-vise-265.htm,Nikad više,,,,,,"Srce je moje zagrlio muk
Sa violina više ne dolazi zvuk
Tama je prekrila potonuli grad

Time has become my worst enemy
All through the years there was nobody to set me free
For this pain, captured me forever

Nikad više moje oči neće jutra vidjeti
Bez tebe nikad više neću disati
Loosing our sacred love is what I'll never forgive myself
And I will never, never be the same

You are the bliss of my memory,
When I close my eyes the only thing that I see
Now I know, you were kissin' a fool

Siva je boja moje ljubavi
U meni sreća već odavno ne postoji
Zadnji si osmijeh u meni slomio ti

Loosing our sacred love is what I'll never forgive myself
'cause there is no one that could ever take your place
Nikad vise moje oči neće jutra vidjeti
Bez tebe nikad više neću disati",Nikad više (with Jaqcues Houdek),https://cuspajz.com//tekstovi-pjesama/pjesma/colonia/nikad-vise-with-jaqcues-houdek.html,Colonia,Nikad Više,4:02,Milijun Milja Od Nigdje,,,,,nan-Milijun Milja Od Nigdje/nan-Oduzimaš Mi Dah (The Best Of...)/2003.0-The Best Of/2005.0-Gold Edition/nan-Best Of/2008.0-The Platinum Collection/2011.0-Gold Edition/2013.0-Komplet 4 CDa/2014.0-The Best Of Collection
86,QUgrhjBj_1_86,Colonia,Colonia,Nisam ti jedina ali sam ti najbolja,14754,"Opet se pletes u vlastite rijeci
 stvarno, duso, stvarno nema potrebe
 nije mi vazno s kim si bio 
nema ovdje nikakve ljubomore
kad si moj, onda si samo moj

Opet zuris, ne gledaj na sat
neka te jos malo, hajde ostani
stize sto i prvi SMS
 prokleti telefon, daj ga ostavi
nocas si samo moj

Ref.
O ne, ne, nisam ti jedina
ali sam ti najbolja
i bio bi razdor sistema da mene nemas
 ja sam vatra, ja sam zar

Opet se pletes u vlastitu mrezu
stvarno, duso, stvarno nema potrebe
nismo par i nismo zaljubljeni
nema ovdje nikakve ljubomore
nocas si samo moj

Ref. 2x

Nismo par i nismo zaljubljeni
nema ovdje nikakve ljubomore
nocas si samo moj

Ref. 2x","https://tekstovi.net/2,140,32044.html",,,,,,,,,,,['Colonia'],,,https://diskografija.com/pjesma/nisam-ti-jedina-ali-sam-ti-najbolja-14889.htm,Nisam ti jedina ali sam ti najbolja,,,,,,,,,Colonia,Nisam Ti Jedina Ali Sam Ti Najbolja,2:58,X (Deset),,,,,nan-X (Deset)
87,QUgrhjBj_1_87,Colonia,Colonia,Nisam vise tvoja,33286,"I sad je stvarno dosta, pretjerujes
ljubomora je tako bolesna stvar
i pusti me da disem
ja mogu biti bilo s kim i to je moja stvar
i bilo kad i bilo gdje prodji kraj mene
ja nemam volje, nemam snage, ne
 
Ref. 2x
Ne mogu tako, lazima ti nema broja
ne, ne, ne zovi me, ja nisam vise tvoja
ne mogu tako, dosta mi je tih problema
ne, ne, ne gotovo je za, za sva vremena

I sad je stvarno dosta, zar hoces da ti nacrtam
ma daj, pogledaj me i nismo vise djeca
al' ti se tako ponasas daj, budi normalan
i bilo kad i bilo gdje prodji kraj mene
ja nemam volje, nemam snage, ne

Ref. 2x

I bilo kad i bilo gdje prodji kraj mene
ja nemam volje, nemam snage, ne

Ref. 2x","https://tekstovi.net/2,140,21799.html",,,,,,,,,,,['Colonia'],,,https://diskografija.com/pjesma/nisam-vise-tvoja-10477.htm,Nisam više tvoja,,,,,,"I sad je stvarno dosta, pretjerujes
Ljubomora je tako bolesna stvar
I pusti me da disem
Ja mogu biti bilo s kim i to je moja stvar
I bilo kad i bilo gdje prodji kraj mene
Ja nemam volje, nemam snage, ne

Ne mogu tako, lazima ti nema broja
Ne, ne, ne zovi me, ja nisam vise tvoja
Ne mogu tako, dosta mi je tih problema
Ne, ne, ne gotovo je za, za sva vremena

I sad je stvarno dosta, zar hoces da ti nacrtam
Ma daj, pogledaj me i nismo vise djeca
Al' ti se tako ponasas daj, budi normalan
I bilo kad i bilo gdje prodji kraj mene
Ja nemam volje, nemam snage, ne

I bilo kad i bilo gdje prodji kraj mene
Ja nemam volje, nemam snage, ne",Nisam više tvoja,https://cuspajz.com//tekstovi-pjesama/pjesma/colonia/nisam-vise-tvoja.html,Colonia,Nisam Više Tvoja,3:46,Do Kraja,,,,,nan-Do Kraja
88,QUgrhjBj_1_88,Colonia,Colonia,Nisi ti vise crno vino,57502,"Nekad bio si more 
sada samo si pjena 
nekad velika ljubav 
a sad sam druga zena

Nekad bio si sunce 
sada svjetlo u tami 
nekad ruka u ruci 
a sad smo opet sami

Ref. 2x
Nisi ti vise crno vino 
koje me opija 
sada si samo zuto lisce 
sto se zaboravlja","https://tekstovi.net/2,140,24570.html",,Nisi ti više crno vino,You're No Longer The Red Vine,Sve najbolje,"Nekad bila si more,
1
Sada samo si pjena.
Nekad velika ljubav,
A sad si druga žena.. Nekad bila si sunce,
Sada svjetlo u tami.
Nekad ruka u ruci,
A sad smo opet sami.. (Pripjev)
Nisi ti više crno vino
Koje me opija,
Sada si samo žuto lišće
Što se zaboravlja.","You used to be the sea,
Now you're only foam.
Used to be a grand love,
And now you're a different woman.. You used to be the sun,
Now a light in the dark.
It used to be a hand in hand,
Now we're alone again.. (Chorus x2)
You're no longer the red vine
Intoxicating me.
Now you're only autumn leaves
To be forgotten.. You used to be the sea,
Now you're only foam.
Used to be a grand love,
And now you're a different woman.. You used to be the sun,
Now a light in the dark.
It used to be a hand in hand,
Now we're alone again.. (Chorus x4)",https://lyricstranslate.com/en/nisi-ti-vi%C5%A1e-crnno-vino-youre-no-longer-red-vine.html,,,,,,,,,,,,,,"Nekad bio si more
Sada samo si pjena
Nekad velika ljubav
A sad sam druga zena

Nekad bio si sunce
Sada svjetlo u tami
Nekad ruka u ruci
A sad smo opet sami

Nisi ti vise crno vino koje me opija
Sada si samo zuto lisce sto se zaboravlja",Nisi ti više crno vino,https://cuspajz.com//tekstovi-pjesama/pjesma/colonia/nisi-ti-vise-crno-vino.html,Colonia,Nisi Ti Više Crno Vino 08,3:28,Pod Sretnom Zvijezdom,,Zlatko Sabolek,Đorđe Novković,,nan-Pod Sretnom Zvijezdom
89,QUgrhjBj_1_89,Colonia,Colonia,Njeno ime ne zovi u snu,30505,"Sve rijeci utjehe u nama
tisina gazi na prstima
skidam ti s lica smijeh andjela
ostavljam ga za sjecanja

Kasno je, oci ti govore sve
nikad me ne prevare
gubim te, znam, zauvijek
 
Ref.
A ipak ostani tu jer kise jos padaju
al' njeno ime ne zovi u snu
jos jednom bicu ti lijek
a ti ces postati moj bol zauvijek

Sad vidim sto sam uradila
kule od vjetra sagradila
ona je sve sto ti nisam ja
njena me sjena sad zaklanja

Kasno je, oci ti govore sve
nikad me ne prevare
i kad je laz, drugo sve

Ref.","https://tekstovi.net/2,140,2514.html",,Njeno ime ne zovi u snu,Don't call her name while dreaming,Ritam ljubavi,"Sve riječi utjehe u nama
1
Tišina gazi na prstima
Skidam ti s lica smijeh anđela
Ostavljam ga za sjećanja. Kasno je, oči ti govore sve
Nikad me ne prevare
Gubim te znam, zauvijek. Pa ipak ostani tu jer kiše još padaju
Al njeno ime ne zovi u snu
Još jednom bit ću ti lijek
A ti ćeš postati moj bol zauvijek. Sad vidim što sam uradila
Kule od vjetra sagradila
Ona je sve što ti nisam ja
Njena me sjena sad zaklanja. Kasno je, oči ti govore sve
Oči što ne prevare
I kad je laž drugo sve. Pa ipak ostani tu jer kiše još padaju
Al njeno ime ne zovi u snu
Još jednom bit ću ti lijek
A ti ćeš postati moj bol zauvijek. Pa ipak ostani tu jer kiše još padaju
Al njeno ime ne zovi u snu
Još jednom bit ću ti lijek
A ti ćeš postati moj bol zauvijek","All the words of comfort in us
The silence walks on the toes
I am taking off the angel's smile from your face
Letting it (the smile) to be remembered.. It's late, the eyes can tell everything
They never deceive me
I am loosing you I know, forever.. Whatever stay here because it is still raining
But don't call her name while dreaming
I will be your remedy again
And you will become my pain for ever.. Now I see what I have done
Have built the towers made of wind
She is everything for you that I am not
Her shadow now covers me.. It's late, the eyes are telling everything
The eyes that never deceive
And when everything else is a lie.",https://lyricstranslate.com/en/njeno-ime-ne-zovi-u-snu-dont-call-her-name-while-dreaming.html,['Boris Đurđević'],['Arijana Kunštek'],['Boris Đurđević'],['Colonia'],1999 - Ritam ljubavi,2002 - The best of volume 1,https://diskografija.com/pjesma/njeno-ime-ne-zovi-u-snu-248.htm,Njeno ime ne zovi u snu,2005 - Gold edition,,,,,"Sve riječi utjehe u nama
Tišina gazi na prstima
Skidam ti s lica smijeh anđela
Ostavljam ga za sjećanja

Kasno je, oči ti govore sve
Nikad me ne prevare
Gubim te znam, zauvijek

Pa ipak ostani tu jer kiše još padaju
Al' njeno ime ne zovi u snu
Još jednom bit ću ti lijek
A ti ćeš postati moj bol zauvijek

Sad vidim što sam uradila
Kule od vjetra sagradila
Ona je sve što ti nisam ja
Njena me sjena sad zaklanja

Kasno je, oči ti govore sve
Oči što ne prevare
I kad je laž drugo sve

Pa ipak ostani tu jer kiše još padaju
Al' njeno ime ne zovi u snu
Još jednom bit ću ti lijek
A ti ćeš postati moj bol zauvijek

Pa ipak ostani tu jer kiše još padaju
Al' njeno ime ne zovi u snu
Još jednom bit ću ti lijek
A ti ćeš postati moj bol zauvijek",Njeno ime ne zovi u snu,https://cuspajz.com//tekstovi-pjesama/pjesma/colonia/njeno-ime-ne-zovi-u-snu.html,Colonia,Njeno Ime Ne Zovi U Snu,3:59,Ritam Ljubavi,,Arijana Kunštek,Boris Đurđević,,nan-Ritam Ljubavi/nan-The Best Of Volume 1/2005.0-Gold Edition/nan-Retroactive Early Years/2011.0-Gold Edition/2013.0-Komplet 4 CDa/nan-C'est La Vie/0.0-The Best Of
