,Song_ID,Song,Lyrics
0,O93DTxfd_1_0,Alaj volim ovo sve,". Od tuge umiru sokaci maleni, puste njive, kuće, ambari, od tuge sad umrijet ću i ja. Alaj volim ovo sve, al' je tužno srce u mene, kad potjeram konje gizdave, preko lijepe zemlje slavonske, prazne kuće, pusti šorovi, i nikog nema da me pozdravi. . Od tuge umiru sokaci maleni, puste njive, kuće, ambari, od tuge sad umrijet ću i ja. Kad nediljom sjednem ja, ispred kuće kao nekada, stara lipa k'o da šapuće, priče kad je sretno bilo sve, još se nadam vratit će se svi, ali nikog nema da me pozdravi. . Od tuge umiru sokaci maleni, puste njive, kuće, ambari, od tuge sad umrijet ću i ja"
1,O93DTxfd_1_1,Becarska tuga,"Aoj meni, majko moja stara, raspuklo se srce u becara, raspuklo se na sedam komada, sve od tuge i golema jada. Siroti smo, majko moja mila, pa me moja draga ostavila, vise mari za gazdina sina, u njega je bogata rubina. Evo ima vec godina dana, ja ti venem k'o slomljena grana, u birtiji noc propijem cijelu, tamburasi prate me po selu. Al' ne marim sto prolaze dani, nit me briga ko mi konje rani, vec me boli i prestati nece, sto je drugi u postelju mece. Aoj meni, majko moja mila, raspuklo se srce u grudima, raspuklo se na sedam komada, sve od tuge i golema jada. Bar da umrem, pa da me sa'rane, iza kuce kraj jabuke rane, pa nek laju sva seoska usta, becarinu ubi ljubav pusta"
2,O93DTxfd_1_2,Četri vitra,"Pušu četiri vitra al' ne pušu stalno, pa nas viju dušo i tamo i amo. I dok nam bura kosti para, a jugo s mora odgovara. Maestral ti si mojih dana, i mog života tramuntana. Pušu četiri vitra pa cvili katarka, bez tebe bi bija ka' bez sidra barka. Pušu četiri vitra, pa škripidu škure, daj mi Bože s tobom sve do zadnje ure."
3,O93DTxfd_1_3,Da mi je soko ptica biti,"Tamo gdje je Papuk planina, Gdje izvire voda studena, Na izvoru stoji momak mlad, Tužno stoji, s tugom zbori:, Što ću jadan vodo studena, Ostavi' me moja voljena, Za drugog se ona udala, Duša boli, još je voli. E, da mi je soko ptica biti, Pa da mogu svoje gnijezdo sviti, Svio bi ga iznad prozora, Gdje mi draga s drugim spava"". Al' govori voda studena, Mladu momku srca ranjena:, Gore glavu, ima vremena, Ljubav doć'e, tuga proć'e"". E, da mi je soko ptica biti, Pa da mogu svoje gnijezdo sviti, Svio bi ga iznad prozora, Gdje mi draga s drugim spava"
4,O93DTxfd_1_4,Da sam im’o šaku dukata,"Ima dana na te ne mislim. Život stisne, pa zaboravim. Al' u srcu uvik tvoj je lik. Još se nadam, vratit ćeš se ti. Kažu da se nisi ljutila. O meni si lipo pričala. Kažu suzu tek bi pustila. Kad si za me di god dočula. . Da sam imo šaku dukata. Da mi nije duša bećarska. Uz tebe bi bio cili vik. Sad je kasno, al' oprosti mi"
5,O93DTxfd_1_5,Daleko je,"Kad te sreca ne cuje, zalud uzdah tuznih grudi, jednom imao sam sve, uzeli mi tudji ljudi. Nema vise spomena, na daleke svete dane, opet su bez imena, ti sto pjesme nase brane. Daleko je kuca moja, dalek mi je put do nje, vec su prosle godine, pa me zovu uspomene. Daleko je ljubav moja, dalek mi je put do nje, jutro nikad ne svane, da je srce ne spomene. Neko gore vidi sve, niti kunem, niti sudim, moje ukrali su sne, pa se tuzna srca budim"
6,O93DTxfd_1_6,Dida,"Dida mi je bio becar, pravi slavonski, ostavio i malo zemlje, gruntovno na mene. Prolazile tu su vojske, carske, velike, i barabe kojekakve, lopuze lokalne. Nisam bas od onih, sto se puno brigaju, kanda malo bacam i ja, na fajtu djedovu. Dok te nisam sreo, nisam im'o smisao, i nisam prije pjesme pisao. Stoput su mi rekli, ali badava , podaj srce zeni, glavu nikada. Al` sto cu kad te vidim, od srece poludim, i kako onda da te ne volim. Ciganke mi jos k'o, klincu jednom gatale, ti ces, mali, srecu nac', u svijetu bijelome. Vjeruj u se i u kljuse, sviraj tamburu, ko bi rek'o kol'ko toga, pise nam na dlanu. E, da me moze dida vidit', bas me zanima, da l' bi mu se prica, moja imalo dopala. Al` ne marim i da, mogu zivit' ponovo, taj s tobom ne bi mijenjao."
7,O93DTxfd_1_7,Domovina,"Ovo nikome nisam rekao, k′o da sam tebe mali čekao. Nije život k′o u knjigama, zato upamti ovo što govorim, ovo je istina. Bilo je ratova i križnih puteva, baka je s djecom sama ostala. Moj stari Jugu nije volio, sve što je imao bio je nogomet. Hajduk i Dinamo. Domovina u venama. Domovinama je u nama. Sedamdesetih ja bio kao ti, procvala ruža, naše proljeće. A onda naglo mnogi nestali, o tom smo šutjeli nismo ih vidjeli, do devedesetih. Svake jeseni kada zakiši, naš susjed Griva svijeću zapali. I on je nekad′ sina imao. Vukovar gorio iz njeg′ se nikada, nije vratio. Sad je moderno nositi kockasto, a poslije neka „čudna muzika. Obećat zato moraš starom svom, da ćeš ovo sve jednog dana ti, svom sinu pričati."
8,O93DTxfd_1_8,Dva vita čempresa,Često se često sjetim tebe. Jedini prijatelju moj. A onda suza sama krene. I opet ona ista bol. Kažu mi sutra bit će bolje. Kažu da vrijeme lijeći sve. Ja samo glavu spustim dolje. Kako kad više nemam te. Prokleta nek je sudbina. Tvoj rano prekinut je san. Samo dva vita čempresa. Uz tebe bdiju noć i dan. Često se često sjetim tebe. Jedini prijatelju moj. A onda suza sama krene. I opet ona ista bol. Dao si život dao sebe. Za ovaj ljepši bolji svijet. Sve dok nas ima dok smo ovdje. U nama živiš zauvijek
9,O93DTxfd_1_9,Dvorište,"U mom dvorištu, od kad za se znaju moji, u njemu nam kuća stoji, stono jednom stari reće, nekad bilo puno veće, al' kako k'o prolazio, od njeg malo otkinuo, razne okolo barabe, svi bi ako može džabe, u mom dvoristu. Ja nedavno rekoh dosta, da ne bi bez svega osta, kupih žicu stupće boje, pa ogradih što je moje, kad komšije svi zajedno, dreknu da sam đubre jedno, prijete mi se mračne sile, i na mene dižu vile, u mom dvoristu. Ko je gazda u dvorištu, sad se valjda zna, ak je ne'ko svoj na svome, to sam onda ja. U mom dvorištu, pjeto zbriso preko plota, ali okolo sad se mota, kriv sam s druge strane viće, al' ne pušim ja te priće, imam i ja neke svoje, pomeću mi dane broje, viću ograda će pasti, znam ja takve što bi vlasti, u mom dvorištu. Kukuruzu držim cijenu, i to čvrstu kao stijenu, a kad netko imat zna, ja mu uzmem dvajestdva, od ostatka još trećinu, i šteram u materinu, sve što smeta moja kasa, ti nemaju pravo glasa, u mom dvorištu. Ko je gazda u dvorištu, sad se valjda zna, ak je ne'ko svoj na svome, to sam onda ja. U mom dvorištu, čim me vide ruku pruže, okrenem se već me tuže, a k tome i svakog dana, sto problema još izvana, susjede sve viđam rjeđe, ne štima nam oko međe, njima malo pa ih ždere, stalno nekog vraga mjere, u mom dvorištu, svako svakog sad napada, al' pušu vjetri sa zapada, josir, beksir čak bizoni, o svemu se brinu oni, često u moj atar svrate, samo jedu niš' ne plate, ograda i njima smeta, i to što ja mimo svijeta, u mom dvorištu. Ko je gazda u dvorištu, sad se valjda zna, ak je ne'ko svoj na svome, to sam onda ja"
10,O93DTxfd_1_10,Fenjeri,"Tebe nocas vidjet moram, vec se pale prvi fenjeri, idem kradom do tvog dvora, gledaju me iza firangi. Ugasite fenjere, neka ljudi ne vide, kako opet placem zbog tebe. Skriven poput lopova, gledam ljubis drugoga, sto cu kad je jace od mene. Boga molim da me prodje, da te mrzim i zaboravim, al' ne mogu, pa mi dodje, pobjec' da se nikad ne vratim. A mogli smo ti i ja, kao ni'ko nikada, da o nama pjesme pjevaju. Ovako cu umrijeti, samo se ugasiti, k'o bez ulja plam u fenjeru"
11,O93DTxfd_1_11,Garavušo garava,"Garavušo garava, ti si mene varala. Ti si mene varala kad si mi govorila. Bit' ćeš moja ili ničija. Garavušo garava, ti si mene lagala. Šorom lipa miriše, srce moje uzdiše. Srce moje uzdiše, nema mi garavuše. Priskoćit ću plotove, privrnut ću stolove. Privrnut ću stolove, curo moja zbog tebe"
12,O93DTxfd_1_12,Golubica,"Ispod oka gledam te, mislim, jesi l' za mene, il' me parfem, odjeća, tek na nekog podsjeća. Izdaju te gutljaji, izgubljene ljubavi, a ni u mom slučaju, ruže baš ne cvjetaju. Srce čezne pa se zezne, kad sve skupa izbrojim, nema nade za nas dvoje, bolje da se izgubim. Ej moja golubice bijela, što je tebi pa si nevesela, je l' tvoj golub krila raširio, pa te ostavio. Broj s točkom ja sam ti, uvijek tu na usluzi, drugi budem katkada, samo prvi nikada. Srce čezne pa se zezne, kad sve skupa izbrojim, nema nade za nas dvoje, bolje da se izgubim. Srce čezne pa se zezne, kad sve skupa izbrojim, prije nego nas je troje, bolje da se izgubim."
13,O93DTxfd_1_13,Hag,"Sjeli kum i ja u bijelog Golfa, krenuli na put, a zene straga, u zemlju tulipana i krojfa, i sa dva tanka stigli do Haga. Hag je nasa posljednja sansa, ma kak'i München, Bec ili Prag, spremi se narode jer dilizansa, krece sto vozi sve nas za Hag. Kumu se svida, sve gladi bradu, veli mi vidi, sve je pod spagu, ovi resurse koristit' znadu, svi bi mi trebali biti u Hagu. Gledam ja kuma, pa di to ima, zveknem ga klompom u ocni zivac, *bo te Hag skup' s biciklima, ic'es ti meni u Remetinac"
14,O93DTxfd_1_14,Heroji ne plaču,"Što ostat će jednom od mene, kad usnama sudbinu dotaknem?. Samo tužne pjesme, neka tuđa žena, reći će moje ime šapatom. Heroji ne plaču, i kad gube, pobjeđuju. Heroji ne mole, zube stisnu i prebole. Što ostane jednom od čovjeka, kad istina na vrata pokuca?. Miris davnog jutra, san o boljem sutra, sjećanja, samo šaka pepela. "
15,O93DTxfd_1_15,"Idem, idem ej, živote","Kad ja krenem stazom starom, jorgovanom sve miriši, kao da je vrijeme stalo, i kraj mene k'o da ti si. A ja idem polagano, polagano kao prije, i ne dam se godinama, k'o da mladost prošla nije, idem, idem ej, živote, moja duša još je mlada, samo tebe nema rano, da zajedno zapjevamo"
16,O93DTxfd_1_16,Izdajnici i heroji,"Posten covjek bit' ponos je i dika, a nema nista gore k'o kad majka rodi izdajnika, taj prevarit' hoce i tudjeg i svoga, lagat', otet' drugom, jer on  nema ni vjere ni Boga. A heroja pronaci ces tesko, on ne prica o djelima svojim, i upamti, rec' cu ti jos nesto, poznat ces ga, poznat ces ga, u pjesmama mojim). Ruke vodom pere, dok ga narod gleda, al' izdajnik ne zna da se obraz nikad oprat' ne da, oduvijek je tako, to ne vrijedi kriti, i sto ljudi vele, covjek posten najteze je biti. Jer heroja pronaci ces tesko, on ne prica o djelima svojim, poznat ces ga u pjesmama mojim, i po suzi iskrenoj, koja pada kada daje zivot svoj"
17,O93DTxfd_1_17,Ja sam taj što voli tambure,"Mnoge cure, mnoge cure, u me gledaju, al se ljubit al se ljubit, nikad ne daju. Ne gledajte, ne gledajte, cure u mene, aj te amo, aj te amo, sjesti do mene, ne gledajte, ne gledajte, cure u mene, ja sam taj, što voli tambure. Idem šorom, idem šorom, žene šapuću. Pa me kradom, pa me kradom, zovu u kuću. Ne gledajte, ne gledajte, žene u mene, aj te amo, aj te amo, sjesti do mene, ne gledajte, ne gledajte, žene u mene, ja sam taj, što voli tambure. Ispred kuće, ispred kuće, babe zasjele, Pokazuju, pokazuju, prstom na mene. Ne gledajte, ne gledajte, babe u mene, aj te amo, aj te amo, sjesti do mene, ne gledajte, ne gledajte, babe u mene, ja sam taj, što voli tambure."
18,O93DTxfd_1_18,Ja se bojim da me ne volis,"Prosetam se nekad, pokraj stare ladje, u suton kada rijeka, ljubi obale. I tu me, k'o po navici, neka tuga snadje, dok mi vjetar sjetne, misli dogoni. Ja se bojim da me ne volis, i da ces otici, ja se bojim da cu umrijeti, ako me ostavis. Ja trebam tvoje ruke, i usne sto se maze, kosu boje jeseni, da me miluje. Koliko te volim, moj ti pogled kaze, i bez tebe dusa, moja boluje. Moja ljubavi, ako me ostavis"
19,O93DTxfd_1_19,Jeleno lijepa,"Jeleno lijepa ljubavi, gdje su te duso odveli, obecala si meni ti, da ces mi sina roditi. Kazu mi stari cigani, u Pesti su te vidjeli, da neces mome narucju, jer braca to ti ne daju. Zato ljube moja bolujem, nicemu se ne radujem, zato ljube moja bol bolujem. Jeleno lijepa ljubavi, po nekome napisi ti, zbore li pravo cigani, pisi mi kada dolazis. Jer ja ljube moja bolujem, nicemu se ne radujem, jer ja ljube moja bol bolujem. Da l' su te od mene odveli, braca ili cigani, tuga ce zemlju pokriti, ako se meni ne vratis. Stiglo mi pismo Jeleno, i srce mi se slomilo, u njemu pises Jeleno, sto se to s tobom desilo. Nisu te od mene odveli, ni braca, a ni cigani, vec tvoje srce nevjerno, tudjinu sto se podalo. A ja ljube moja bolujem, nicemu se ne radujem, ja ti ljube moja bol bolujem. Jer ja ljube moja bolujem, nicemu se ne radujem, zivot kunem i umirem. Jeleno lijepa ljubavi, zbog nas ce plakati vjekovi"
20,O93DTxfd_1_20,Jorgovan,"Svatko pjeva o svom jadu, ja o svome ne smijem, loši snovi noći kradu, noći su mi najgore. Stavljam život u zavežljaj, a svu ljubav u zagrljaj, i odlazim i sve ostavljam. Crven, bijeli, plavi jorgovan, u mom vrtu cvjeta neubran, uvenuti neće nikada, moga srca to je zastava. Gdje sam rođen teće rijeka, kraj nje mladost ostala, i šapatom još me zove, moja desna obala, Al' je tuga od sveg jača, što po krvi moja braća, svog se stide, ništa ne vide. Crven, bijeli, plavi jorgovan, u mom vrtu cvjeta neubran, uvenuti neće nikada, moga srca to je zastava. Crven, bijeli, plavi jorgovan, u mom vrtu cvjeta neubran, uvenuti neće nikada, moga srca to je zastava. Kad je zorom sunce obrva, na tebe me jutro podsjeća, na tri boje moje radosti, pa ne mogu suze sakriti"
21,O93DTxfd_1_21,Kad se laste kuci vrate,"Nikome o nama ne pricam, i pravim se da se ne sjecam nicega. Zivim, disem, rijetko izlazim, a ključeve uvijek ostavim, skrivene, znas vec gdje. Ja ne mogu nikud poci, da ne pitaju me za te, pa im lazem da ces doci, kad se laste kuci vrate. Kaplje vrijeme, svoje obavlja, noc podsjeti, dan zaboravlja na tebe. Moze covjek stoput zivjeti, al' jedanput stvarno voljeti, iskreno, i to je to. Stalno lazem da ces doci, kad se laste kuci vrate"
22,O93DTxfd_1_22,"Konji bili, Konji vrani","Još po danu nekako i mogu. Bi' sakriti bez zamirke Bogu. Al' po noći kada sve utiša'. Od sićanja san na oči neće. Ej, kakve sam konje im'o. Konje bile, konje vrane. Konje bile, konje vrane. I žerave, razigrane. Konje bile, konje vrane. I žerave, razigrane. Upalite onaj fenjer stari. Neka svitli dok zora ne svane. Neka u njem' gore uspomene. Na ljubavi, na minule dane. Ej kakve sam konje im'o. Konje bile, konje vrane. Konje bile, konje vrane. I žerave, razigrane. Konje bile, konje vrane. I žerave, razigrane. Sve sam spisku rastep'o imanje. Što ga za me stari dido smog'o. Da bi mog'o platit' lumpovanje. Ne bi l' srcu pijan pomoć' mog'o. Ej kakve sam konje im'o. Konje bile, konje vrane. Konje bile, konje vrane. I žerave, razigrane. Ej kakva sam kola im'o. Za momačke lude dane. Ostala mi kraj salaša. Ispod duda, krajputaša. Ostala mi kraj salaša. Pale na nji' suve grane. Ej kakve sam konje im'o..."
23,O93DTxfd_1_23,Kupila cura mala,"Miroslav:. Kupila cura mala, kupila cipele, ulicu zaljuljala kad se prošetala, kupila cura mala, svilene čarape, suknjicu na volane, da pamet zastane. Lidija:. Kupila je mala što joj milo, još bi više da je para bilo, nije niko, nećeš ni ti, mi zabraniti. Miroslav:. Ej curo mala, vidio te Bog, pusti modu, okani se tog, nije što ćeš novce trošiti, već je zima bokovima. Lidija:. Zašto ti moram reći stoput ponovo, sve je kao da se volimo, i sve dok ćemo novce trošiti, nek je zima bokovima. Miroslav:. A mogla bi se ti prehladiti. Ljubav sam curo mala, skupo ja platio, lako bi tko te ne zna, bez svega ostao. Lidija:. Kupila je mala što joj milo, još bi više da je para bilo, nije niko, nećeš ni ti, mi zabraniti. Miroslav:. Ej curo mala, vidio te Bog, pusti modu, okani se tog, nije što ćeš novce trošiti, već je zima bokovima. Lidija:. Zašto ti moram reći stoput ponovo, sve je kao da se volimo, i sve dok ćemo novce trošiti, nek je zima bokovima. Miroslav:. A mogla bi se ti prehladiti"
24,O93DTxfd_1_24,"Laku noć, ljubavi","U neko doba kada zaspu svi, ja svoje pjesme crtam, vilenim, i neka nitko se ne naljuti, u svakoj od njih imaš barem stih. Ljubav je rulet, čista lutrija, stalno se igra a rijetko dobiva, a onaj Amor, mali debeli, gađa u srce, kada poželi. Laku noć, ljubavi, spomeni me u molitvi, kao što tvoje ime ja, spominjem u svim, mojim pjesmama. Laku noć, ljubavi, zaplovi snom i ne brini, dobar mornar biću ja, naš dom je lađa sigurna. Topi se noćna santa vremena, budi se pjevac, ptica Petrova, a u daljini život magli se, plaši i mami naše brodove. Sve manje snage ima u meni, razlog za stih teško nalazim, na kraju, sve te riječi velike, ne vrijede kao jedno volim te. Laku noć, ljubavi, spomeni me u molitvi, kao što tvoje ime ja, spominjem u svim, mojim pjesmama. Laku noć, ljubavi, moram ti tajnu otkriti, i kad te nisam poznao, tebi sam pjesme pisao."
25,O93DTxfd_1_25,Ljubav ne bira,"U neko davno vrijeme, jos stari pricaju, silno su se voljeli, princeza i trubadur. Al nebilo tu srece, sve moze, al ne to, da princeza i trubadur, budu zajedno. Vidis sreco moja, ljubav ne bira, vec spaja sto je volja, i nikog ne pita. Nema nista ljepse, od sretna srca dva, kad se vole kao ti i ja. Vidis sreco moja, ljubav ne bira, vec spaja sto je volja, i nikog ne pita. Ma nema nista ljepse, od sretna srca dva, kad se vole kao ti i ja. Nit si ti princeza, trubadur nisam ja, al' je prica o nas dvoje, ko i njihova. Eto i mi malo, srecu sanjali, al ne dadose drugi, pa se i mi rastali. Vidis sreco moja, ljubav ne bira, vec spaja sto je volja, i nikog ne pita. Jer nema nista ljepse, od sretna srca dva, kad se vole kao ti i ja. Ali ljubav prava, nekad ima tuzan kraj, sto je tako, to me ne pitaj"
26,O93DTxfd_1_26,MAJKO JEDINA,"Majko jedina, Dugo, dugo ne vidjeh te ja. Kad si otišla, Na srcu mi želja zaspala. Srest ćemo se jednom, majko, Među zvijezdama. Ti si za mene jedina! ). Ja ne tugujem;. Tamo gdje si, znam da dobro je. Ipak, teško je…. Tvoja ruka mi nedostaje. Srest ćemo se jednom, majko, Među zvijezdama. Ti si za mene jedina! ). Rano s proljeća. Naša trešnja cvijetom ocvala. Noć kad spusti se;. Oči tvoje u njoj sjaje se. Srest ćemo se jednom, majko, Među zvijezdama. Ti si za mene jedina! ). Ti si za mene jedina!. Majko, majko najdraža!"
27,O93DTxfd_1_27,Maligani,"Maligani maligani, stani pani idu dani, a ja nemam baš nekih želja, osim po litre veselja. Uvijek razlog neki ima, da se nađem ja sa svima, kad se naše male ruke slože, litra voda uvijek može. Eto smo se malo zapili, maligani su nas dotukli, al' ćemo do zore pjevati, nećemo se nikad rastati. Idem kući zorom ranom, ovom mojom ravnom stranom, jer je staza malo preko puta, pade konjak iz kaputa. Nemam pojma di sam bio, di sam pare potrošio, sve u redu, što se mene tiče, samo žena malo viče"
28,O93DTxfd_1_28,Maria de la Lovrez,"Zvala se Maria de la Lovrez, iz Meksika je bila, ljudi, to što pričam nije zez. Sreo sam je, sred Jadranske obale. zna po naški, kakva sreća, dida joj je sa Lovreča, Bože hvala ti. I Mate, dobar si. Gitaru sviro sam joj, ja dan i noć, a ona je nešto prekidala, da je glumica i da mora kući poć. Reko sam Hej!. Ti naša jesi, budi Lassie. A ona reče:. Moj Santana, ja ti odo za dva dana, nazad u Meksiko!. Maria, Maria!. Svirajte mi, mariachi, uz gitaru srce, plači, moje ranjeno. Jer dijaspora, ljubav mi je uzela. Maria, Maria!. Svirajte mi, mariachi, uz gitaru srce, plači, moje ranjeno. jer taj Meksiko, fakat mi je daleko. Od tada loše živim, visok mi tlak. Već mi je više puta došlo, da se bacim pod teretni vlak. Ali ne... pomogne kroz sapunice. Tražit ću je širom svijeta, preko UNCA, interneta. Ima još nade, zar ne?. Maria, Maria!. Svirajte mi, mariachi, i uz trubu srce, plači, moje ranjeno. Jer dijaspora, ljubav mi je uzela. Maria, Maria!. Svirajte mi, mariachi, uz gitaru srce, plači, moje ranjeno. jer taj Meksikoooo, e fakat mi je visoko."
29,O93DTxfd_1_29,Mata,"Mata je rođen jedne nedilje, četrdeset neke godine, otac nije za njega ni znao, s križnog puta kad se vratio. Živili tako skromno al' ponosno, u selu malom pitomom slavonskom, seoske babe nisu ga volile, kad krene šorom navuku firange. A ja, k'o da ga vidim još i sad, u kas vraća konje s pojila, selo priča, Matu ne briga, samo konje brže potjera. Onda je došla devedeseta, otac reče sad il' nikada, i Mata krenu k'o iz nekog sna, bez igdi išta al' srca velika. Te su mu zime brata ubili, spalili selo, konje odveli, oca su našli nakon mjesec, dva, slomila ga tuga velika. Bio sam s Matom prošle nedilje, kod crkve poslije mise jutarnje, uz njega sin mu i djeca bratova, pa gdje si Mata, kako je, pitam ga. Veli mi sve će biti k'o ranije, opet će selo okitit kapije, sve ćemo vratit, al' jedno nikad ne, uspomene što su nam nestale."
30,O93DTxfd_1_30,Merak (feat. Grupa Vigor),"Mama, jedva dodjoh do praga, jedva potrefio, sto je razloga, sto sam takav. Kucu dva put falio, jedva pogodio, sto je razloga, sto bi opet sve ponovio. Bjezi dok se nije razdanilo, bas te briga kad bi se i saznalo. Merak kad je mrak, malo pustit' glas, koju pogledat', i tako zoru docekat'. Ona od svega pravi slona, ja k'o da ne vidim, i sto je pitanja, sto sam takav. Vidi, mjesec k'o da se stidi, sto je nakrivo, pa mi sapuce, samo tako ili nikako. Bjezi dok se nije razdanilo, bas te briga kad bi se i saznalo"
31,O93DTxfd_1_31,Milo Moje,"Milo moje, milo mame svoje, više moje, nego mame svoje, milo moje, milo mame svoje, imal' rano, nade za nas dvoje. Reci dal' me, dal' me voliš zlato, milo moje, milo umiljato, od kada ti, ja ne ljubim grudi, niti spavam, nit' se sretan budim. Reci dal' me, dal' me voliš zlato, milo moje, milo umiljato, reci dal' me, dal' me voliš zlato, milo moje, milo mame svoje. Reci dal' me, dal' me voliš zlato, milo moje, milo umiljato, ), milo moje, lane umiljato"
32,O93DTxfd_1_32,Misli baja,"Leži baja u srid lada dudova, leži tako ne mari za nikoga. Misli baja došlo vrime i meni, ženit ću se i ja ove jeseni. Gori vatra ispod stari kazana, peće baja rakiju od dudova. Došle duge noći mrkli šorovi, zapivali oko duda svatovi."
33,O93DTxfd_1_33,Moja je kuca na kraju sela,"Moja je kuca na kraju sela, tu zorom dodjem, a odem s' noci, pa pijem vina crna i bijela, i trazim lijeka svojoj samoci. O meni svasta govore, lazu, pusti ga, vele, taj dugo nece, ne smeta meni kad ljudi kazu, isti ko otac, tu nema srece. Neka sam isti kao on, dani mi idu uludo, neka sam isti k'o stari moj, dok zivot juri, ja cu lagano. Moja je kuca vec dugo pusta, oko nje raste visoka trava, kriju je kise i magla gusta, i u njoj moje djetinjstvo spava"
34,O93DTxfd_1_34,Moja Juliška,"Kad se sjetim ja, moja Juliška, kako si mene ljubila. Kako smo samo ludo plesali, dok su čardaš svirali. Tvoje male slatke čizmice, zemlju nisu dirale. Nije bilo ljepše curice, od tebe, golubice. Meni čini se da su noći te, zvijezde sve nama sijale. Pokraj čarde trava polegla, nama pamet pobjegla. Samo Bog to zna, moja Juliška, gdje si sad, u čijim snovima. Meni duša uvijek zaigra, kada čardaš zasvira."
35,O93DTxfd_1_35,Moja vilo,"Da sam ja, na dnu kutije, bombona tvojih sitan prah, pa da me, vrskom prsta, razmazes po usnama. Da sam ja, dukat zut, na tankoj vrpci u tvojim, njedrima tvog kaputa, da sam podstava. Moja vilo, u oku mi zakisilo, zbog tebe, a ti ne znas, lopov ja sam sto ti krade poglede, da te vidim smisljam glupe razloge. Boze tesko je biti bez tebe. Vjeruj mi, ja bi duso, s tobom bio zauvijek, al' ljubav mi, srna sto se, lako srece prepadne. Cujes li, kao kljuc, u gluhoj noci, kad na pod ispada, to moje srce za te udara. Moja vilo, u oku mi zakisilo, zbog tebe, a ti ne znas, lopov ja sam sto ti krade poglede, da te vidim smisljam glupe razloge, ), Boze tesko je biti bez tebe. A jos teze je reci volim te)"
36,O93DTxfd_1_36,Molio sam Boga za te,"Prvi sam te poljubio, oko moje plavo, ime sam ti nadjenuo, i srce ti dao. Molio sam Boga za te, i on mi te dao, da te nema, što je sreća, nikad' ne bi' znao. A kad jednom odem zlato, kad mi slome krila, znaj da si mi u životu, prva radost bila"
37,O93DTxfd_1_37,"Mozda pijan, ali nisam jako","Prosla ponoc, psi laju u mraku, neki pijet’o rano pjesmu poje, ja se vucem po nasem sokaku, trazim puta do ograde moje. Mozda pijan, ali nisam jako. Boze zdravlja, pa kuci polako. Svirali smo na nekom salasu, gazda dao sunke i kulina, pamtim samo jednu zgodnu snasu, ispijeno bure dobrog vina. Sad sam pijan, ali nisam jako. Boze zdravlja, pa kuci polako. Gori lampa, a Vinkovci nisu, il' je stvarnost ili mi se cini, poznam kucu, znam i vrata di su, to je moja, o hvala sudbini. Ja sam pijan, ali nisam jako. Boze, zdravlja, pa kuci polako. Cim sam us'o, zena poce buku, nema mira u to kasno doba, skace s mjesta, stade mi na ruku, oko mene okrece se soba. Zeno moja, bolje pricu skrati, da te baja pijan ne do'vati"
38,O93DTxfd_1_38,Ne dirajte mi ravnicu,"Večeras me, dobri ljudi, nemojte ništa pitati, neka suze tiho teku, pa će manje boljeti. Još u sebi čujem majku, kako tužna govori, kad se jednom vratiš, sine, ja ću te čekati. Mene zovu moja polja, mene zovu tambure, prije nego sklopim oči, da još jednom vidim sve. Ne dirajte mi večeras, uspomenu u meni, ne dirajte mi ravnicu, jer ja ću se vratiti."
