,Song_ID,Song,Lyrics
77,+WaQ+Bqb_1_77,Vlak,"Stol nase ljubavi, zdjela proljeca i zdjela jeseni uz to, tihim korakom od mene odlazis, ne zelim vjerovat' u to da si me sit. Nit o nit se zaplice, zlatna zora osvice, prva zora bez tebe, u dubok ponor ponirem, al' mu se odupirem, za suze nema potrebe. Mi smo se vec rastali, sapucu zemlja, voda, vatra i zrak, mi smo se vec rastali, samo jos cekamo na to da krene vlak. Sve ovo vrijeme s tobom zvacu ljubavlju, pamtit snijegove i svaku pahulju, da znas, one rijeci snene, neizgovorene, zauvijek presutjet cu"
78,+WaQ+Bqb_1_78,"Volim te, volim","Zauvijek promijenjena. Tu razum ništa ne može. Za tobom je otišlo sve. Tu pustila sam korijenje. I gdje da bježim?. Koraci moji slabi su. Ja više nigdje ne stižem. I gdje da kucam?. Kad padam sve niže bez tebe. . Volim te, volim, al' se borim. Dok ja lutam, ti tu stojiš. A znaš da ne znam predat se lako. I sve me tvoje do kosti taklo. Sada kad padam i kruni me tuga. Tu si kraj mene ko' najljepša duga. Ne daš me nikom, čuvaš od svijeta. Ova je ljubav od Boga, sveta, zauvijek. A gdje da bježim?. Koraci moji slabi su. Ja više nigdje ne stižem. Gdje da kucam?. Kad padam sve niže bez tebe. "
79,+WaQ+Bqb_1_79,Vrati me,"Nije slučajno, evo opet ti. Ma ti to namjerno. Samo da meni kradeš mir. Možda već predugo. Tamo gdje ne idemo. Život čeka na nas. A mi to ne znamo. Vrati me u one dane. Nek još jednom srce stane. Od previše ljubavi. Vrati sjaj u oči moje. Kunem se u ime svoje. Da ću te zauvijek voljeti. Ma reci iskreno. Reci što bi ti. Il ti je dovoljno. Samo da meni kradeš mir. Možda već predugo. Tamo gdje ne idemo. Život čeka na nas. A mi to ne znamo. Vrati me u one dane. Nek još jednom srce stane. Od previše ljubavi. Vrati sjaj u oči moje. Kunem se u ime svoje. Da ću te zauvijek voljeti. Jer od nas nema dalje. Ma samo neka traje, traje. Nek i zvijezde oku male. Vide što je to ljubav. Vrati me u one dane. Nek još jednom srce stane. Od previše ljubavi. Ma vrati sjaj u oči moje. Kunem se u ime svoje. Da ću te zauvijek voljeti. Vrati me u one dane. Nek još jednom srce stane. Od previše ljubavi. Vrati sjaj u oči moje. Kunem se u ime svoje. Da ću te zauvijek voljeti"
80,+WaQ+Bqb_1_80,Za dobre i loše dane,"Kada sve, k'o za inat krene po zlu, dignem glavu visoko, najviše, k'o da su najljepše pjesme za mene pjevane. Ne dam se, stisnem zube k'o da je sva, snaga svijeta u mojim rukama, od srca smijem se kad je najteže. Jer ja se gorih ne bojim, još mogu svjetove lomiti, i sve dok postojim, još mogu ponovo krenuti. Tu u meni još ima snage za sve, dobre i loše dane, je, dok ima još imalo nade, ja ću vjerovati. Tu u meni još ima snage za sve, dobre i loše dane, je, dok ima još imalo nade ja ću vjerovati, da sreća postoji. Bila sam sasvim sama, bez ikoga svog, na mojoj strani tek pošteno srce i Bog, jedini prijatelj u životu mom. Sada znam, da je dovoljno bilo i to, što je vrijedilo tu je i ostalo, drugi su bili tek lažna utjeha. Al' ja se gorih ne bojim, još mogu svjetove slomiti, i sve dok postojim, još mogu ponovo krenuti. Tu u meni još ima snage za sve, dobre i loše dane, je, dok ima još imalo nade, ja ću vjerovati. Tu u meni još ima snage za sve, dobre i loše dane, je, dok ima još imalo nade ja ću vjerovati, da sreća postoji"
81,+WaQ+Bqb_1_81,Zbog tebe živim,"Postaje sve sad jasno, dolazim znam prekasno, srce se odavno predalo. Dolazim praznih ruku, tisine me uvijek svuku, zato, molim te, da kazes mi sve. Ako ovo kraj je, reci, predajem se, al' prije nego odes, jos ti priznajem da). Ja jos uvijek zivim, samo da dozivim, dan u kojem te, vise ne krivim. Ja jos uvijek zivim, samo da dozivim, dan u kojem te, vise ja ne volim. A gdje je tu ljubav. Ljubav je dar za druge, u nama ostaju bol i tuge, sada znam da kriv si mi za sve. Osjecam bit' ce bolje, al' ne daju ruke tvoje, da me neke druge zagrle. Ako ovo kraj je, reci, predajem se, al' prije nego odes, jos ti priznajem da. "
82,+WaQ+Bqb_1_82,Znam te ja,"U tom beskraju tvojih slatkih lazi, koje slabe moje moci da ti kazem nemoj, sve si srusio i ranio mi srce. U njemu vise nema mene, u njemu ti si heroj, dok ljubis me ti vec nisi sa mnom, al' slaba sam i na sve pristajem. Znam te ja, sto dotaknes, ti slomis po pola, znam te ja, al' uzmi, kad je tvoje do kraja. Znam te ja, nek ova noc, malo priceka, znam ja sve, al' vjecno bih, sa tobom ostala. U tom treptaju koji zivot znaci, koji nosi tople noci kao miris juga, ja sam ostala zarobljena tobom. Spremna da ti budem cak i ona druga. Jer ne znam bez tebe da zivim. Ostavi mi barem cekanje"
