Unnamed: 0,Song_ID,Artist,Artist_diskografija,Song_tekstovinet,Views_tekstovinet,Lyrics_tekstovinet,Url_tekstovinet,Writer_lyricstranslate,Song_lyricstranslate,EngTitle_lyricstranslate,Album_lyricstranslate,Lyrics_lyricstranslate,EngLyrics_lyricstranslate,Url_lyricstranslate,Izvedba_diskografija,Url_diskografija,Song_diskografija,Skladba_diskografija,Stihovi_diskografija,Aranžman_diskografija,Album_1_diskografija,Album_2_diskografija,Album_3_diskografija,Album_4_diskografija,Album_5_diskografija,Album_6_diskografija,Lyrics_cuspajz,Song_cuspajz,Url_cuspajz,Artist_discogs,Song_discogs,Song_duration_discogs,Album_title_discogs,Lyrics By_discogs,Album_year_discogs,Music By_discogs,Featuring_discogs,All_albums_discogs
0,LC92qBcX_1_0,Vlado Kalember,Vlado Kalember,"Adio, bambina",5537,"Stare su to price, jedna drugoj slice
more, ja i ti
bilo je tu vina, pjesme, mandolina
bilo je tu ljubavi

Poljupci od soli, kad se ludo voli
slatki su ko med
evo, ide zima i ostra klima
adio ti, sinjorina
 
Ref. 2x
Adio, bambina, cao, cao, bela
dao sam ti dusu, dao sam ti srce
dao sam ti sto si htjela

Dolje pokraj mora, ispod starog bora 
raste ruzmarin
tebi sam ga brao, tebi sam ga dao
da te poljubim

Ljeto puno daje, ali kratko traje
laste odlaze
evo, ide zima i ostra klima
adio ti, sinjorina

Ref. 3x","https://tekstovi.net/2,642,26329.html",,"Adio, Bambina",,,"Stare su to price, jedna drugoj slice. more, ja i ti. bilo je tu vina, pjesme, mandolina. bilo je tu ljubavi. Poljupci od soli, kad se ludo voli. slatki su ko med. evo, ide zima i ostra klima. adio ti, sinjorina. Ref. 2x. Adio, bambina, cao, cao, bela. dao sam ti dusu, dao sam ti srce. dao sam ti sto si htjela. Dolje pokraj mora, ispod starog bora. raste ruzmarin. tebi sam ga brao, tebi sam ga dao. da te poljubim. Ljeto puno daje, ali kratko traje. laste odlaze. evo, ide zima i ostra klima. adio ti, sinjorina. Ref. 3x",,https://lyricstranslate.com/en/vlado-kalember-adio-bambina-lyrics.html,['Vlado Kalember'],https://diskografija.com/pjesma/adio-bambina-14095.htm,Adio bambina,,,,,,,,,,"Stare su to price, jedna drugoj slice
More, ja i ti
Bilo je tu vina, pjesme, mandolina
Bilo je tu ljubavi

Poljupci od soli, kad se ludo voli
Slatki su ko med
Evo, ide zima i ostra klima
Adio ti, sinjorina

Adio, bambina, cao, cao, bela
Dao sam ti dusu, dao sam ti srce
Dao sam ti sto si htjela

Dolje pokraj mora, ispod starog bora
Raste ruzmarin
Tebi sam ga brao, tebi sam ga dao
Da te poljubim

Ljeto puno daje, ali kratko traje
Laste odlaze
Evo, ide zima i ostra klima
Adio ti, sinjorina
","Adio, bambina",https://cuspajz.com//tekstovi-pjesama/pjesma/vlado-kalember/adio-bambina.html,Vlado Kalember,Adio Bambina,3:00,Rano Mi Je Zaspati,,,,,nan-Rano Mi Je Zaspati/2002.0-Največji Hiti
1,LC92qBcX_1_1,Vlado Kalember,Vlado Kalember,Cesto mi u noci dolazis pred oci,9634,"Sjecas li se onih toplih ljetnih veceri
uz gitaru pored mora kad smo pjevali
gdje su stari prijatelji, smijeh i zezanja
onaj slatki okus tvojeg prvog poljupca

Ostali smo poslije sami svi su otisli
i u pijesku tada smo se dugo voljeli
kazu mi da zivis sretna pored drugog ti
sjeti li te stara pjesma nase ljubavi, nase ljubavi
 
Ref.
Cesto mi u noci dolazis pred oci
kao kazna od Boga
cesto mi u noci dolazis pred oci
a znam da si kraj drugoga

Da sam znao da cu tako zalit za tobom
ja se ne bi vjeruj mi niti okrenuo za njom
kazu mi da zivis sretna pored drugog ti
sjeti li te stara pjesma nase ljubavi, nase ljubavi

Ref.

Ref.

Sjecas li se onih toplih ljetnih veceri
uz gitaru pored mora kad smo pjevali ","https://tekstovi.net/2,642,18114.html",,Često mi u noći dolaziš pred oči,Часто ты приходишь ночью пред мои очи,,"Sjećaš li se onih toplih ljetnih večeri
uz gitaru pored mora kad smo pjevali?
Gdje su stari prijatelji, smijeh i zezanja
onaj slatki okus tvojeg prvog poljupca?. Ostali smo poslije sami, svi su otišli
i u pijesku tada smo se dugo voljeli
kažu mi da živiš sretna pored drugog ti
Sjeti li te stara pjesma naše ljubavi, naše ljubavi?. [Refren]
Često mi u noći dolaziš pred oči
kao kazna od Boga
često mi u noći dolaziš pred oči,
a znam da si kraj drugoga. Da sam znao da ću tako žalit za tobom
ja se ne bih, vjeruj mi, niti okrenuo za njom
kažu mi da živiš sretna pored drugog ti
Sjeti li te stara pjesma naše ljubavi, naše ljubavi?. [Refren]. Sjećaš li se onih toplih ljetnih večeri
uz gitaru pored mora kad smo pjevali?","Помнишь ли те тёплые летние вечера,
Когда мы пели под гитару у моря?
Где старые друзья, смех и шутки,
И этот сладкий вкус твоего первого поцелуя.. Остались мы после одни, а все ушли,
И на песке мы долго любили друг друга.
Говорят, что ты живёшь счастливо с другим;
Напоминает ли тебе старая песня о нашей любви, о нашей любви?. ПРИПЕВ:
Часто ты приходишь ночью пред мои очи
Как Божье наказание;
Часто ты приходишь ночью пред мои очи,
А знаю, что ты возле другого.. Если б знал, что я о тебе так пожалею,
Я даже не обернулся бы за ней, поверь.
Говорят, что ты живёшь счастливо с другим;
Напоминает ли тебе старая песня о нашей любви, о нашей любви?. (Припев:). (Припев:). Помнишь ли те тёплые летние вечера,
Когда мы пели под гитару у моря?",https://lyricstranslate.com/en/%C4%8Desto-mi-u-no%C4%87i-dolazi%C5%A1-pred-o%C4%8Di-%D1%87%D0%B0%D1%81%D1%82%D0%BE-%D1%82%D1%8B-%D0%BF%D1%80%D0%B8%D1%85%D0%BE%D0%B4%D0%B8%D1%88.html,['Vlado Kalember'],https://diskografija.com/pjesma/cesto-mi-u-noci-dolazis-pred-oci-7010.htm,Često mi u noći dolaziš pred oči,,,,,,,,,,"Sjećeš li se onih toplih ljetnih večeri
Uz gitaru pored mora kad smo pjevali
Gdje su stari prijatelji, smijeh i zezanja
Onaj slatki okus tvojeg prvog poljupca

Ostali smo poslije sami svi su otišli
I u pijesku tada smo se dugo voljeli
Kažu mi da živiš sretna pored drugog ti
Sjeti li te stara pjesma naše ljubavi, naše ljubavi

Često mi u noći dolaziš pred oči
Kao kazna od Boga
Često mi u noći dolaziš pred oči
A znam da si kraj drugoga

Da sam znao da ću tako žalit' za tobom
Ja se ne bih, vjeruj mi, niti okrenuo za njom
Kažu mi da živiš sretna pored drugog ti
Sjeti li te stara pjesma naše ljubavi, naše ljubavi

Sjećeš li se onih toplih ljetnih večeri
Uz gitaru pored mora kad smo pjevali ",Često mi u noći dolaziš pred oči,https://cuspajz.com//tekstovi-pjesama/pjesma/vlado-kalember/cesto-mi-u-noci-dolazis-pred-oci.html,Vlado Kalember,Često Mi U Noći Dolaziš Pred Oči,3:29,Ponoć Otkucava,,,,,nan-Ponoć Otkucava
2,LC92qBcX_1_2,Vlado Kalember,Vlado Kalember,Ciao amore (feat. Izolda Barudzija),1103,"Sjecas li se, te je noci pao snijeg
stajali smo na peronu ti i ja
drzao si me za ruku
dirao si moju kosu i cutao

S prvim vozom morala si poci, znam
u ocima tvojim vidio sam strah
saptala si moje ime
drhtala si sva od zime i plakala
 
Ref.
Ciao amore, ciao ljubavi
ciao amore, ciao i pisi mi
idi brzo, ne okreci se
nista vise nije vazno, ne
tvoje oci govore mi sve
samo me poljubi, ciao amore

Sjecas li se, te je noci pao snijeg
stajali smo na peronu ti i ja
saptala si moje ime
drhtala si sva od zime i plakala

Ref.

Ciao amore, ciao ljubavi
ciao amore, ciao i pisi mi","https://tekstovi.net/2,642,61093.html",,,,,,,https://lyricstranslate.com/en/language/english-artists,,,,,,,,,,,,,,,,Vlado Kalember,Ciao Amore (English Version),,Ciao Amore,,,,,nan-Ciao Amore
3,LC92qBcX_1_3,Vlado Kalember,Vlado Kalember,Cija si u dusi,8597,"Cija si, cija, u dusi
koga skrivas u srcu
i sanjas u snovima
cija si, cija, u dusi
koga skrivas od mene
nocas u grudima
 
Ref.
Gorke suze, gorko vino
toliko ih zbog nje proli
gorke suze, gorko vino
a u dusi jos me boli

Cija si, cija, u dusi
pozeli bar jednom
isto sto zelim i ja
cija si, cija, u dusi
kad se probudis
priznaj mi koga si sanjala

Ref.","https://tekstovi.net/2,642,14220.html",,Čija si u duši?,Whose are you in your soul,,"Čija si, čija, u duši?
Koga skrivaš u srcu
i sanjaš u snovima?
Čija si, čija, u duši?
Koga skrivaš od mene
noćas u grudima?. [Refren]
Gorke suze, gorko vino
toliko ih zbog nje proli
gorke suze, gorko vino
a u duši još me boli. Čija si, čija, u duši?
Poželi bar jednom
isto što želim i ja
Čija si, čija, u duši?
Kad se probudiš,
priznaj mi koga si sanjala. [Refren]","Whose are you, who's, in your soul
Who are you hiding in your heart
And dream about
Whose are you, who's, in your soul
Who are you hiding from me
Tonight in your chest. Chorus
Bitter tears, bitter wine
I spilled so much because of her
Bitter tears, bitter wine
But my soul still hurts. Whose are you, whose, in your soul
Just for once wish
The same i'm wishing
Whose are you, whose, in your soul
When you wake up
Admit to me who you dreamed of",https://lyricstranslate.com/en/cija-si-u-dusi-whos-are-you-your-soul.html,['Vlado Kalember'],https://diskografija.com/pjesma/cija-si-u-dusi-11016.htm,Čija si u duši,,,,,,,,,,"Čija si, čija, u duši
Koga skrivaš u srcu
I sanjaš u snovima
Čija si, čija, u duši
Koga skrivaš od mene
Noćas u grudima

Gorke suze, gorko vino
Toliko ih zbog nje proli
Gorke suze, gorko vino
A u duši još me boli

Čija si, čija, u duši
Poželi bar jednom
Isto što želim i ja
Čija si, čija, u duši
Kad se probudiš
Priznaj mi koga si sanjala",Čija si u duši,https://cuspajz.com//tekstovi-pjesama/pjesma/vlado-kalember/cija-si-u-dusi.html,Vlado Kalember,Čija Si U Duši,3:30,Čija Si U Duši,,,,,nan-Čija Si U Duši/2008.0-Zlatna Kolekcija/2013.0-Najljepše Ljubavne Pjesme/nan-The Best Of Collection
4,LC92qBcX_1_4,Vlado Kalember,Vlado Kalember,Crni biseru,1591,"Mjesec je te noci puk'o na pola
zmirkaju zvijezde k'o oci lopova
dolje u tami potonuo je grad
kad cemo, duso, ako ne sad
znat cemo samo ja i ti sto smo radili

Bozic je, ide i Nova godina
vrijeme je kad svatko svakog dariva
radio svira k'o barski orkestar
nek' idu k vragu sat i kalendar
znat cemo samo ja i ti sto smo radili
 
Ref. 2x
Crni biseru
to zbog tebe ove noci
sume pjevaju

Ref. 4x","https://tekstovi.net/2,642,48269.html",,Crni Biseru,,,"Mjesec je te noći puk'o na pola
žmirkaju zvijezde k'o oči lopova
dolje u tami potonuo je grad
kad ćemo, dušo, ako ne sad
znat ćemo samo ja i ti što smo radili. Božić je, ide i Nova godina
vrijeme je kad svatko svakog dariva
radio svira k'o barski orkestar
nek' idu k vragu sat i kalendar
znat ćemo samo ja i ti što smo radili. Ref. 2x
Crni biseru
to zbog tebe ove noći
šume pjevaju. Ref. 4x",,https://lyricstranslate.com/en/vlado-kalember-crni-biseru-lyrics.html,['Vlado Kalember'],https://diskografija.com/pjesma/crni-biseru-14079.htm,Crni biseru,,,,,,,,,,,,,Vlado Kalember,Crni Biseru,4:30,"Pjevaj, Raduj Se",,1996.0,,,"1996.0-Pjevaj, Raduj Se/0.0-Pjevaj, Raduj Se "
5,LC92qBcX_1_5,Vlado Kalember,Vlado Kalember,Da li uz njega sjetis se svega,8179,"Ponekad upalim radio
zazmirim i odem do tebe
do dobro znanog dvorista 
po stazi crvenih cigana
tamo gdje si me cekala

Ponekad u prazno se zagledam
zamislim da ti si kraj mene
jos imas staro prezime
osmjeh na licu i jamice
i one oci sanjive
 
Ref.
Da li uz njega sjetis se svega
pozelis nekad da nadjes me
godine dodju mahnu pa prodju
sto su mi dalje sve mi je teze bez njih

Ponekad slike se javljaju 
dolaze kao u polusnu i ti si opet tu
sa mnom kraj rijeke u sutonu
sa istom ceznjom u pogledu

Ref. 2x","https://tekstovi.net/2,642,15203.html",,Da li uz njega sjetiš se svega,А ты рядом с ним помнишь ли всё?,,"Ponekad upalim radio
zažmirim i odem do tebe
do dobro znanog dvorišta
po stazi od crvenih cigala
tamo gdje si me čekala. Ponekad u prazno se zagledam
zamislim da ti si kraj mene
još imaš staro prezime
osmijeh na licu i jamice
i one oči sanjive. [Refren]
Da li uz njega sjetiš se svega
poželiš nekad da nađeš me
godine dođu, mahnu pa prođu
što su mi dalje, sve mi je teže bez njih. Ponekad slike se javljaju
dolaze kao u polusnu i ti si opet tu
sa mnom kraj rijeke u sutonu
sa istom čežnjom u pogledu. [Refren]","Иногда я включу радио,
Зажмурюсь и пойду к тебе
В хорошо знакомый двор
По тропе от красных цыган
Туда, где ты меня ждала.. Иногда я в пустоту засмотрюсь,
Представив, что ты рядом со мной.
Что у тебя ещё старая фамилия,
Улыбка и ямочки на лице,
И те же очи мечтательные.. ПРИПЕВ:
А ты рядом с ним помнишь ли всё;
И захочешь ли когда-то встретить меня?
Годы приходят, махнут рукой и уходят,
Чем дальше, тем мне всё труднее без них.. Иногда картины появляются,
Приходя как в полусне, и ты опять тут;
Со мной у реки в сумерках
С тем же желанием во взгляде.. (Припев:) 2х",https://lyricstranslate.com/en/da-li-uz-njega-sjetis-se-svega-%D0%B0-%D1%82%D1%8B-%D1%80%D1%8F%D0%B4%D0%BE%D0%BC-%D0%BD%D0%B8%D0%BC-%D0%BF%D0%BE%D0%BC%D0%BD.html,['Vlado Kalember'],https://diskografija.com/pjesma/da-li-uz-njega-sjetis-se-svega-7012.htm,Da li uz njega sjetiš se svega,,,,,,,,,,"Ponekad upalim radio
Zažmirim i odem do tebe
Do dobro znanog dvorišta
Po stazi crvenih cigana
Tamo gdje si me čekala

Ponekad u prazno se zagledam
Zamislim da ti si kraj mene
Još imaš staro prezime
Osmijeh na licu i jamice
I one oči sanjive

Da li uz njega sjetiš se svega
Poželiš nekad da nađeš me
Godine dođu, mahnu pa prođu
Što su mi dalje, sve mi je teže bez njih

Ponekad slike se javljaju
Dolaze kao u polusnu i ti si opet tu
Sa mnom kraj rijeke u sutonu
Sa istom čežnjom u pogledu",Da li uz njega sjetiš se svega,https://cuspajz.com//tekstovi-pjesama/pjesma/vlado-kalember/da-li-uz-njega-sjetis-se-svega.html,Vlado Kalember,Da Li Uz Njega Sjetiš Se Svega,3:35,Ponoć Otkucava,,,,,nan-Ponoć Otkucava
6,LC92qBcX_1_6,Vlado Kalember,Vlado Kalember,Da se ja pitam,7524,"Da se ja pitam u zivotu tvom
znaj, plakala ne bi u narucju mom
da se ja pitam bar u tvome snu
k'o dijete bi sanjala na mom jastuku

Ref.
Vjetrovi hladni ove zime
pricajte vi u moje ime
zbog nje se moja dusa skita
drukcije bilo bi sve, drukcije bilo bi sve
da se ja pitam
 
Da se ja pitam u zivotu tvom
znaj, plakala ne bi u narucju mom
da se ja pitam bar u tvome snu
k'o dijete bi sanjala na mom jastuku

Ref. 2x","https://tekstovi.net/2,642,21286.html",,Da Se Ja Pitam,,,"Da se ja pitam u životu tvom
znaj, plakala ne bi u naručju mom
da se ja pitam bar u tvome snu
k'o dijete bi sanjala na mom jastuku. Ref.
Vjetrovi hladni ove zime
pričajte vi u moje ime
zbog nje se moja duša skita
drukčije bilo bi sve, drukčije bilo bi sve
da se ja pitam. Da se ja pitam u životu tvom
znaj, plakala ne bi u naručju mom
da se ja pitam bar u tvome snu
k'o dijete bi sanjala na mom jastuku. Ref. 2x",,https://lyricstranslate.com/en/vlado-kalember-da-se-ja-pitam-lyrics.html,['Vlado Kalember'],https://diskografija.com/pjesma/da-se-ja-pitam-11017.htm,Da se ja pitam,,,,,,,,,,"Da se ja pitam u zivotu tvom
Znaj, plakala ne bi u narucju mom
Da se ja pitam bar u tvome snu
K'o dijete bi sanjala na mom jastuku

Vjetrovi hladni ove zime
Pricajte vi u moje ime
Zbog nje se moja dusa skita
Drukcije bilo bi sve, drukcije bilo bi sve
Da se ja pitam

Da se ja pitam u zivotu tvom
Znaj, plakala ne bi u narucju mom
Da se ja pitam bar u tvome snu
K'o dijete bi sanjala na mom jastuku",Da se ja pitam,https://cuspajz.com//tekstovi-pjesama/pjesma/vlado-kalember/da-se-ja-pitam.html,Vlado Kalember,Da Se Ja Pitam,4:12,Čija Si U Duši,,,,,nan-Čija Si U Duši/nan-Sve Najbolje/2008.0-Zlatna Kolekcija/2013.0-Najljepše Ljubavne Pjesme
7,LC92qBcX_1_7,Vlado Kalember,Vlado Kalember,Djecak je tuzan i sam,8291,"Djecak je tuzan i sam
ulica njegov je stan
sam je na svijetu tom
sam je u dvoru svom
djecak je tuzan i sam

Ref. 2x
I place on svake noci
i place on kad je zima
jer mama nikad nece doci
da cuva svoga sina
 
Teret vec nosi on sam
nosi a tako je mlad
ponekad trazi gros
htio bi jesti jos
djecak je tuzan i sam

Ref. 2x","https://tekstovi.net/2,642,19170.html",,Djecak Je Tuzan I Sam,,,"Dječak je tužan i sam
ulica njegov je stan
sam je na svijetu tom
sam je u dvoru svom
dječak je tužan i sam. Ref. 2x
I plače on svake noći
i plače on kad je zima
jer mama nikad neće doći
da čuva svoga sina. Teret već nosi on sam
nosi a tako je mlad
ponekad traži groš
htio bi jesti još
dječak je tužan i sam. Ref. 2x",,https://lyricstranslate.com/en/vlado-kalember-djecak-je-tuzan-i-sam-lyrics.html,['Vlado Kalember'],https://diskografija.com/pjesma/djecak-je-tuzan-i-sam-11018.htm,Dječak je tužan i sam,,,,,,,,,,"Dječak je tužan i sam
Ulica njegov je stan
Sam je na svijetu tom
Sam je u dvoru svom
Dječak je tužan i sam

I plače on svake noći
I plače on kad je zima
Jer mama nikad neće doći
Da čuva svoga sina

Teret već nosi on sam
Nosi, a tako je mlad
Ponekad traži groš
Htio bi jesti još
Dječak je tužan i sam
",Dječak je tužan i sam,https://cuspajz.com//tekstovi-pjesama/pjesma/vlado-kalember/djecak-je-tuzan-i-sam.html,Vlado Kalember,Dječak Je Tužan I Sam,2:40,Čija Si U Duši,Đorđe Novković,,,,nan-Čija Si U Duši/2008.0-Zlatna Kolekcija
8,LC92qBcX_1_8,Vlado Kalember,Vlado Kalember,Dobrodosla ljubavi,8847,"Noc je tamo, noc je ovdje
ja te ljubim satima
tvoje ruke pletu mreze
ti si san bez povratka

Kao srna, kao dijete
njezna si i plasljiva
tvoje price, igre sjene
ti si ponor beskraja
 
Ref. 2x
Dobrodosla ljubavi
dobrodosla radosti
neka stanu vjetrovi
dobrodosla ljubavi
stizu snjegovi

Kao srna, kao dijete
njezna si i plasljiva
tvoje price, igre sjene
ti si ponor beskraja

Ref. 4x","https://tekstovi.net/2,642,21287.html",,Dobrodosla Ljubavi,,,"Noć je tamo, noć je ovdje
ja te ljubim satima
tvoje ruke pletu mreže
ti si san bez povratka. Kao srna, kao dijete
nježna si i plašljiva
tvoje priče, igre sjene
ti si ponor beskraja. Ref. 2x
Dobrodošla ljubavi
dobrodošla radosti
neka stanu vjetrovi
dobrodošla ljubavi
stižu snjegovi. Kao srna, kao dijete
nježna si i plašljiva
tvoje priče, igre sjene
ti si ponor beskraja. Ref. 4x",,https://lyricstranslate.com/en/vlado-kalember-dobrodosla-ljubavi-lyrics.html,,,,,,,,,,,,,"Doć će dan, doć će ovdje
Ja te ljubim satima
Tvoje ruke pletu mreže
Ti si san bez povratka

Kao srna, kao dijete
Nježna si i plašljiva
Tvoje priče igra sjene
Ti si ponor bez kraja

Dobra došla ljubavi
Dobra došla radosti
Neka stanu vjetrovi
Dobra došla ljubavi
Stižu snijegovi, stižu snijegovi

Kao srna, kao dijete
Nježna si i plašljiva
Tvoje priče igra sjene
Ti si ponor bez kraja",Dobro došla ljubavi,https://cuspajz.com//tekstovi-pjesama/pjesma/vlado-kalember/dobro-dosla-ljubavi.html,Vlado Kalember,Dobro Došla Ljubavi,3:54,Vino Na Usnama,,,,,nan-Vino Na Usnama/nan-Sve Najbolje/2013.0-Najljepše Ljubavne Pjesme/nan-The Best Of Collection
9,LC92qBcX_1_9,Vlado Kalember,Vlado Kalember,Duge su noci bez tebe,9487,"Ako ti me ne volis
ne pitaj me sto cu sam
bit ce tuzna godina
za mene predosjecam

Ako ti si sve sto znam
ja ne zelim drugo znat
zagrlit cu sjecanje
od sebe te necu dat
 
Ref.
Duge, duge su noci bez tebe
nema, jer tebe nema kraj mene
duge, duge su kao citav vijek
najduze su minute kad tvoje usne sute
za mene zauvijek

Ako ti si sve sto znam
ja ne zelim drugo znat
zagrlit cu sjecanje
od sebe te necu dat

Ref. 3x","https://tekstovi.net/2,642,20032.html",,Duge su noći bez tebe,,,"Ako ti me ne voliš
ne pitaj me što ću sam
bit će tužna godina za mene,
predosjećam. Ako ti si sve što znam
ja ne želim drugo znat
zagrlit ću sjećanje
od sebe te neću dat. [Refren]
Duge, duge su noći bez tebe
nema, jer tebe nema kraj mene
duge, duge su kao čitav vijek
najduže su minute kad tvoje usne šute
za mene zauvijek. Ako ti si sve što znam
ja ne želim drugo znat
zagrlit ću sjećanje
od sebe te neću dat. [Refren]",,https://lyricstranslate.com/en/vlado-kalember-duge-su-noci-bez-tebe-lyrics.html,['Vlado Kalember'],https://diskografija.com/pjesma/duge-su-noci-bez-tebe-4269.htm,Duge su noći bez tebe,['Vlado Kalember'],['Željko Pavičić'],"['Rajko Dujmić', 'Vlado Kalember']","2004 - Nakon svih ovih godina - 4 asa
Aranžman: Rajko Dujmić / Vlado Kalember / Alen Islamović / Jurica Pađen",2004 - Volim te do neba,,,,,"Ako ti me ne voliš
Ne pitaj me što ću sam
Bit ce tužna godina
Za mene, predosjećam

Ako ti si sve što znam
Ja ne želim drugo znat'
Zagrlit ću sjećanje
Od sebe te neću dat'

Duge, duge su noći bez tebe
Nema, jer tebe nema kraj mene
Duge, duge su kao čitav vijek
Najduže su minute kad tvoje usne šute
Za mene zauvijek

Ako ti si sve što znam
Ja ne želim drugo znat'
Zagrlit' ću sjećanje
Od sebe te neću dat'",Duge su noći bez tebe,https://cuspajz.com//tekstovi-pjesama/pjesma/vlado-kalember/duge-su-noci-bez-tebe.html,Vlado Kalember,Duge Su Noći Bez Tebe,,Volim Te Do Neba,,2004.0,,,2004.0-Volim Te Do Neba
10,LC92qBcX_1_10,Vlado Kalember,Vlado Kalember,Dunje zute,6842,"Evo opet nase pjesme
evo nevolje
slomit ce mi ove noci
srce na dvoje

Ti bi da se pomirimo
e pa ne moze
s njim si bila, s njim i budi
to je najbolje
 
Ref. 2x
Ej, dunje zute
ruzmarin ce na kapute
svadbe krecu
samo ja na tvoju ruku
prsten stavit necu

E sto mogu neke rijeci
da me pogode
kad mi kazes poslije svega
da ti znacim sve

Nije tebe bilo briga
kad si otisla
nit' je mene sto bi mi se
sada vratila

Ref. 2x

Ref. 2x","https://tekstovi.net/2,642,21288.html",,Dunje Žute,,,"Evo opet naše pjesme
evo nevolje
slomit će mi ove noći
srce na dvoje. Ti bi da se pomirimo
e pa ne može
s njim si bila, s njim i budi
to je najbolje. Ref. 2x
Ej, dunje žute
ružmarin će na kapute
svadbe kreću
samo ja na tvoju ruku
prsten stavit neću. E što mogu neke riječi
da me pogode
kad mi kažeš poslije svega
da ti značim sve. Nije tebe bilo briga
kad si otišla
nit' je mene što bi mi se
sada vratila. Ref. 2x. Ref. 2x",,https://lyricstranslate.com/en/vlado-kalember-dunje-zute-lyrics.html,['Vlado Kalember'],https://diskografija.com/pjesma/dunje-zute-7014.htm,Dunje žute,,,,,,,,,,"Evo opet naše pjesme
Evo nevolje
Slomit će mi ove noći
Srce na dvoje

Ti bi da se pomirimo
E pa ne može
S njim si bila, s njim i budi
To je najbolje

Ej, dunje žute
Ružmarin će na kapute
Svadbe kreću
Samo ja na tvoju ruku
Prsten stavit' neću

E što mogu neke riječi
Da me pogode
Kad mi kažeš poslije svega
Da ti značim sve

Nije tebe bilo briga
Kad si otišla
Nit' je mene što bi mi se
Sada vratila",Dunje žute,https://cuspajz.com//tekstovi-pjesama/pjesma/vlado-kalember/dunje-zute.html,Vlado Kalember,Dunje Žute,3:12,Ponoć Otkucava,,,,,nan-Ponoć Otkucava
