Unnamed: 0,Song_ID,Artist,Artist_diskografija,Song_tekstovinet,Views_tekstovinet,Lyrics_tekstovinet,Url_tekstovinet,Writer_lyricstranslate,Song_lyricstranslate,EngTitle_lyricstranslate,Album_lyricstranslate,Lyrics_lyricstranslate,EngLyrics_lyricstranslate,Url_lyricstranslate,Izvedba_diskografija,Album_1_diskografija,Album_2_diskografija,Url_diskografija,Song_diskografija,Aranžman_diskografija,Skladba_diskografija,Stihovi_diskografija,Album_3_diskografija,Album_4_diskografija,Lyrics_cuspajz,Song_cuspajz,Url_cuspajz,Artist_discogs,Song_discogs,Song_duration_discogs,Album_title_discogs,Album_year_discogs,Lyrics By_discogs,Music By_discogs,All_albums_discogs
29,TkHYG/uZ_1_29,Zabranjeno Pušenje,Zabranjeno pušenje,Gospoda Brams,1604,"Pokupila je ostatke jela
pogledala dnevnik i rekla - strasno
pogladila po glavi dijete, psa i muza
navika il' ljubav, nije ni vazno

Zadihani muz ja sis'o s njenih grudi
pogled uprt gore, ka plafonu
razmazuje po licu Njemacku kremu
madam Brams pedantna u svemu
 
Danas je imala naporan dan
po prozoru dobuju kisne kapi
oci joj se gase u mocvari sna
madam Brams se sprema da zaspi

I tada u odaje upada on
njen latino-lover iz Vera Cruza
pod prozor je doveo mariache
i gospoda Brams u snu sapce

Povedi me, vodi me odavde
povedi me, por favor
povedi me, vodi me odavde
povedi me, senor﻿","https://tekstovi.net/2,550,56108.html",,,,,,,,,,,,,,,,,,,,,Zabranjeno Pušenje,Gospođa Brams,3:41,Dok Čekaš Sabah Sa Šejtanom,,Dr. Nele Karajlić,Sejo Sexon,nan-Dok Čekaš Sabah Sa Šejtanom
30,TkHYG/uZ_1_30,Zabranjeno Pušenje,Zabranjeno pušenje,Gospodja Senada,2995,"Gospodja Senada je vazda nasmijana
ona je psiholog, ona drzi se svog plana
ona je strpljiva, ona iskreno se trudi
da izlijeci moju averziju od ljudi

Ona zna zasto moje misli gore
ona ce me skontat' i dat' mi odgovore
otvaram joj dusu, sva vrata, kapije
ma, 'ko bi rek'o, jaro, sta u glavi stanuje
 
Kaze - moramo se prilagodit', zivot ne stavljat' sa strane
naci svijetlu stranu, pronaci jarane
i borio sam se, gospodjo, ali mrak je bio jaci
pa su mi u glavi crkli svi osiguraci

Ref.
Gospodjo Senada, mrzim fasizam, mrzim ksenofobiju
gospodjo Senada, da se mene pita, sve na robiju
gospodjo Senada, meni licno ovo vrijeme strasno smeta
muka mi je od lazova, mediokriteta

Gospodjo Senada, hronicno sam umoran i svega se bojim
gospodjo Senada, k'o da ovo sanjam, k'o da ne postojim
gospodjo Senada, reci da sam dobro, da nisam u pravu
i mozes li mi mozda popraviti glavu

Gospodja Senada je divna i plemenita zena
mirna, komunikativna, nadasve stalozena
ja odajem joj tajne, prepricavam snove
ona pita za kosmare moje i stare i nove

Ref. 2x","https://tekstovi.net/2,550,57027.html",,,,,,,,,,,,,,,,,,,,,Zabranjeno Pušenje,Gospođa Senada,5:00,Šok I Nevjerica,,,,nan-Šok I Nevjerica
31,TkHYG/uZ_1_31,Zabranjeno Pušenje,Zabranjeno pušenje,Guzonjin sin,71812,"U mojoj ulici ne prodaju se kifle
ne tece saobracaj i dim
u mojoj ulici nema fukare
jer ja sam guzonjin sin

Oko mene rastu cempresi i drot
veceras imam party, a ujutru trim
lijepe zene dolaze kod mene
jer ja sam guzonjin sin
 
Ref. 2x
Ja sam, ja sam guzonjin sin

Jede se kavijar, pije se dzin
ima se para, ima se s' cim
ponekad trava, nikad heroin
jer ja sam guzonjin sin

U skolu me vozi samo auto pravo
sa mnogim sam pjevacicama spav'o
sa sobom nosim svoj mali karabin
jer ja sam guzonjin sin

Ref. 2x

Moja raja me bas ne vole
zavide mi na moje uspjehe
a ja sam svima najbolji
ja sam sa svima fin
jer ja sam guzonjin sin

Ref. 2x

Al' kad me ona zovne
hodi malo 'vamo, ja odmah potrcim
jer macehu ja volim vise nego starog
jer ja sam guzonjin sin

Ref. 2x

Danas sam dobio 
svog novoga Porsea
i malko cu se voziti s' njim
jer ja, ja sam guzonjin sin","https://tekstovi.net/2,550,7005.html",N.karajlić,Guzonjin sin,Son of a rich man,,"U mojoj ulici ne prodaju se kifle,
1
Ne teče saobraćaj i dim,
U mojoj ulici nema fukare,
Jer ja sam guzonjin sin.. Oko mene rastu čempresi i drot,
Večeras imam party a ujutro trim,
Lijepe žene dolaze kod mene,
Jer ja sam guzonjin sin.. Jede se kavijar, pije se džin,
Ima se para, ima se s čim,
Ponekad trava, nikad heroin,
Jer ja sam guzonjin sin.. U školu me vozi samo auto pravo,
Sa mnogim sam pjevačicama spav'o,
Sa sobom nosim svoj mali karabin,
Jer ja sam guzonjin sin.. Moja raja me baš ne vole,
Zavide mi na moje uspjehe,
A ja o svima najbolje, ja sa svima fin,
Jer ja sam guzonjin sin.. A kad me ona zovne ""Hodi malo 'vamo!"",
Ja odmah potrčim,
Jer maćehu ja volim više nego starog,
Jer ja sam guzonjin sin.. Danas sam dobio svog novoga Porschea,
I malko ću se voziti s njim,
Jer ja -
Ja sam guzonjin sin!","They don't sell rolls in my street
There is no traffic and smoke
There aren't any poor people in my street
Because I'm a son of a rich man. Cypress grow around me
Tonight I'm having a party and tomorrow I'm going to trim
Pretty women come to my place
Because I'm a son of a rich man. Only great car takes me to school
I've slept with many pop-stars
I always carry my little carabine
Because I'm a son of a rich man. We eat caviar, we drink gin
We have money, we have the paper
Sometimes weed, but never heroin
Because I'm a son of a rich man. My people don't like me a lot
They are envious because of my successes
And I talk the best about everyone, I'm nice to everyone
Because I'm a son of a rich man. And when she calls me: ""C'mon, get over here!""
I run instantly
Because I love my stepmom more than my dad
Because I'm a son of a rich man. Today I've gotten my new Porsche
And I'm gonna drive it around a little
Because I'm
I'm a son of a rich man!",https://lyricstranslate.com/en/guzonjin-sin-son-rich-man.html,['Zabranjeno pušenje'],,,https://diskografija.com/pjesma/guzonjin-sin-6235.htm,Guzonjin sin,,,,,,"U mojoj ulici ne prodaju se kifle,
Ne teče saobraćaj i dim
U mojoj ulici nema fukare,
Jer ja sam guzonjin sin

Oko mene rastu čempresi i drot,
Večeras imam party, a ujutru trim
Lijepe žene dolaze kod mene,
Jer ja sam guzonjin sin

Jede se kavijar, pije se džin
Ima se para, ima se s čim
Ponekad trava, nikad heroin
Jer ja sam guzonjin sin

U školu me vozi samo auto pravo
Sa mnogim sam pjevačicama spav'o
Sa sobom nosim svoj mali karabin
Jer ja sam guzonjin sin

Moja raja me baš ne vole,
Zavide mi na moje uspjehe
A ja sa svima najbolje, a ja sa svima fin
Jer ja sam guzonjin sin

Jer ja sam

Al' kad me ona zovne ""Hodi malo 'vamo!"",
Ja odma' potrčim
Jer mačehu ja volim više nego starog
Jer ja sam guzonjin sin

Jer ja sam
Ja sam guzonjin sin

Danas sam dobio svog novoga Porshe-a
I malko ću se voziti sa njim

Jer ja
Ja sam guzonjin sin

Guzonjin sin",Guzonjin sin,https://cuspajz.com//tekstovi-pjesama/pjesma/zabranjeno-pusenje/guzonjin-sin.html,Zabranjeno Pušenje,Guzonjin Sin,,Male Priče O Velikoj Ljubavi,,,,"nan-Male Priče O Velikoj Ljubavi/nan-Najveći Hitovi/nan-Na Straži Pored Prizrena/nan-Nikad Robom, Vazda Taksijem - Najveći Hitovi '84.-'89. (The Best Of)/nan-Hapsi Sve!/nan-Kolekcija Hitova Vol. 2/2009.0-The Ultimate Collection/nan-The Best Of"
32,TkHYG/uZ_1_32,Zabranjeno Pušenje,Zabranjeno pušenje,Haile Selasije,4191,"Obuk'o sam bijelu kapicu 
i crveni sal
ucitelj je rek'o 
dolazi nam car

Mnogo ljudi cekalo je
gosta iz daljina
carsijom da prodje crna limuzina
 
Prosao je mirno
gledajuci svjet
uhvativsi tek poneki
dobaceni cvijet

Zbog njega su nene
sebi sjekle vene
zbog njega su raste 
zarasle u kraste

Ref. 2x
Haile Selasije 
car Afrike i Azije
haile, haile 
haile, Selasije

Bio je to divan covjek
omiljen od mase
mudar kao Ghandi
lijep kao Nasser

Od svih nasih prijatelja 
bio je najveci
vodio svoj narod 
k' bogatstvu i sreci

Ref. 3x","https://tekstovi.net/2,550,40977.html",,Hajle Selasije,Haile Selassie,,"Obuko sam bijelu kapicu
1
I crveni šal
Učitelj je rek'o:
""Dolazi nam car!""
Mnogo ljudi čekalo je
Gosta iz daljina
Čaršijom da prođe
Crna limuzina. Prošao je mirno,
Gledajući svijet
Uhvativši tek po neki
Dobačeni cvijet
Zbog njega su nene
Sebi sjekle vene
Zbog njega su raste
Zarasle u kraste. Haile Selasije, car Afrike i Azije
Haile, Haile, Haile Selasije!. Bio je to divan čovjek
Omiljen od mase
Mudar kao Gandhi
I lijep kao Nasser
Od svih naših prijatelja
Bio je najveći
Vodio svoj narod
Bogatstvu i sreći. Haile Selasije, car Afrike i Azije
Haile, Haile, Haile Selasije!","I
I put on a white hat
and red scarf
The teacher said:
""The emperor is coming!""
Many people were waiting
for the guest from the far
a black limo
to pass through the town. He passed by quietly
while watching the people
caught only some of
the flowers thrown at him
girlies cut their wrists
because of him
Because of him ...
turned into scabs. Haile Selassie, the emperor of Africa and Asia
Haile, Haile, Haile Selassie!. It was a wonderful man
loved by the crowd
as wise as Gandhi
as beautiful as Nasser
Compared to all our friends
he was the best
He led his people
towards wealth and happiness. Haile Selassie, the emperor of Africa and Asia
Haile, Haile, Haile Selassie!",https://lyricstranslate.com/en/hajle-selasije-haile-selassie.html,,,,,,,,,,,"Obuko sam bijelu kapicu
I crveni šal
Učitelj je rek'o:
""Dolazi nam car!""
Mnogo ljudi čekalo je
Gosta iz daljina
Čaršijom da prođe
Crna limuzina

Prošao je mirno,
Gledajući svijet
Uhvativši tek po neki
Dobačeni cvijet
Zbog njega su nene
Sebi sjekle vene
Zbog njega su raste
Zarasle u kraste

Haile Selasije, car Afrike i Azije
Haile, Haile, Haile Selasije!

Bio je to divan čovjek
Omiljen od mase
Mudar kao Gandhi
I lijep kao Nasser
Od svih naših prijatelja
Bio je najveći
Vodio svoj narod
Bogatstvu i sreći

Haile Selasije, car Afrike i Azije
Haile, Haile, Haile Selasije!",Haile Selasije,https://cuspajz.com//tekstovi-pjesama/pjesma/zabranjeno-pusenje/haile-selasije.html,Zabranjeno Pušenje,Hajle Selasije,3:56,Fildžan Viška,,Elvis J. Kurtović,Sejo Sexon,nan-Fildžan Viška
33,TkHYG/uZ_1_33,Zabranjeno Pušenje,Zabranjeno pušenje,Halid umjesto Halida,22819,"Come on, come on, come on
come on then

Good evening ladies and gentleman
it's nice to see you again
in Marcus place tonight
 
We should start our program
with the song about Mr. Halid
sad song about folk singer
from Bosnia & Herzegowina

Tamo negdje iza sedam gora
gdje vozi our prigradski saobracaj
u maloj kuci se rodio Halid
na nebu je zvijezda zasjala

Gazda iz kafane Visnja 
rece ljudi ovo je dobar znak
bice pjevac, glumac il' politicar
a mozda i Halid 'mjesto Halida

Skola mu nije isla Bog zna kako
mrzile ga profesorice
al sve je puklo kada je mazno
lovu od ekskurzije

Pos'o je pjevat' u kafani
bilo je gadno, bilo je degeneka
k'o onda kad je pjev'o tamo daleko
kamiondziji iz Citluka, hej

Ref. 2x
Al' sve se nekako predevera
kad imas viziju, imas san
gutu para, koka povazdan
da budes Halid 'mjesto Halida

Menadzer Boro ga je uzeo
pod svoje, koji Boro
u Sarajevo da ploce snimaju
novine su pisale tu nisu cista posla
tu se turske pjesme hapaju

Al' Halidu su rekli da ne pita nista
i da se smije i kad ne konta fol
imace kucu s teniskim terenom
BMW-a kesom placenog, o

Ref. 2x

Dobro je mali, odmori malo
ovdje bi treb'o ici solo
tu se nasa prica prekida 
uglavnom Halid i postade Halid
Halid 'mjesto Halida

Haj opet mali
fala dajdza
a sad opet ja

Al' dobre pjesme dobiv'o je sve rijedje
prestigli ga novi pastuvi brzi
sto im je nekad zvao ture
sto ih je pusto da vire kada guzi, ehe

Stock u ruci, 'mjesto mikrofona
sve rijedje na naslovnim stranama
zenu su mu vidjeli na Stojcevcu
s nekim juniorom Saraj'va

Al' jedno vece se odvez'o u brda
i odozgo gled'o kako svijetli grad
iznad neke male kuce
na nebu je zvijezda zasjala

I k'o da mu se neka velika tezina
s ledja sama skinula
doslo je vrijeme da neko drugi bude
Halid 'mjesto Halida
(2x)

Haj'mo mali, hocemo
opa, hop, ozezi
come on, come, on","https://tekstovi.net/2,550,19296.html",,,,,,,,,,,,,,,,,,,,,Zabranjeno Pušenje,Halid Umjesto Halida,5:23,Fildžan Viška,,,,nan-Fildžan Viška/nan-Hapsi Sve!/2009.0-The Ultimate Collection
34,TkHYG/uZ_1_34,Zabranjeno Pušenje,Zabranjeno pušenje,Hodi da ti ciko nesto da,16705,"Kad ti stari ode i prazan ti je stan
dok pusis tanku travu ""Made in Capljina""
okreces moj broj jer si realna
znas, nocas jedino ti more valjat tvoja stara dzukela

Ref. 4x
Hodi da ti ciko nesto da","https://tekstovi.net/2,550,20869.html",,,,,,,,,,,,,,,,,,,,,Zabranjeno Pušenje,Hodi Da Ti Čiko Nešto Da,,Hodi Da Ti Čiko Nešto Da,,,,nan-Hodi Da Ti Čiko Nešto Da
35,TkHYG/uZ_1_35,Zabranjeno Pušenje,Zabranjeno pušenje,Ibro dirka,50054,"Kunem vam se rahmetom dedinim 
iako se u tu svirku ne razumijem bas
da niko nikad nije znao harmoniku svirat'
kao mali Ibro, Ibro dirkanas

Jer kada pocne dernek i kad on zasvira
ne bi stig'o reci ni Bismilah
vec bi lup'o glavom i lomio bi case
vec bi te Ibro bacio u sevdah
 
Al' ubrzo za Ibru cuse 
ljudi sa estrade
i pocese njuskati po nasoj mahali

Svaki Ibri pice placa
svakih deset prsta Ibrinih hvali
Ibro poce pricati o parama, o slavi
mi ga odgovarasmo, Ibro, ne budali

Ti si nesto drugo
ti harmonikom lijecis bol
na estradi sve je lazno
na estradi sve je fol

Samo da ti kazem nesto za Ibru
dodje Mercedes po njega i on ode
ode u harmonicare i posta popularan
eno ga, isp'o u novinama
 s oba Halida se slik'o
 s Brenom bio, jest, majke mi

Pa on je vuk'o curu nosila 
bedj da joj se zna prednja strana
a sad sve noge do krajnika
Ozrenka, daj nam dvije pive
i reci, Boga ti, muzici malo tise

Samo, nije nesto
ali ne da on da ga se daraci
mislim da ga daracu oni Sinanovci
ogulise ga od njega

Ali nije ni to 
ne daju mu bolan da sevdah svira
ovo kriza, raja traze veselo
ko ce slusat' tudju muku

Ali jednog jutra 
udje Ibro u mahalu sam
isti Gari Kuper
 sve je licilo na san

Na licu mu vise ne bi sjene 
koju tuga pravi
Mahalu sevdah Ibro 
nije mog'o da zaboravi

Ibro nije htio para
Ibro ce vazda bit' fukara
neki odmah pocese da blate Ibrin lik

Ali samo prava raja je znala
u cemu je trik
nije Ibro, jarane nas, fukara
Ibro ti je defakato umjetnik
svacas","https://tekstovi.net/2,550,8194.html",N.karajlić,Ibro dirka,Ibro dirka,Dok čekaš sabah sa šejtanom,"Kunem vam se, rahmetom mi dedinim
Iako se u tu svirku ne razumijem baš
Da ni'ko nikad nije znao
'armoniku svirat'
Kao mali Ibro, Ibro dirka naš. Kada počne dernek i kad on zasvira
Ne bi stigo reči ni bismillah
Već bi lup'o glavom i lomio bi čaše
Već bi te Ibro bacio u sevdah. Al' ubrzo za Ibru čuše ljudi sa estrade
I počeše njuškati po našoj mahali
Svaki Ibri piće plaća
Svaki deset prsta Ibrinih hvali. Ibro poče pričati o parama, o slavi
Mi ga odgovarasmo Ibro ne budali
Ti si nešto drugo
Ti 'armonikom liječiš bol
Na estradi sve je lažno
Na estradi sve je fol. - Samo da ti kažem nešto za Ibru
- Dođe Mercedes po njega i on ode
- Ja, ja
- Ode u 'armoničare i posta popularan
- Eno ga bolan, gledo sam sliku
S oba Halida se sliko
- Ma čuo sam
- Sa Brenom bio
- Ma čo'ece, on je vuko curu
Nosila bedž da joj se zna prednja strana
I sad evo hoda i s ovom i s onom
- Kosjenka, daj nam dvije pive i reci bogati muzici malo tiše
- Znam ja, duševan čovjek, ne da on da ga se daraći, da ga daraću oni
Oni, oni menađžeri
- Oguliše ga
- Bi'l ti dopustio?
- Ali nije ni to, ne daju mu bolan da sevdah svira
- Misliš?
- Sigurno
- Ovo kriza, jel'
- Ja, bolan, raja traže veselo
Tko će slušat tuđu muku.... Al' jedno jutro uđe Ibro u mahalu sam
Isti Gary Cooper sve je ličilo na san
Na licu mu više ne bi sjene koju tuga pravi
Mahalu, sevdah, Ibro nije mog'o da zaboravi. Ibro nije htio para
Ibro će vazda bit' fukara
Neki odma' počeše da blate Ibrin lik
Al' samo prava raja je znala
U čemu je trik. Nije Ibro, jarane, nas fukara
Ibro ti je de fakto umjetnik, svaćaš?","I swear to you, by my dead grandfather,
Eventhough i'm not quite into that thing
That no one has ever knew how to play
the accordion
such as our Ibro Dirka. Once the party started, and once he started to play
He hasn't even got time to say bismillah
He would shake his head and break the glasses
Ibro would bring you into sevdah. But quickly, people from the industry heard about Ibro
And started to snoop around in our hood
Every one of them started to bring Ibro drinks
Every one of them started to compliment Ibro. Ibro started to talk about money and sucess
We told him 'Ibro don't be silly
You're special
You cure people with your music
In the industry everything is fake
Everything is fake'. -'I just have to tell you a bit about Ibro
Once, a mercedes came to pick him up and he left
Yes, yes
He went on with the pro's and became famous
There he is, i saw him on a picture
He took a photo with both Halid's '
-'Yeah, i've heard that,
He was with Brena'
-'Boy, he has the best girls,
One of them wore a badge just so he could know where the front of her body was. And now he has two new ones'
- 'Waiter, give us two beers, and please tell the singer to be a bit more quiet'
-'Yes I know, he's a witty person, he lets everyone play him, everyone, i mean those managers'
-'They used him'
-'Would you let that happen?'
- 'No it's not that, they don't let him play sevdah anymore'
-'You think?'
-'For sure'
-'These are hard times'
-'Yes, man, people are looking for upbeat music,
Who would listen to others problems'. But one morning Ibro came to the neighbourhood alone
He looked like Gary Cooper, everything felt like a dream
There was no sign of sadness left on his face
The neighbourhood, sevdah, Ibro just couldn't forget it. Ibro didn't want the money anymore
Ibro will always remain a bady
Some immediatley stared to blame Ibro
But only the real ones
Knew what really had happend. Ibro isn't a bady, man
Ibro is the meaning of an artist",https://lyricstranslate.com/en/ibro-dirka-ibro-dirka.html,['Zabranjeno pušenje'],,,https://diskografija.com/pjesma/ibro-dirka-6212.htm,Ibro dirka,,,,,,"Kunem vam se, rahmetom mi dedinim
Iako se u tu svirku ne razumijem baš
Da ni'ko nikad nije znao
'armoniku svirat'
Kao mali Ibro, Ibro dirka naš

Kada počne dernek i kad on zasvira
Ne bi stigo reči ni bismillah
Već bi lup'o glavom i lomio bi čaše
Već bi te Ibro bacio u sevdah

Al' ubrzo za Ibru čuše ljudi sa estrade
I počeše njuškati po našoj mahali
Svaki Ibri piće plaća
Svaki deset prsta Ibrinih hvali

Ibro poče pričati o parama, o slavi
Mi ga odgovarasmo Ibro ne budali
Ti si nešto drugo
Ti 'armonikom liječiš bol
Na estradi sve je lažno
Na estradi sve je fol

- Samo da ti kažem nešto za Ibru
- Dođe Mercedes po njega i on ode
- Ja, ja
- Ode u 'armoničare i posta popularan
- Eno ga bolan, gledo sam sliku
S oba Halida se sliko
- Ma čuo sam
- Sa Brenom bio
- Ma čo'ece, on je vuko curu
Nosila bedž da joj se zna prednja strana
I sad evo hoda i s ovom i s onom
- Kosjenka, daj nam dvije pive i reci bogati muzici malo tiše
- Znam ja, duševan čovjek, ne da on da ga se daraći, da ga daraću oni
Oni, oni menađžeri
- Oguliše ga
- Bi'l ti dopustio?
- Ali nije ni to, ne daju mu bolan da sevdah svira
- Misliš?
- Sigurno
- Ovo kriza, jel'
- Ja, bolan, raja traže veselo
Tko će slušat tuđu muku...

Al' jedno jutro uđe Ibro u mahalu sam
Isti Gary Cooper sve je ličilo na san
Na licu mu više ne bi sjene koju tuga pravi
Mahalu, sevdah, Ibro nije mog'o da zaboravi

Ibro nije htio para
Ibro će vazda bit' fukara
Neki odma' počeše da blate Ibrin lik
Al' samo prava raja je znala
U čemu je trik

Nije Ibro, jarane, nas fukara
Ibro ti je de fakto umjetnik, svaćaš?",Ibro dirka,https://cuspajz.com//tekstovi-pjesama/pjesma/zabranjeno-pusenje/ibro-dirka.html,Zabranjeno Pušenje,Ibro Dirka,3:20,Ibro Dirka / Djevojčice Kojima Miriše Koža,1985.0,,,"1985.0-Ibro Dirka / Djevojčice Kojima Miriše Koža/nan-Dok Čekaš Sabah Sa Šejtanom/nan-Najveći Hitovi/nan-Nikad Robom, Vazda Taksijem - Najveći Hitovi '84.-'89. (The Best Of)/nan-Kanjon Drine/nan-The Best Of  Vol. 1/nan-Hapsi Sve!/2009.0-The Ultimate Collection/nan-The Best Of"
36,TkHYG/uZ_1_36,Zabranjeno Pušenje,Zabranjeno pušenje,Idol,11498,"Bio je moj idol 
i ja sam slus'o sve njegove ploce
sad mu placam duplu ljutu
i pitam ga kad ce 
prestat' da loce

Svi njegovi sviraju u revijskom
skratili su kose i skresali brade
samo je on ostao isti
da pokupi prasinu s barikade
 
Ref.
Da l' nocas pjan tetura 
ili je mozda zaspao tek
il' u svojoj pijanoj glavi
priprema neki novi come back

Vikali su mu, bjezi s puta
proslo je i tvojih pet minuta
smjeskao im se iz daleka 
znao je da i njih isto ceka

","https://tekstovi.net/2,550,6926.html",,,,,,,,['Zabranjeno pušenje'],,,https://diskografija.com/pjesma/idol-9277.htm,Idol,['Dragomir Herendić Dragianni'],,,,,,,,Zabranjeno Pušenje,Idol,3:35,Bog Vozi Mercedes,,,,nan-Bog Vozi Mercedes
37,TkHYG/uZ_1_37,Zabranjeno Pušenje,Zabranjeno pušenje,Igrac s brojem dva,15135,"Kad savladas vjestinu igre
kad postanes prodoran i brz
kad ti dribling postane perfektan
za protivnicku odbranu kad postanes enigma

Medju bekovima kad pocnes pravit slalom
kada usavrsis igru glavom
kad tribine pocnu da se pale
na tvoje pasove, dijagonale
 
Tada na scenu stupa igrac s brojem dva
takozvani igrac zadatka
koji dobro zna sve tvoje tajne i lako moze doci do svakog podatka

Pocinje da te vuce za dres
da te udara, da te gura
programiran je za to, antitalent, kreatura
il' ti mali igrac velikih struktura

Ref.
Dok igrac s brojem dva prati te k'o sjena
ipak ti gospodaris sredinom terena

Ali ti mu moras parirat' svojom igrom
prefinjenom tehnikom, duhovitom fintom
izbjegavaj verbalne duele, izbjegevaj incident
ne slusaj mu pricu i iskljuci ton
ne prihvacaj tu igru, to iskusava te On

Ref.

Jer lopta se krece, kombinacija tece
i tu je mudrost sva
i zato nemoj pasti, mada kuca dobro casti
nikad nemoj postat' igrac s brojem dva

Igrac s brojem dva te napada
igrac s brojem dva igra flastera
igrac s brojem dva te napada
igrac s brojem dva, igrac s brojem dva","https://tekstovi.net/2,550,20874.html",,,,,,,,,,,,,,,,,,,,,,,,,,,,
38,TkHYG/uZ_1_38,Zabranjeno Pušenje,Zabranjeno pušenje,Impossible is nothing,12774,"Ja i Amar zivimo u kuci od kartona
svadjamo se 'ko ce obuc Beckhamov dres
on je za nas Tito i Alija i Bog
dobro, u zadnje vrijeme ne ide ga gol

Citam u Avazu pisu novinari - supci
sirotinji dao prilog, samo dvaes' funti
ne mere se tako na sportsku velicinu
ne mere se, jaro, goloruk na planinu
 
Ref. 4x
Beckham, David Beckham

Posl'o sam mu pismo i napis'o broj
volio bi' da me zovne makar platio roaming
volio bi' da ga pitam u cemu je fol
pa da i ja kazem ""Impossible is nothing""

Ref. 4x

Al' nocas se probudih u jastucima mokrim
Beckham, David Beckham 
jer od losih snova poceo sam da se znojim
Beckham, David Beckham 
neko crno dijete je stajalo na vodi
 Beckham, David Beckham 
kaze: Sjeb'o si se jaro, Beckham ne postoji

Lopta leti u grmlje","https://tekstovi.net/2,550,20866.html",,,,,,,,,,,,,,,,,,,,,Zabranjeno Pušenje,Inpossible Is Nothing,,Hodi Da Ti Čiko Nešto Da,,Sejo Sexon,Sejo Sexon,nan-Hodi Da Ti Čiko Nešto Da
39,TkHYG/uZ_1_39,Zabranjeno Pušenje,Zabranjeno pušenje,"Izvini, jaro, guzim",18361,"Politika i kritika 
i vojska i balistika
izvini, jaro, guzim
i plaze i gaze 
i kapije i straze
izvini, jaro, guzim
 
I nadgradnja i baza 
cinjenica, fraza
izvini, jaro, guzim
i Internet i Sky 
bas je lijepo sto si high
i grebi i struzi
kol'ko mozes ti se pruzi

I bekrija i tekija 
firaum i efendija
i mislilac i cmizdravac 
i covjek a i gmizavac

Astronaut, eklektik 
atleta, epileptik
budi svjetla staza
budi junak, kamikaza

Ne zelim, ne zelim 
horizonte da ti suzim
izvini, jaro, guzim
i Clinton i piton 
i Pershing i avion
izvini, jaro, guzim

Zemljaci, narodnjaci 
stranke, manijaci 
izvini, jaro, guzim
limuzine, krinoline 
i daljine, i visine
izvini, jaro, guzim

I Internet i Sky 
bas je lijepo sto si high
i grebi i struzi
kolk'o mozes ti se pruzi

I bekrija i tekija 
firaum i efendija
i mislila i cmizdravac 
i covjek a i gmizavac

Astronaut, eklektik 
atleta, epileptik
budi svjetla staza
budi junak, kamikaza

Ne zelim, ne zelim 
horizonte da ti suzim
izvini, jaro, guzim
i sta sad o tome reci
ja samo u muziku 
uvaljujem rijeci

Ne molim, ne stedim 
ne razmisljam da l' vrijedim
ne molim, ne puzim
izvini, jaro, guzim 
","https://tekstovi.net/2,550,15821.html",,,,,,,,,,,,,,,,,,,,,Zabranjeno Pušenje,"Izvini Jaro, Guzim",2:15,Agent Tajne Sile,,Sejo Sexon,Sejo Sexon,nan-Agent Tajne Sile
40,TkHYG/uZ_1_40,Zabranjeno Pušenje,Zabranjeno pušenje,Ja imam kuhinju,7941,"Joj dobrog fazona
nisam znao da se na ovom mjestu
skuplja toliko klosara tisina

Ja imam banju
(4x)
 
Al' ona nije poptuna
necu biti odista veseo
dok ne ugradim
odvod za djubre u njoj

Ja imam banju
(3x)

Banju imam ja

Ref. 4x
Ja imam kuhinju

Al' ni ona nije poptuna
necu biti odista veseo
dok ne ugradim
odvod za djubre u njoj

Ref. 4x

Ja sam egzistent
ja nisam go-patent
imam svoj bend

Ref. 4x

Io prego dela banja
(2x)

Sempre, sempre, sempre amici mei
sempre, sempre, sempre liberta

Io prego dela banja
(4x)

Io mio egzistento
io mio no patento

Io prego dela banja
(4x)

Ja imam spajz
(4x)

Nisam znao da se skupilo
ovdje toliko onih, onih miseva","https://tekstovi.net/2,550,20426.html",,,,,,,,['Zabranjeno pušenje'],,,https://diskografija.com/pjesma/ja-imam-kuhinju-6213.htm,Ja imam kuhinju,,,,,,,,,Zabranjeno Pušenje,Ja Imam Kuhinju,,Grupa Za Vas,1983.0,,,1983.0-Grupa Za Vas/nan-Dok Čekaš Sabah Sa Šejtanom
