Unnamed: 0,Song_ID,Artist,Artist_diskografija,Song_tekstovinet,Views_tekstovinet,Lyrics_tekstovinet,Url_tekstovinet,Writer_lyricstranslate,Song_lyricstranslate,EngTitle_lyricstranslate,Album_lyricstranslate,Lyrics_lyricstranslate,EngLyrics_lyricstranslate,Url_lyricstranslate,Izvedba_diskografija,Album_1_diskografija,Album_2_diskografija,Url_diskografija,Song_diskografija,Aranžman_diskografija,Skladba_diskografija,Stihovi_diskografija,Album_3_diskografija,Album_4_diskografija,Lyrics_cuspajz,Song_cuspajz,Url_cuspajz,Artist_discogs,Song_discogs,Song_duration_discogs,Album_title_discogs,Album_year_discogs,Lyrics By_discogs,Music By_discogs,All_albums_discogs
60,TkHYG/uZ_1_60,Zabranjeno Pušenje,Zabranjeno pušenje,Lutka sa naslovne strane,39536,"U tebe smo se kleli
na tebe trosili plate
zamisljali trenutke s tobom
u kafani lagali jedan drugom

Zbog tebe smo se tukli
kupovali vrucih djevreka
o, kako si samo odudarala ti
od memle i blata Sedrenika
 
Ref.
Al' tvoje su misli bile daleko
htjela si u foto-modele
skupa svila i skupe pele
i gola si se slikala, vele

Zbog tebe smo se tukli
kupovali vrucih djevreka
o, kako si samo odudarala ti
od memle i blata Sedrenika

Virili smo dok se presvlacis
ma nije bilo ljepse
pod Allahovim svodom
pjesme smo ti pjevali
a tvoja nas je nana
polijevala vodom

Ref.

Htjela si da tvoje aktove
vidi barem pola svijeta
a sada u granapu Sedrenika
lokalni dripci te pitaju
lutko, posto je pasteta","https://tekstovi.net/2,550,15037.html",,Lutka sa naslovne strane,Front Page Doll,,"U tebe smo se kleli
Na tebe trošili plate
Zamišljali trenutke s tobom
U kafani lagali jedan drugom. Zbog tebe smo se tukli
Kupovali vrućih đevreka
O kako si samo odudarala ti
Od memle i blata Sedrenika. Al tvoje su misli bile daleko
Htjela si u foto-modele
Skupa svila i skupe pele
I gola si se slikala vele. Zbog tebe smo se tukli
Kupovali vrućih đevreka
O kako si samo odudarala ti
Od memle i blata Sedrenika. Virili smo dok se presvlačiš
Ma nije bilo ljepše
Pod Alahovim svodom
Pjesme smo ti pjevali
A tvoja nas je nana
Polijevala vodom. Al tvoje su misli bile daleko
Htjela si u foto-modele
Skupa svila i skupe pele
I gola si se slikala vele. Htjela si da tvoje aktove
Vidi barem pola svijeta
A sada u granapu Sedrenika
Lokalni dripci te pitaju
Lutko, pošto je pašteta. Htjela si da tvoje aktove
Vidi barem pola svijeta
A sada u granapu Sedrenika
Lokalni dripci te pitaju
Lutko, pošto je pašteta","We swore by you
Spent our money on you
Imagined moments with you
Lied to one another in the café. We fought because of you
Bought hot simits1
Oh, how you set yourself apart
From the smog and mud of Sedrenik2. But your dreams were big
You wanted to be a photo-model
Expensive silk and expensive shoes
You photographed yourself naked, they say. We fought because of you
Bought hot simits
Oh, how you set yourself apart
From the smog and mud of Sedrenik. We peeked while you were changing
There was nothing more beautiful
Under Allah's vaulted roof
We sung you songs
And your grandma
Poured water over us. But your dreams were big
You wanted to be a photo-model
Expensive silk and expensive shoes
You photographed yourself naked, they say. You wanted your acts
To be seen by half the world
But now in the market of Sedrenik
Local rascals ask you
Doll, how much is the paté. You wanted your acts
To be seen by half the world
But now in the market of Sedrenik
Local rascals ask you
Doll, how much is the paté",https://lyricstranslate.com/en/lutka-sa-naslovne-strane-front-doll.html,['Zabranjeno pušenje'],1985 - Dok čekaš sabah sa šejtanom,2000 - Super Hitovi 1998-2000,https://diskografija.com/pjesma/lutka-sa-naslovne-strane-6209.htm,Lutka sa naslovne strane,,,,,,"U tebe smo se kleli
Na tebe trošili plate
Zamišljali trenutke s tobom
U kafani lagali jedan drugom

Zbog tebe smo se tukli
Kupovali vrućih đevreka
O kako si samo odudarala ti
Od memle i blata Sedrenika

Al' tvoje su misli bile daleko
Htjela si u foto-modele
Skupa svila i skupe pele
I gola si se slikala vele

Zbog tebe smo se tukli
Kupovali vrućih đevreka
O kako si samo odudarala ti
Od memle i blata Sedrenika

Virili smo dok se presvlačiš
Ma nije bilo ljepše
Pod Alahovim svodom
Pjesme smo ti pjevali
A tvoja nas je nana
Polijevala vodom

Al' tvoje su misli bile daleko
Htjela si u foto-modele
Skupa svila i skupe pele
I gola si se slikala vele

Htjela si da tvoje aktove
Vidi barem pola svijeta
A sada u granapu Sedrenika
Lokalni dripci te pitaju
Lutko, pošto je pašteta

Htjela si...",Lutka sa naslovne strane,https://cuspajz.com//tekstovi-pjesama/pjesma/zabranjeno-pusenje/lutka-sa-naslovne-strane.html,Zabranjeno Pušenje,Lutka Sa Naslovne Strane,3:32,Dok Čekaš Sabah Sa Šejtanom,,Sejo Sexon,Munja Mitić,nan-Dok Čekaš Sabah Sa Šejtanom/nan-Kanjon Drine/nan-The Best Of  Vol. 1/nan-Hapsi Sve!/2009.0-The Ultimate Collection/nan-The Best Of
61,TkHYG/uZ_1_61,Zabranjeno Pušenje,Zabranjeno pušenje,Mahala u magli,1694,"Ti si tajni princ iz City trznog centra
dok na viljuskaru lebdis nad hipnotisanom masom
poslao si SMS jutros hrabro, nakon sna
stvar se dobro razvija, vratila je smajlija

Jos u menzu pa ces kuci, rucak dobar, puding voden
vreli tramvaj, pun k'o oko, danas ni'ko nije zboden
samo jos da predas tiket, vidis tekmu, smotas drogu
pa kod gazda Sekija na ljut pelincic s nogu
 
U svom Golfu dvojci gargas, briga te za radar
otfrljio si ""Stuke"" jako, holivudski kadar
poslao si SMS jutros hrabro, nakon sna
stvar se dobro razvija, vratila je smajlija

Veceras je ta noc, senzori ferceraju 
bager ljubavi nocas gradi novi put
veceras je ta noc, za sankom ces je naci
kad ne vidi vas ni'ko ruku ce ti taci

Brzina sad je svjetlosna
svi otkucaji srca u jedan tren ce stat'
brzina sad je svjetlosna
sestra sudbina za tebe ima novi plan

Brzina sad je svjetlosna
svi otkucaji srca u jedan tren ce stat'
brzina sad je svjetlosna
a puknuti retrovizor sakrij
pse lutalice, divlju gradnju i mahalu u magli","https://tekstovi.net/2,550,57041.html",,,,,,,,,,,,,,,,,,,,,Zabranjeno Pušenje,Mahala U Magli,3:50,Šok I Nevjerica,,,,nan-Šok I Nevjerica
62,TkHYG/uZ_1_62,Zabranjeno Pušenje,Zabranjeno pušenje,Mali motac jointa,12199,"Ja sam mali motac jointa
ja sam monter svakog derneka
ja znam kakav stuff je potreban

Motam ga za dobre jarane
motam ga za ratne veterane
motam ga tebi da prifuras toj trebi
 
Ref.
Daj mi, daj mi dimic jarane
daj mi, da ljepsi bude svijet
daj mi, daj mi dimic jarane
da bude ljepse sve

Kada si na mom terenu
tvoje misli tada krenu
gdje zelim ja, mali motac jointa

Motam ga za stare dame
motam ga za prosle dane
ja motam frlju za nabrijanu rulju

Ref.

Motam za drzavu, motam ga u fusu
veliku pusu smontirat cu i Bushu
smot'o bi  za one u Iraku
veliku raketu smontirat cu Chiracu

Oces jaci, oces kraci
motam ga tebi, motam ga tebi
da prifuras toj trebi

Ref.","https://tekstovi.net/2,550,20861.html",,,,,,,,,,,,,,,,,,,,,Zabranjeno Pušenje,Mali Motač Jointa,,Hodi Da Ti Čiko Nešto Da,,Sejo Sexon,John Fogerty,nan-Hodi Da Ti Čiko Nešto Da
63,TkHYG/uZ_1_63,Zabranjeno Pušenje,Zabranjeno pušenje,Manijak,15513,"Bejbi, bejbi, ko te ne bi 
tako mladu negdje u 'ladu

Ja sam manijak iz gimnazijskog parka
vec danima sakriven 
ja gledam te iz mraka
i veceras sam ovdje, o je, je, je
i veceras sam ovdje i imacu te
 
Ref.
Ja upravo cujem tvoje korake
padam u trans i grlo mi je suho
prici cu ti necujno i tiho ti sapnuti na uho
bejbi, bejbi, ko te ne bi 
tako mladu negdje u 'ladu prislonio

I briga me sta ce poslije da bude
da l' ce da me lincuju ili da mi sude
progoni me glas iz moje glave lude
koji kaze, ona je lijepa 
a ljepota je za ljude

Ref.","https://tekstovi.net/2,550,12283.html",,,,,,,,['Zabranjeno pušenje'],,,https://diskografija.com/pjesma/manijak-6231.htm,Manijak,,,,,,"Bejbi bejbi ko te nebi
Tako mladu negdje u 'ladu

Ja sam manijak iz gimnazijskog parka
Već danima sakriven ja gledam te iz mraka
I večeras sam ovdje, o je-je-je
I večeras sam ovdje i imat ću te

Ja
Upravo čujem tvoje korake
Padam u trans
I grlo mi je suho
Prići ću ti nečujno
I tiho ti
Šapnuti na uho

Bejbi bejbi ko te nebi
Tako mladu negdje u 'ladu
Prislonio

I briga me šta će
Poslije da bude
Dal' će da me linčuju
Ili da mi sude
Progoni me glas
Iz moje glave lude
Koji kaže
""Ona je lijepa""
A ljepota je za ljude

Ja
Upravo čujem tvoje korake
Padam u trans
I grlo mi je suho
Prići ću ti nečujno
I tiho ti
Šapnuti na uho

Bejbi bejbi ko te nebi
Tako mladu negdje u 'ladu
Prislonio

Manijak",Manijak,https://cuspajz.com//tekstovi-pjesama/pjesma/zabranjeno-pusenje/manijak.html,Zabranjeno Pušenje,Manijak,,Pozdrav Iz Zemlje Safari,,Sejo Sexon,Sejo Sexon,"nan-Pozdrav Iz Zemlje Safari/nan-Srce, Ruke I Lopata /Najveći Hitovi/ 2/nan-Kanjon Drine/nan-Kolekcija Hitova Vol. 2"
64,TkHYG/uZ_1_64,Zabranjeno Pušenje,Zabranjeno pušenje,Mejtas,7920,"Noc je i sjenke su duge
isto kao i juce
jedna je velika, od nocnog oblaka
prekrila dio kuce

Sa Istoka stie rumeni zrak
on je i tu i negdje drugo
ti si odavno vec zaspala
uspavalo te jugo
 
Ref. 4x
Sunce kad izadje, na Mejtas izadje

Po sobi se igras s prvim zrakama
sad znam sta znaci rijec ""sloboda""
odavno slutim, sad sigurno znam
odakle pocinje dan

Ref. 4x","https://tekstovi.net/2,550,20873.html",,,,,,,,,,,,,,,,,,,,,Zabranjeno Pušenje,Mejtaš,,Hodi Da Ti Čiko Nešto Da,,Darko Ostojić,Darko Ostojić,nan-Hodi Da Ti Čiko Nešto Da
65,TkHYG/uZ_1_65,Zabranjeno Pušenje,Zabranjeno pušenje,Meteor,8751,"Idem uz aleju, kisa kapa
u grudima mi struje dva Djerdapa
na vrhu me cekas, zasjedu spremas
htjela me ili ne, svejedno je

Ne grli me, oko vrata mi je zica
ne ljubi me, jezik mi je zmija otrovnica
ledja me svrbe od nozeva
lice mi grubo od pogleda
poljubices me ili ne, svejedno je
 
Ref.
Vjeruj mi, moja je zelja jedina 
da se vinem put visina 
i da tamo gore visoko
sagorim kao meteor

Ne zelim da volim, nisam spreman
ne zelim da mrzim, vremena nemam
ne zelim da imam putanju
ja sam prvak svijeta u lutanju
vjerovala ili ne, svejedno je

Ref. 2x","https://tekstovi.net/2,550,21102.html",,,,,,,,['Zabranjeno pušenje'],,,https://diskografija.com/pjesma/meteor-6234.htm,Meteor,,,,,,"Idem uz aleju, kiša kapa
U grudima mi struje dva Đerdapa
Na vrhu me čekaš, zasjedu spremaš
Htjela me, ili ne, svejedno je

Ne grli me, oko vrata mi je žica
Ne ljubi me, jezik mi je zmija otrovnica
Leđa me svrbe od noževa,
Lice mi grubo od pogleda
Poljubit ćeš me, ili ne, svejedno je

Vjeruj mi
Moja je želja jedina
Da se vinem put visina
I da tamo gore visoko
Sagorim kao meteor

Ne želim da volim, nisam spremam
Ne želim da mrzim, vremena nemam
Ne želim da imam putanju,
Ja sam prvak svijeta u lutanju
Vjerovala, ili ne, svejedno je

Vjeruj mi
Moja je želja jedina
Da se vinem put visina
I da tamo gore visoko
Sagorim kao meteor

Meteor",Meteor,https://cuspajz.com//tekstovi-pjesama/pjesma/zabranjeno-pusenje/meteor.html,Zabranjeno Pušenje,Meteor,,Pozdrav Iz Zemlje Safari,,Dr. Nele Karajlić,Goran Grbić,nan-Pozdrav Iz Zemlje Safari
66,TkHYG/uZ_1_66,Zabranjeno Pušenje,Zabranjeno pušenje,Modni guru,2582,"Rodom je iz malog sela, pokraj sela Nevesela
on je stilist
mama nije tako htjela, rodbina se stidi cijela
on je modni stilist

On je modni guru i nema curu
on je modni guru, on nece platit turu
 
Je li crna ili bijela, plasi se estrada cijela
on je modni stilist
haljinice i odijela, nabildana muska tijela
on je modni stilist

On je modni guru i posto nema curu
k'o pravi modni guru, on voli tuci nas po turu

Ref.
Jer on je modni kralj, gdje je party tu je on
oh, kamere on voli, jos vise voli mikrofon
preferira pinky ton, obozava silikon

Modni guru, ne voli slaninu ni puru
on je modni guru, on voli tuci te po turu

Modni guru

Sta je out, sta je in, savjetujte se sa njim
jer on je stilist
koje gace, koje hlace, koje boje natikace
on je stilist

On je modni macak
njezan je k'o maslacak
on je macak modni
a mladici su zgodni

Ref.
Jer on je modni kralj, on je modni guru
prvo na frizuru pa na pedikuru
obozava silikon, preferira pinky ton

Modni guru, ne jede slaninu ni puru
on je modni guru, on voli tuci te po turu

Ref.

On je macak modni (modni guru)
mladici su zgodni (modni guru)
macak modni (modni guru)
mladici su zgodni

Modni guru","https://tekstovi.net/2,550,54611.html",,Modni guru,Fashion guru,Muzej revolucije (2009),"Rodom je iz malog sela
pokraj sela Nevesela
on je stilist
Mama nije tako htjela
rodbina se stidi cijela
on je modni stilist. On je modni guru
i nema curu
on je modni guru
on neće platit' turu. Je li crna ili bijela
plaši se estrada cijela
on je stilist
Haljinice i odijela
nabildana muška tijela
on je modni stilist. On je modni guru
i pošto nema curu
k'o pravi modni guru
on voli tući nas po turu. REF.
Jer on je modni kralj
gdje je party - tu je on
oh, kamere on voli
još više voli mikrofon
preferira pinky ton
obožava silikon. Modni guru
ne voli slaninu, ni puru
on je modni guru
on voli tući te po turu. Modni guru.... Šta je 'out', šta je 'in'
savjetujte se sa njim
jer, on je stilist
Koje gaće, koje hlače
koje boje natikače
on je stilist. On je modni mačak
nježan je k'o maslačak
on je mačak modni
a mladići su zgodni. REF.
Jer on je modni kralj
on je modni guru
prvo na frizuru
pa na pedikuru
obožava silikon
preferira pinky ton. Modni guru
ne jede slaninu, ni puru
on je modni guru
on voli tući te po turu. REF.
Jer on je modni kralj
gdje je party - tu je on
oh, kamere on voli
još više voli mikrofon
preferira pinky ton
obožava silikon. Modni guru
ne voli slaninu, ni puru
on je modni guru
on voli tući nas po turu. On je mačak modni
(modni guru)
mladići su zgodni
(modni guru)
on je mačak modni
(modni guru)
mladići su zgodni
(modni guru). Modni guru...","He was born in a small village
next to Sadville
He is a stylist
His mother didn't want him to be like that
all his relatives are ashamed
He is a fashion stylist. He is a fashion guru
and he doesn't have a girlfriend
He is a fashion guru
and he won't pay the round. Is it black or white
the whole elite is afraid
He is a stylist
Dresses and suits
buffed up male bodies
He is a fashion stylist. He is a fashion guru
and because he doesn't have a girlfriend
like a real fashion guru
he likes to beat our butts. Chorus:
Because he is a fashion king
he is where the party is
Oh, he loves cameras
and he loves microphone even more
He prefers pinky tone
he loves silicone. Fashion guru
doesn't like bacon and corn grits
He is a fashion guru
he likes to beat your butt. Fashion guru.... What's 'out' and what's 'in',
consult with him
because, he is a stylist
Which underwear, which pants,
which colour of loafers
He is a stylist. He is a fashion kitten
He is as delicate as a dandelion
He is a fashion kitten
and young guys are hot. Chorus:
Because he is a fashion king
He is a fashion guru
First hairdressing,
then pedicure
he loves silicone
He prefers pinky tone. Fashion guru
doesn't like bacon and corn grits
He is a fashion guru
he likes to beat your butt. Chorus:
Because he is a fashion king
he is where the party is
Oh, he loves cameras
and he loves microphone even more
He prefers pinky tone
he loves silicone. Fashion guru
doesn't like bacon and corn grits
He is a fashion guru
he likes to beat your butt. He is a fashion kitten
(fashion guru)
Young guys are hot
(fashion guru)
He is a fashion kitten
(fashion guru)
Young guys are hot
(fashion guru). Fashion guru...",https://lyricstranslate.com/en/modni-guru-fashion-guru.html,['Zabranjeno pušenje'],,,https://diskografija.com/pjesma/modni-guru-25062.htm,Modni guru,,,,,,"Rodom je iz malog sela, pokraj sela Nevesela
On je stilist
Mama nije tako htjela, rodbina se stidi cijela
On je modni stilista

On je modni guru, i nema curu
On je modni guru, on neće platit turu

Je li crna ili bijela, plaši se estrada cijela
On je modni stilist
Haljinice i odijela, nabildana muška tijela
On je modni stilist

On je modni guru, i pošto nema curu
Ko pravi modni guru, on voli tući nas po turu

Jer on je modni kralj, gdje je party tu je on
Oh, kamere on voli, još više voli mikrofon
Preferira pinky ton, obožava silikon

Modni guru, ne voli slaninu ni puru
On je modni guru, on voli tući te po turu

Modni guru

Šta je out, šta je in, savjetujte se sa njim
Jer on je stilist
Koje gaće, koje hlače, koje boje natikače
On je stilist

On je modni mačak
Nježan je ko maslačak
On je mačak modni
A mladići su zgodni

Jer on je modni kralj, on je modni guru
Prvo na frizuru pa na pedikuru
Obožava silikon, preferira pinky ton

Modni guru, ne jede slaninu ni puru
On je modni guru, on voli tući te po turu

Jer on je modni kralj, gdje je party tu je on
Oh, kamere on voli, još više voli mikrofon
Preferira pinky ton, obožava silikon

Modni guru, ne voli slaninu ni puru
On je modni guru, on voli tući nas po turu

On je mačak modni
Mladići su zgodni
Mačak modni
Mladići su zgodni

Modni guru",Modni guru,https://cuspajz.com//tekstovi-pjesama/pjesma/zabranjeno-pusenje/modni-guru.html,Zabranjeno Pušenje,Modni Guru,3:50,Muzej Revolucije,,,,nan-Muzej Revolucije
67,TkHYG/uZ_1_67,Zabranjeno Pušenje,Zabranjeno pušenje,Mozes imat' moje tijelo,138675,"Gdje sam rodjen tu je sve sirotinja
vuk je u nas domaca zivotinja
skrta zemlja nikoga ne hrani
da prezivis moras radit' vani

Sljakao sam ja u tudjoj zemlji
sanjao sam o voljenoj zeni
sa arbajta kad bi dos'a doma
gledao sam kako raste ona
 
Mislio sam srecu kupit' novcem
sredio sam stvar sa njenim ocem
prenesoh je preko kucnog praga
mislio sam da bice moja draga

Ref. 2x
Rekla mi je prvo vece
rekla mi je sve
mozes imat' moje tijelo
ali dusu ne

Samo tijelo nista mi ne znaci
kraj banhofa takve mogu naci
zelio sam da me stvarno voli
da joj ljubav nije aerobik

Kad je sa mnom da ne skriva pogled
da ne gleda uvijek negdje pored
zagrljeni kada zora svice
da budemo kao jedno bice

Ref. 2x

Nije mogla dugo da zanese
u nas nije bilo graje djece
sporo su nam prolazili dani
za veceru kad bi sjeli sami

Razboli se, Bog je mladu uze
pamtim vjecno njene zadnje suze
i saptaje ti si covjek vrijedan
ali zivot, zivot, on je bijedan

Ref. 2x","https://tekstovi.net/2,550,8402.html",,Mozes imat moje tijelo,You Can Have My Body,,"Gdje sam rođen tu je sve sirotinja
Vuk je u nas domaća životinja
Škrta zemlja nikoga ne hrani
Da preživiš moraš radit vani. Šljakao sam ja u tuđoj zemlji
Sanjao sam o voljenoj ženi
Sa arbajta kad bih doša doma
Gledao sam kako raste ona. Mislio sam sreću kupit novcem
Sredio sam stvar sa njenim ocem
Prenesoh je preko kućnog praga
Mislio sam da biće moja draga. Rekla mi je prvo veče, rekla mi je sve
Možeš imat moje tijelo, ali dušu ne. Samo tijelo ništa mi ne znači
Kraj banhofa takve mogu naći. Želio sam da me stvarno voli
Da joj ljubav nije aerobik. Kad je sa mnom da ne skriva pogled
Da ne gleda uvijek negdje pored
Zagrljeni kada zora sviće
Da budemo kao jedno biće. Nije mogla dugo da zanese
U nas nije bilo graje djece
Sporo su nam prolazili dani
Za večeru kad bi sjeli sami. Razboli se, Bog je mladu uze
Pamtim vječno njene zadnje suze
I šaptaje :""Ti si čovjek vrijedan,
Ali život, život on je bijedan..."". She told me the first night, she told me everything
You can have my body, but never my soul","Where I`m born everything is poor
Where we live the wolf is domestic animal
Cheap soil doesn`t feed anybody
You`ll have to work abroad to survive. I have walked around in the foreigner countries
I have dreamed about beloved woman
When I came back from work
I looked how she grows. I tought I could by happyness with money
I sorted out the thing with her father
I carried her over the doorstep
I tought that she would be my darling. She told me the first night, she told me everything
You can have my body, but never my soul. The body doesn`t mean anything to me
Near the Banhoff I could find ones like that (Banhof is a place in Amsterdam, Holland = The Red light district is near by, so he means that he could go to the prostitutes for a woman like that). I really wanted her to love me
And that love isn`t aerobic to her. And when she is with me that she doesn`t hide her look (looking with eyes= to watch)
That she doesn`t look somewhere else
Holding around each other when the dawn breakes
That we would be one. For a long time she couldn`t get pregnant
We didn`t have children
Our dayes went slowly
And for the dinner when we would sit down alone. She got ill, and the God took the bride
Forever I remember her last tears
And the whispers: ""You are a hard working man,
But the life, the life is poor..."". Možeš imat moje tijelo, ali dušu ne",https://lyricstranslate.com/en/Mozes-imat-moje-tijelo-You-Can-Have-My-Body.html,['Zabranjeno pušenje'],,,https://diskografija.com/pjesma/mozes-imat-moje-tijelo-9282.htm,Možeš imat' moje tijelo,,,,,,,,,Zabranjeno Pušenje,Možeš Imat' Moje Tijelo,4:51,Fildžan Viška,,,,nan-Fildžan Viška/nan-Live In St. Louis/2009.0-The Ultimate Collection
68,TkHYG/uZ_1_68,Zabranjeno Pušenje,Zabranjeno pušenje,Murga drot,47957,"Nas Murga nije obican drot 
njegove metode su modernije 
on te prvo ponudi cigarom 
pa te poslije razbije 

Murga nije obican drot 
zanimaju ga psiho-fenomeni 
svakom se unese u lice i kaze
zasvirat ces ti klavir meni 
 
Ponekad izmaltretira kakvog klinca 
od ovih rukovodecih glava 
poslije se Murga duboko klanja 
poslije se Murga dugo izvinjava 

Ref.
The night is dark 
and the night is hot 
it is right time 
for you, Murga drot 
noc je tmava, noc je horka 
je to spravne cas
pro tebe pane Murga

Otkako je gled'o Tacno u podne
Murga ide sredinom dzade 
toki-voki prislanja na uho 
pazljivo slusa komande 

Mozda ga bas veceras u mraku 
ceka njegov komad slave 
dodijalo mu marisat' uvijek istu raju 
legitimacija mu navrh glave 

Ref.

I dok sjedim ovdje u baru 
i kroz prozor promatram njega 
kontam da je Freud u pravu 
i da je seks korijen svega 

Ref.","https://tekstovi.net/2,550,13839.html",,Murga Drot,Officer Murga,,"Naš Murga nije običan drot
njegove metode su modernije
on te prvo ponudi cigarom
pa te poslije razbije. Murga nije običan drot
zanimaju ga psiho-fenomeni
svakom se unese u lice i kaže
zasvirat ćes ti klavir meni. Ponekad izmaltretira kakvog klinca
od ovih rukovodečih glava
poslije se Murga duboko klanja
poslije se Murga dugo izvinjava. Ref.
The night is dark
and the night is hot
it is right time
for you, Murga drot
noc je tmava, noc je horka
je to spravne ćas
pro tebe pane Murga. Otkako je gled'o Tačno u podne
Murga ide sredinom džade
toki-voki prislanja na uho
pažljivo sluša komande. Mozda ga baš većeras u mraku
čeka njegov komad slave
dodijalo mu marisat' uvijek istu raju
legitimacija mu navrh glave. Ref.. I dok sjedim ovdje u baru
i kroz prozor promatram njega
kontam da je Freud u pravu
i da je seks korijen svega","Our Murga isn't an ordinary officer
his methods are modern
first he offers you a cigar
then he beats you down. Murga isn't an ordinary cop
psycho-phenomena interest him
he grabs all and says to their faces
you'll play the piano for me. Every so often he'll mock some kid
of these guiding leaders
afterwards, Murga slaughters
afterwards, Murga apologizes deeply. Chorus:
The night is dark
and the night is hot
it is the right time
for you, officer Murga
The night is dark, the night is hot
it is the right time
for you, officer Murga. Ever since Murga watched High Noon
Murga walked the center of the road
He sets a walkie-talkie to his ear
and listens diligently to commands. Maybe, in the dark, tonight
awaits his piece of fame
he bargained their beat downs, always with the same gang
legitimacy was on his mind. Chorus.. And while I sit here in this bar
I watch him through the window
I'm thinking if Freud was right
and if sex is the cause of all things",https://lyricstranslate.com/en/murga-drot-officer-murga.html,['Zabranjeno pušenje'],,,https://diskografija.com/pjesma/murga-drot-6227.htm,Murga drot,,,,,,"Naš Murga nije običan drot
Njegove metode su modernije
On te prvo ponudi cigarom
Pa te poslije razbije

Murga nije običan drot
Zanimaju ga psiho-fenomeni
Svakom se unese u lice i kaže:
Zasvirat ćeš ti klavir meni

Ponekad izmaltretira kakvog klinca
Od ovih rukovodećih glava
Poslije se Murga duboko klanja
Poslije se Murga dugo izvinjava

The night is dark and the night is hot
It is right time
For you, Murga drot

Otkako je gled'o ""Tačno u podne""
Murga stalno ide sredinom džade
Toki-voki prislanja na uho
Pažljivo sluša komande
Možda ga baš večeras u mraku
Čeka njegov komad slave
Dodijalo mu marisat'
Uvijek istu raju
Legitimacija mu navrh glave

I dok sjedim ovdje u baru
I kroz prozor promatram njega
Kontam da je Freud u pravu
I da je seks korijen svega

Noc je tmava, noc je horka
Je to spramne čas, pro tebe pane Murga

Murga drot",Murga drot,https://cuspajz.com//tekstovi-pjesama/pjesma/zabranjeno-pusenje/murga-drot.html,Zabranjeno Pušenje,Murga Drot,,Pozdrav Iz Zemlje Safari,,Sejo Sexon,Sejo Sexon,nan-Pozdrav Iz Zemlje Safari/nan-Na Straži Pored Prizrena/nan-Kolekcija Hitova Vol. 2/2009.0-The Ultimate Collection
