Unnamed: 0,Song_ID,Artist,Artist_diskografija,Song_tekstovinet,Views_tekstovinet,Lyrics_tekstovinet,Url_tekstovinet,Writer_lyricstranslate,Song_lyricstranslate,EngTitle_lyricstranslate,Album_lyricstranslate,Lyrics_lyricstranslate,EngLyrics_lyricstranslate,Url_lyricstranslate,Izvedba_diskografija,Album_1_diskografija,Album_2_diskografija,Url_diskografija,Song_diskografija,Aranžman_diskografija,Skladba_diskografija,Stihovi_diskografija,Album_3_diskografija,Album_4_diskografija,Lyrics_cuspajz,Song_cuspajz,Url_cuspajz,Artist_discogs,Song_discogs,Song_duration_discogs,Album_title_discogs,Album_year_discogs,Lyrics By_discogs,Music By_discogs,All_albums_discogs
82,TkHYG/uZ_1_82,Zabranjeno Pušenje,Zabranjeno pušenje,Pisonja i Zuga u paklu droge,43651,"Pisonju i Zugu je zovnuo na
dernek jaran koji studira
rekao je, momci nemojte belaja
tu su raja kulturna

Amila je bila lijepa kao vila
starci su joj radili negdje u Iraku
rekla je samo, udjite momci
pa se poslije izgubila u mraku
 
Pisonja, rece Zuga
ovo mjesto mi se ne svidja
ajmo radje pred piramidu
ima finih putera

Odmori Zuga malo, matere ti
zar ne vidis kakve su ovde trebe
zar vec poslje pete pive moras
da pravis budalu od sebe

Ref.
Pisonja, ovo mjesto mi se ne svidja
niko se ne smije i cudna je muzika
Pisonja, ovdje se nesto cudno dogadja
sve je puno drogiranih pedera

A Pisonja odmah prifura Amili
kao Indijana Dzons onoj u Hong Kongu
znao je, ne smije biti greske
ove fine ti odmah daju nogu

Pisonja taman slozi pravu pricu
i odsvira Crne Leptire
kad se odnekud pojavi Zuga
i poce da paranoise

Ref.

Odmori Zuga malo, Tite ti
zar ne vidis kakve su ovde trebe
zar vec poslje seste pive moras
da pravis budalu od sebe

Al' negdje oko pola tri
na dernek upadose drotovi
neke frajere odmah
prislonise uza zid

Amila se prestrasi, kaze
joj, stari ce me masakrirati
a onda ugleda Pisonju i pogled
joj djavolski zasvjetli

Maleni, zelim nesto da ti poklonim
maleni, primi ovaj dar moje ljubavi
maleni, al' nesto moras mi obecati
prije jutra neces ga otvoriti

Jedan drot prifura Pisonji
dzepove mu prebira
nadje Amilinu travu i rece
Slavko, imamo dilera

Pisonja rece, drugovi
jel' se to mozda snima neki film
Pisonja rece, drugovi
ja nemam nista s tim

Ref.

Pisonja, ovo mjesto mi se ne svidja
niko se ne smije i cudna je muzika","https://tekstovi.net/2,550,11366.html",,Pišonja i Žuga u paklu droge,Pišonja and Žuga in a junkie den,Male priče o velikoj ljubavi (1989),"Pišonju i Žugu je zovnuo na dernek jaran koji studira
Rekao je ""Momci nemojte belaja, tu su raja kulturna!""
Amila je bila lijepa kao vila, starci su joj radili negdje u Iraku,
Rekla je samo ""Uđite, momci!"", pa se poslije izgubila u mraku. ""Pišonja"", reče Žuga, ""ovo mjesto mi se ne sviđa
'Ajmo radje pred ""Piramidu"", ima finih putera""
""Odmori, Žuga, malo, matere ti, zar ne vidiš kakve su ovde trebe,
Zar već poslje pete pive moraš da praviš budalu od sebe?"". Refren:
Pišonja, ovo mjesto mi se ne sviđa,
Niko se ne smije i čudna je muzika
Pišonja, ovdje se nešto čudno događa,
Sve je puno drogiranih pedera. A pišonja odmah prifura Amili kao Indijana Džons onoj u Hong Kongu
Znao je, ne smije biti greške, ove fine ti odmah daju nogu
Pišonja taman složi pravu priču i odsvira ""Crne leptire""
Kad se odnekud pojavi Žuga i poče da paranoiše:. Refren. ""Odmori, Žuga, malo, Tite ti, zar ne vidiš kakve su ovde trebe,
Zar već poslje šeste pive moraš da praviš budalu od sebe?"". Al' negdje oko pola tri na dernek upadoše drotovi
Neke frajere odmah prisloniše uza zid
Amila se prestraši, kaže ""Joj, stari će me masakrirati!""
A onda ugleda Pišonju i pogled joj đavolski zasvjetli. ""Maleni, želim nešto da ti poklonim
Maleni, primi ovaj dar moje ljubavi
Maleni, al' nešto moraš mi obećati
Prije jutra nećeš ga otvoriti"". Jedan drot prifura Pišonji, džepove mu prebira
Nadje Amilinu travu i reče ""Slavko, imamo dilera!"". Pišonja reče ""Drugovi, jel' se to, možda, snima neki film?""
Pisonja reče ""Drugovi, ja nemam ništa s tim"". Refren","Pišonja and Žuga were invited to a party by their friend who was a student
He said: ""Guys, don't do shit, these are cultured people!""
Amila was as beautiful as fairy, her folks worked somewhere in Iraq
She just said: ""Get in, guys!"" and later she got lost in the dark
""Pišonja"", Žuga said, ""I don't like this place
Let's rather go to 'The Pyramid', they have some nice food there.""
""Chill, Žuga, for the goodness sake, can't you see how hot are these chicks?
Do you really have to act like a fool after just five beers?"". Chorus:
""Pišonja, I don't like this place
Nobody's laughing and the music is awkward
Pišonja, something weird is happening here
Everything is full of junkie faggots!"". And Pišonja just went to chat up Amila, like Indiana Jones did with that girl in Hong Kong
He knew, he mustn't make a mistake, these nice girls reject pretty quick
Pišonja has just made the right story and played a song
When Žuga came out of somewhere and started to go crazy:. Chorus. ""Chill, Žuga, for the Tito's sake, can't you see how hot are these chicks?
Do you really have to act like a fool after just six beers?"". But just about two and a half, cops invaded the party
They leaned some guys next to the wall
Amila got scared, she thought: ""My dad's going to massacre me!""
And then she saw Pišonja and her eyes lit up devilishly. ""Baby, I want to give you something
Baby, please take this gift of my love
Baby, but you have to promise me something
You won't open it till the morning!"". One cop came to Pišonja and digged his pockets
He found Amila's weed and said: ""Slavko, we have a dealer!""
Pišonja said: ""Guys, are you filming or something?""
Pišonja said: ""Guys, I have nothing to do with this!"". Chorus",https://lyricstranslate.com/en/pisonja-i-zuga-u-paklu-droge-pisonja-and-zuga-junkie-den.html,['Zabranjeno pušenje'],1989 - Male priče o velikoj ljubavi,2004 - Live in St. Louis - uživo,https://diskografija.com/pjesma/pisonja-i-zuga-u-paklu-droge-6238.htm,Pišonja i Žuga u paklu droge,,,,,,"	Pišonju i Žugu je zovnuo na dernek jaran koji studira
Rekao je ""Momci nemojte belaja, tu su raja kulturna!""
Amila je bila lijepa kao vila, starci su joj radili negdje u Iraku,
Rekla je samo ""Uđite, momci!"", pa se poslije izgubila u mraku

""Pišonja"", reče Žuga, ""ovo mjesto mi se ne sviđa
'Ajmo radje pred ""Piramidu"", ima finih putera""
""Odmori, Žuga, malo, matere ti, zar ne vidiš kakve su ovde trebe,
Zar već poslje pete pive moraš da praviš budalu od sebe?""

Pišonja, ovo mjesto mi se ne sviđa,
Niko se ne smije i čudna je muzika
Pišonja, ovdje se nešto čudno događa,
Sve je puno drogiranih pedera

A Pišonja odmah prifura Amili kao Indijana Džons onoj u Hong Kongu
Znao je, ne smije biti greške, ove fine ti odmah daju nogu
Pišonja taman složi pravu priču i odsvira ""Crne leptire""
Kad se odnekud pojavi Žuga i poče da paranoiše

Pišonja, ovo mjesto ...

""Odmori, Žuga, malo, Tite ti, zar ne vidiš kakve su ovde trebe,
Zar već poslje šeste pive moraš da praviš budalu od sebe?""

Al' negdje oko pola tri na dernek upadoše drotovi
Neke frajere odmah prisloniše uza zid
Amila se prestraši, kaže ""Joj, stari će me masakrirati!""
A onda ugleda Pišonju i pogled joj đavolski zasvjetli

""Maleni, želim nešto da ti poklonim
Maleni, primi ovaj dar moje ljubavi
Maleni, al' nešto moraš mi obećati
Prije jutra nećeš ga otvoriti""

Jedan drot prifura Pišonji, džepove mu prebira
Nadje Amilinu travu i reče ""Slavko, imamo dilera!""

Pišonja reče ""Drugovi, jel' se to, možda, snima neki film?""
Pisonja reče ""Drugovi, ja nemam ništa s tim""

Pišonja, ovo mjesto ...

Pišonja i Žuga u paklu droge",Pišonja i Žuga u paklu droge,https://cuspajz.com//tekstovi-pjesama/pjesma/zabranjeno-pusenje/pisonja-i-zuga-u-paklu-droge.html,Zabranjeno Pušenje,Pišonja I Žuga U Paklu Droge,,Male Priče O Velikoj Ljubavi,,,,"nan-Male Priče O Velikoj Ljubavi/nan-Najveći Hitovi/nan-Srce, Ruke I Lopata /Najveći Hitovi/ 2/nan-Na Straži Pored Prizrena/nan-Live In St. Louis/2009.0-The Ultimate Collection"
83,TkHYG/uZ_1_83,Zabranjeno Pušenje,Zabranjeno pušenje,Pklatovi I,7555,"Postoji jedna dimenzija 
nepoznata covjeku
prostor izmedju svjetlosti i sjenke
izmedju nauke i praznovjerja

To je dimenzija tamnih sila 
i perverzne imaginacije
gospodari te dimenzije 
nazivaju se Pklatovi
 
Pklatovi imaju oci i usi 
i noge, i ruke, i ledeni dah
samo im je dodir potpuno mek
a korak previse lak

Zauzeli su cijeli nas grad 
i poceli sebi ljude zvat'
nisi vise znao ko je covjek
a ko je Pklat

Ubrzo su usli u svaki nas dom 
i ljudima spustili zavjese
svak je mogao da vidi samo unutra
niko nije gledao napolje

Na ulice su pustili bijele medvjede
cija je dlaka sjajna
dosli su iz dalekog svemira
njihovo porijeklo mora ostati tajna

Ref.
Mi smo Pklatovi i nemojte nam sta zamjeriti
mi samo zelimo da mislite ko mi

Izmedju nas, draga, ne postoji nista
otkako su na nasa vrata kucali
ne cujemo vrisak komsinice
niti smo plin osjetili

Prazne su case, puna pepeljara, nestaje boje
srce kuca sporo, tika-ta-tak
nema vise poljupca, ni svadje, ni samara
tvoga tijela, draga, ja se vise ne sjecam

Ref. 2x

Iskaci kroz prozor, mala 
i bjezimo odavde
u dvoriste i park 
pa sve do kraja ulice

Ja cu na drugu stranu 
da im trag zametnem
ti cekaj na kraju grada
neka auto bude upaljen
","https://tekstovi.net/2,550,21564.html",,,,,,,,['Zabranjeno pušenje'],,,https://diskografija.com/pjesma/pklatovi-i-invazija-pklatova-6239.htm,Pklatovi I - Invazija Pklatova,,,,,,,,,Zabranjeno Pušenje,Pklatovi (I Dio),,Male Priče O Velikoj Ljubavi,,,,nan-Male Priče O Velikoj Ljubavi
84,TkHYG/uZ_1_84,Zabranjeno Pušenje,Zabranjeno pušenje,Pocasna salva,44182,"Druze, bilo je lakse sve
mi u rovu, oni u rovu, tu na puskomet
sjecas li se, druze, da ne bi izdali
mi smo zadnji metak za sebe cuvali

Druze, dok sam se budio
ukrali su moju mladost, moje ludilo
dobre su kafane, dobro se napusi
dobri ljudi vole price sto prica gubitnik
 
Druze, ljudi bez muda i casti
k'o hijene se mlate oko komada vlasti
druze, laksi su bunkeri
nego limuzine i salteri

Ref.
Korak preko ograde
je l' to, druze, jedino sto casno je
zar za nas, stare ratnike
pocasna salva da ne odjekne

Druze, sjene su kraj mene
od Senke, od Gaje i od Pisonje
druze, sjene su kraj mene
kazu, marsirali smo dugo, al' zalud cini se

Ref.

Druze, zivot je bitka
i nije za dusu meku
ostani uz mene i puni redenik
neprijatelj prelazi reku

Mala, velika moja
veceras cemo za njih voleti
bilo ih je dvadeset i osam
bilo ih je pet hiljada i dvadeset osam

Bilo ih je vise nego sto ikada
i u jednoj pesmi bilo ljubavi
sad bi bili ocevi
sad ih vise nema","https://tekstovi.net/2,550,22995.html","Sejo Sexon, Traditional",Pocasna Salva,Volley Shots,,"Druže, bilo je lakše sve
1
mi u rovu, oni u rovu, tu na puškomet
sjećaš li se, druže, da ne bi izdali
mi smo zadnji metak za sebe čuvali. Druže, dok sam se budio
ukrali su moju mladost, moje ludilo
dobre su kafane, dobro se napuši
dobri ljudi vole priču što priča gubitnik. Druže, ljudi bez muda i časti
k'o hijene se mlate oko komada vlasti
druže, loši su bunkeri
nego limuzine i šalteri. REF.
Korak preko ograde
jel' to, druže, jedino što časno je
zar za nas, stare ratnike
počasna salva da ne odjekne. Druže, sjene su kraj mene
od Senke, od Gaje i od Pišonje
druže, sjene su kraj mene
kažu, marširali smo dugo, al' zla učini se. Ref.. Druže, život je bitka
i nije za dušu meku
ostani uz mene i puni redenik
neprijatelj prelazi reku. Mala, velika moja
večeras ćemo za njih voleti
bilo ih je dvadeset i osam
bilo ih je pet hiljada i dvadeset osam. Bilo ih je više nego što ikada
i u jednoj pesmi bilo ljubavi
sad bi bili očevi
sad ih više nema","Comrade it was all more simple
we in trenches, they in trenches,just a fire-distance away
do U remember. comrade, so we wouldn't betray
we save the last bullet for us. Comrade, whil I was awakening
they took my youth and my crazyness away
Cafes are good and getting high is good
Good people love a story that is told by a loser. Comrade,people without balls and honour
fight like hyenas over a piece of power
druze, losi su bunkeri
nego limuzine i salteri
Comrade, bunkers are worse than limousines and offices. Ref.
A step over the fence
is it the only that is honorful
can it be, that for for us, the old warirors,
no volley shots will echo. Comrade,the shadows are next to me
From Senke, from Gaje and from Pisonje (names of people)
Comrade,the shadows are next to me
They said: we marched for a long, but it seems we did it for nothing. Ref.
A step over the fence
is it the only that is honorful
can it be, that for for us, the old warirors,
no volley shots will echo. Comrade,the shadows are next to me
From Senke, from Gaje and from Pisonje (names of people)
Comrade,the shadows are next to me
They said: we marched for a long, but it seems we did it for nothing. Comrade, lif is a battle
and it's not for a soft soul
stay close to me and fill your bandolier
enemy is crosin' the river. Mala, velika moja
My little, my big one
veceras cemo za njih voleti
Tonight we'll love for them
there was 28 of them
there was 5028 of them. There were more of them then ever
was a love in one song
now they would be fathers
now, they are gone",https://lyricstranslate.com/en/pocasna-salva-volley-shots.html,['Zabranjeno pušenje'],,,https://diskografija.com/pjesma/pocasna-salva-9278.htm,Počasna salva,['Dragomir Herendić Dragianni'],,,,,,,,Zabranjeno Pušenje,Počasna Salva,5:14,Bog Vozi Mercedes,,,Traditional,nan-Bog Vozi Mercedes/2009.0-The Ultimate Collection
85,TkHYG/uZ_1_85,Zabranjeno Pušenje,Zabranjeno pušenje,"Poljubi je, budalo",2304,"Tvoje kurve i jarani
sve belaji odabrani
foliranti i fukara
vole te dok imas para

Nije htjela odgovore
gdje si cugao do zore
nije bilo pitanja
nakon tvojih skitanja
 
Ref.
Samo ona mari, samo njoj je stalo
ne daj joj da ide, poljubi je, budalo
napravi taj korak, potrudi se bar malo
ne daj joj da ide, poljubi je, budalo
poljubi je

Ne'ko koga mozes tuci
cekao te vjerno kuci
kada spiskala se plata
otvarala ti je vrata

Ref.

Ali dosla je do zida
zbog komsija i zbog stida
sa cipela skida blato
odlazi u nepoznato

Ref. 2x","https://tekstovi.net/2,550,57032.html",,,,,,,,,,,,,,,,,,,,,Zabranjeno Pušenje,Poljubi Je Budalo,3:33,Šok I Nevjerica,,,,nan-Šok I Nevjerica
86,TkHYG/uZ_1_86,Zabranjeno Pušenje,Zabranjeno pušenje,"Pos'o, kuca, birtija",64989,"Nikad nisam bio neki veliki vjernik
nisam cit'o stampu, nisam gled'o dnevnik
nisam znao gdje sam i koja je klima
ti si bila moje proljece i zima

Al' otkako je presusio okean
ja vise srece u ljubavi nemam
al' otkako se ugasio vulkan
ja po cijeli dan sam po sobi lutam
 
Ref.
Otkako si s njim
otkako si otisla
zivot mi je siv
pos'o, kuca, birtija

Zavrsit cu sad ko svi stari cugeri
u ovome bircu gdje skupljaju se luzeri
i necu dat' nikom da ti spomene ime
i TV cu gledat' od himne do himne

Ref.","https://tekstovi.net/2,550,8432.html",,"Pos'o, kuća, birtija","Job, house, bar",Agent tajne sile (1999),"Nikad nisam bio neki veliki vjernik
nisam čit'o štampu, nisam gled'o dnevnik
nisam znao gdje sam i koja je klima
ti si bila moje proljeće i zima. Al' otkako je presušio okean
ja više sreće u ljubavi nemam
al' otkako se ugasio vulkan
ja po cijeli dan sam po sobi lutam. Ref.
Otkako si s njim
otkako si otišla
život mi je siv
pos'o, kuća, birtija. Završit cu sad ko svi stari cugeri
u ovome bircu gdje skupljaju se luzeri
i neću dat' nikom da ti spomene ime
i TV ću gledat' od himne do himne. Ref.","I've never been very religious
I've never read or watched the news
I didn't know where am I and which climate is this
You were my spring and winter. But since the ocean has dried up,
I don't have any more luck in love
But since the volcano has turned off,
I'm wandering alone in my room for the whole day. Chorus:
Since you went with him,
since you went away,
my life is all blue:
job, house and bar. I will end up like all old drunkards
In this bar where all the losers gather
I won't let anybody say your name
And I will watch TV from an anthem to an anthem. Chorus:",https://lyricstranslate.com/en/pos039o-kuca-birtija-job-house-bar.html,['Zabranjeno pušenje'],,,https://diskografija.com/pjesma/pos-o-kuca-birtija-9285.htm,"Pos'o, kuća, birtija",,,,,,,,,Zabranjeno Pušenje,"Pos'o, Kuća, Birtija",4:28,Agent Tajne Sile,,Sejo Sexon,Sejo Sexon,nan-Agent Tajne Sile/nan-Live In St. Louis/2009.0-The Ultimate Collection
87,TkHYG/uZ_1_87,Zabranjeno Pušenje,Zabranjeno pušenje,Posljednja oaza (U losoj formi sam),21928,"Fikreta, izmedju mene i dna
jos samo ti stojis, Fikreta
mozda bi trebalo da se sklonis otuda
i da pocnes ispocetka

Da ne peres vise tudja stubista
zbog mojih lutanja, kafana i tombola
ti znas da lazem
da se promjenit' necu nikada
zivot je jedan, zivi ga, Fikreta
 
Ref.
U losoj formi sam
u losoj formi sam
i zato ne zelim da budes
tu kraj mene, prosetaj

Nekada davno si voljela covjeka
taj covjek, to vec dugo nisam ja
vec dugo u losoj formi sam
uzalud me ispravljas

Ref.

Fikreta mi tresnje iznijela
a ja se sjetih nekog filma o pticama
kada je ptici u losoj formi drug
tada ni ona ne leti na jug

Ref. 2x","https://tekstovi.net/2,550,8542.html",,,,,,,,['Zabranjeno pušenje'],1987 - Pozdrav iz zemlje Safari,2004 - Live in St. Louis - uživo,https://diskografija.com/pjesma/posljednja-oaza-u-losoj-formi-sam-6232.htm,Posljednja oaza (U lošoj formi sam),,,,,,"Fikreta, između mene i dna
Još samo ti stojiš, Fikreta
I možda bi trebalo
Da se skloniš otuda
I da počneš iz početka

Da ne pereš više tuđa stubišta
Zbog mojih lutanja, kafana i tombola
Ti znaš da lažem da se promijenit neću nikad
Život je jedan, živi ga Fikreta

Ooooo u lošoj formi sam
Ooooo u lošoj formi sam
I zato ne želim da budeš
Tu kraj mene, prošetaj

Nekada davno voljela si čovjeka
Taj čovjek to već dugo nisam ja
Već dugo u lošoj formi sam
Uzalud me uspravljaš

Fikreta mi trešnje iznijela
A ja se sjetim nekog filma o pticama
Kada je ptici u lošoj formi drug
Tada ni ona ne leti na jug",Posljednja oaza (U lošoj formi sam),https://cuspajz.com//tekstovi-pjesama/pjesma/zabranjeno-pusenje/fikreta-posljednja-oaza-u-losoj-formi-sam.html,Zabranjeno Pušenje,Posljednja Oaza (U Lošoj Formi Sam),,Pozdrav Iz Zemlje Safari,,Sejo Sexon,Sejo Sexon,nan-Pozdrav Iz Zemlje Safari
88,TkHYG/uZ_1_88,Zabranjeno Pušenje,Zabranjeno pušenje,Pravo zajebani DJ iz Chicaga,8081,"Staroj sam popio cijeli vinjak
Almasi rekoh da obuce najzesci minjak
diler Kvaja je jos jucer ost'o bez tableta
oko naseg sehera vrti se planeta

Jer veceras dolazi
veceras dolazi, veceras dolazi
 
Sipac Madjuni je dovez'o za kokice kolica
kaze nikad nije bilo toliko napucanih pica
nacelnik Harun je govorom pozdravio gosta
najvazniji dogadjaj od otvaranja mosta

Faco je dos'o razvaljen k'o deva
u domu naglas krci, na podu DJ zijeva
Slava-kurava prati ga u stopu
ona bi htjela prva u Evropu

Veceras dolazi, veceras dolazi
veceras dolazi 

Pravo zajebani DJ iz Chicaga

Vracamo se kuci, preskacemo bare
kontam kako da eskiviram aperkat od stare
sa minare Hodza uci, odjekuje ezan
k'o da kune mladez u koje usao je Sejtan

Pored nas prodje DJ u blindiranom dzipu
skupio je Slavu i neku sminkersku ekipu
poprsk'o je Almasine najnovije sandale
good bye dreams vracamo se do reale

Jer veceras dolazi, veceras prolazi
veceras odlazi

Pravo zajebani DJ iz Chicaga","https://tekstovi.net/2,550,20862.html",,,,,,,,,,,,,,,,,,"Staroj sam popio cijeli vinjak
Almasi rekoh da obuče najžešći minjak
Diler Kvaja je još jučer ost'o bez tableta
Oko našeg šehera vrti se planeta

Jer večeras dolazi...
Večeras dolazi...
Večeras dolazi...

Šipac Mađuni je dovez'o za kokice kolica
Kaže nikad nije bilo toliko napucanih pica
Načelnik Harun je govorom pozdravio gosta
Najvažniji događaj od otvaranja mosta

Fačo je doš'o razvaljen k'o deva
U domu razglas krči, na podu DJ zijeva
Slava-kurava prati ga u stopu
Ona bi htjela prva u Europu

Večeras dolazi...
Večeras dolazi...
Večeras dolazi...

Pravo zajebani DJ iz Chicaga

Vraćamo se kući, preskačemo bare
Kontam kako da eskiviram aperkat od stare
Sa minare Hodža uči, odjekuje ezan
K'o da kune mladež u koju ušao je Šejtan

Pored nas prođe DJ u blindiranom džipu
Skupio je Slavu i neku šminkersku ekipu
Poprsk'o Almasine najnovije sandale
Good bye dreams vraćamo se do reale

Jer večeras dolazi...
Večeras prolazi...
Večeras odlazi.

Pravo zajebani DJ iz Chicaga",Pravo zajebani DJ iz Chicaga,https://cuspajz.com//tekstovi-pjesama/pjesma/zabranjeno-pusenje/pravo-zajebani-dj-iz-chicaga.html,Zabranjeno Pušenje,Pravo Zajebani DJ Iz Chicaga,,Hodi Da Ti Čiko Nešto Da,,,,nan-Hodi Da Ti Čiko Nešto Da
89,TkHYG/uZ_1_89,Zabranjeno Pušenje,Zabranjeno pušenje,Pred zatvorenim sankom,9767,"Zagrli me fola radi, kao ja sam taj
od neke te mracne bande spasavam
ne misli veceras, gdje bi bila sad
da si znala prave rijeci, da si bila sigurna

Zagrli me fola radi i ne razmisljaj
Nicole Kidman nema nikog da joj ""suplju"" saslusa
zagrli me pravo jako, samo budi tu
da me uhvatis za ruku kad zaurlam u snu
 
Ref.
Moja tuga nije duga
stara sema, isti krug
samo veceras budi sa mnom
samo veceras budi mi drug

Zagrli me iako sam prespor za nafaku
jer ostali smo sami, pred zatvorenim sankom
valjda sve to tako hoda, valjda mac iz kamena
izvuce samo onaj 'ko je odabran

Ref.

Ref.","https://tekstovi.net/2,550,20871.html",,,,,,,,,,,,,,,,,,,,,Zabranjeno Pušenje,Pred Zatvorenim Šankom,,Hodi Da Ti Čiko Nešto Da,,,,nan-Hodi Da Ti Čiko Nešto Da
