Unnamed: 0,Song_ID,Artist,Artist_diskografija,Song_tekstovinet,Views_tekstovinet,Lyrics_tekstovinet,Url_tekstovinet,Writer_lyricstranslate,Song_lyricstranslate,EngTitle_lyricstranslate,Album_lyricstranslate,Lyrics_lyricstranslate,EngLyrics_lyricstranslate,Url_lyricstranslate,Izvedba_diskografija,Album_1_diskografija,Album_2_diskografija,Url_diskografija,Song_diskografija,Aranžman_diskografija,Skladba_diskografija,Stihovi_diskografija,Album_3_diskografija,Album_4_diskografija,Lyrics_cuspajz,Song_cuspajz,Url_cuspajz,Artist_discogs,Song_discogs,Song_duration_discogs,Album_title_discogs,Album_year_discogs,Lyrics By_discogs,Music By_discogs,All_albums_discogs
0,TkHYG/uZ_1_0,Zabranjeno Pušenje,Zabranjeno pušenje,12 sati,27490,"Proslo je 12 sati, mala 
carolije su nestale
konji postase misevi 
a kocije bundeve

Ti si opet jedna 
od smizli dosadnih
a ja nafurani student 
polovni buntovnik
 
Proslo je 12 sati, mala 
carolije su nestale
vrijeme je da se nove 
karte podijele

Veceras moras stisnuti sake 
u oci me gledati
sutra ces opet 
svoje snove zivjeti

Foliram te da drzim igru 
u svojim rukama
foliram te da znam kuda sada 
foliram te da sam jak

Foliram te, ali tramvaj mi 
lezi na grudima
i ja bih malo plakao 
ali glumim frajera

Uzalud mala taj pogled 
kao iz francuskih filmova
idi sada kuci, ima i sutra dan

Jer proslo je 12 sati, mala 
carolije su nestale
konji postase misevi 
a kocije bundeve 
","https://tekstovi.net/2,550,15820.html",,,,,,,,,,,,,,,,,,"	Prošlo je 12 sati, mala, čarolije su nestale,
Konji postaše miševi, a kočije bundeve
Ti si opet jedna od šmizli dosadnih,
A ja nafurani student, polovni buntovnik

Prošlo je 12 sati, mala, čarolije su nestale,
Vrijeme je da se nove karte podijele
Večeras moraš stisnuti šake, u oči me gledati,
Sutra ćeš opet svoje snove živjeti

Foliram te da držim igru u svojim rukama,
Foliram te da znam kuda sada, foliram te da sam jak
Foliram te, ali tramvaj mi leži na grudima,
I ja bih malo plakao, ali glumim frajera

Uzalud mala taj pogled, kao iz francuskih filmova
Idi sada kući, ima i sutra dan
Jer prošlo je 12 sati, mala, čarolije su nestale,
Konji postaše miševi, a kočije bundeve

12 sati",12 sati,https://cuspajz.com//tekstovi-pjesama/pjesma/zabranjeno-pusenje/12-sati.html,Zabranjeno Pušenje,12 Sati,,Male Priče O Velikoj Ljubavi,,,,nan-Male Priče O Velikoj Ljubavi/nan-Kolekcija Hitova Vol. 2
1,TkHYG/uZ_1_1,Zabranjeno Pušenje,Zabranjeno pušenje,Abid,18893,"Preskocim kanal, pogledam na tle
i vidim tebe, Abide
Abide, reci nam, de
sta to tvoje ruke rade

Udarnicki rade, burazere
da bude gasa za sve
sve u sklopu akcije
zastite nase okoline
 
Abide, reci nam, de
otkud za to finansije
dva posto svake plate
niko od nas nije rekao ne

Abide, reci nam, de
je l' jos tvoj mali 
skuplja stare novine
jok, moj burazere
radi u posluzi kod trznice

Abide, reci nam, de
ima l' tu manipulacije
Sarajevo, najmiliji grade
u tebi me mnogi rade

Abide, reci nam, de
hoce l' biti bolje za godinu, dve
Sarajevo, najmiliji grade,
popravismo te do Olimpijade

Kubika

Covjek hoce nesto da te pita
samo da cigaru zapalim
ej, covjek hoce nesto 
da te pita, bolan
samo da cigaru zapalim, jarane

","https://tekstovi.net/2,550,6325.html",,Abid,Abid,,"Preskočim kanal,
Pogledam na tle,
I vidim tebe, Abide
Abide, reci nam, de,
Šta to tvoje ruke rade?. Udarnički rade burazere,
Da bude gasa za sve,
Sve u sklopu akcije
Zaštite naše okoline. Abide, reci nam, de,
Otkud za to finansije?. Dva posto svake plate,
Niko od nas nije rekao ""Ne."". Abide, reci nam, de,
Jel' još tvoj mali skuplja stare novine?. Jok, moj burazere,
Radi u posluzi kod tržnice.. Abide, reci nam, de,
Ima l' tu manipulacije?. Sarajevo, najmiliji grade,
U tebi me mnogi rade. Abide, reci nam, de,
Hoće l' biti bolje za godinu-dve?. Sarajevo, najmiliji grade,
Popravismo te do Olimpijade. Kubika...
Kubika...
Kubika...
Kubika.... Čovjek hoće nešto da te pita
Samo da cigaru zapalim
Čovjek hoće nešto da te pita
Samo da cigaru zapalim
Ej, čovjek hoće nešto da te pita
Samo da cigaru zapalim, jarane.","I skip the street canal,
and look to the ground,
And I see you,Abid
Abid,tell us,com on,
What is that,your hands are doing. Working hard,bro'
So there is gas for everyone
All within the action
for our enviroment protection. Abid,tell us,com on
Where the finances are coming from?. 2% from each pay check
Not one of us said ""no"" to that.. Abid,tell us,com on
Does your kid still colects old papers ?. No,my bro,
Now it works in a grocery store near the market.. Abid,tell us,com on
Is there manipulation ?. Sarajevo,my dearest city,
lot's of people work in here. Abid,tell us,com on,
Is it getting better in a year or two ?. Sarajevo,my dearest city,
We fixed you till the Olympics. cubics.....
cubics.....
cubics......
cubics...... A man wants to ask you something
Wait till I light up the cigarette
A man wants to ask you something
Wait till I light up a cigarette
Hey,man wants to ask you something
Wait till I light up a cigarette,bro",https://lyricstranslate.com/en/abid-abid.html,,,,,,,,,,,"Press:
Preskočim kanal
Pogledam na tle
I vidim tebe Abide
Abide reci nam de
Šta to tvoje ruke rade

Abid:
Udarnički rade burazere
Da bude gasa za sve
Sve u sklopu akcije
Zaštite naše okoline

Press:
Abide reci nam de
Otkud za to finansije

Abid:
Dva posto svake plate
Niko od nas nije rekao ne

Press:
Abide reci nam de
Jel' ti mali skuplja stare novine

Abid:
Jok moj burazere
Radi u posluzi kraj tržnice

Press:
Abide reci nam de
Ima l' tu manipulacije

Abid:
Sarajevo najmiliji grade
U tebi me mnogi rade

Press:
Abide reci nam de
Hoće l' biti bolje za godinu, dv'je

Abid:
Sarajevo najmiliji grade
Popravili smo te do Olimpijade

Kubika, kubika, kubika, kubika
Čovjek hoće nešto da te pita
Samo da cigaru zapalim jarane!

Abid",Abid,https://cuspajz.com//tekstovi-pjesama/pjesma/zabranjeno-pusenje/abid.html,Zabranjeno Pušenje,Abid,,Grupa Za Vas,1983.0,,,"1983.0-Grupa Za Vas/nan-Das Ist Walter/nan-Najveći Hitovi/nan-Srce, Ruke I Lopata /Najveći Hitovi/ 2/nan-Kanjon Drine/nan-The Best Of  Vol. 1/0.0-Das Ist Walter"
2,TkHYG/uZ_1_2,Zabranjeno Pušenje,Zabranjeno pušenje,Agent tajne sile,34305,"Razlio se mjesec po sobi 
punoj tajnih zvukova
to ludi naucnik pravi u mojoj glavi
tebe od sna i sjecanja

K'o lud idem kod nasih starih mjesta
gori li jos svjetlo, je li izasla
skriven iz parka buljim u tebe
i tvog novog frajera
 
Ref.
Ti si zmija, ti si pile
ti si agent tajne sile
ti si vuna i ti si svila
ti si sejtan, ti si vila

Ti si offsajd, ti si gol 
nekad prava, nekad fol
ti si put i ti si zid
ti si down i ti si speed 

Ti imas figuru koja lici na mene
i koju iglom ubadas
i onda bilo gdje 
pred zdravim ljudima
lice krijem rukama

Cigarom progorena zavijesa
u sobi cudnih zvukova
to ludi naucnik pravi u mojoj glavi
tebe od sna i sjecanja

Ref.

Ti si vatra i ti si led
ti si super i ti si bed
ti si ugljen, a i zar
ti si kazna, a i dar

Ti si zmija, ti si pile
ti si agent tajne sile
ti si put, ti si zid
ti si down i ti si speed

Ti me gusis, ti me davis 
ti me rusis, ti me slavis
ti si greska, ti si kvar
moj pocetak i moj kraj","https://tekstovi.net/2,550,6400.html",,,,,,,,,,,,,,,,,,"Da smo se u mjesec po sobi ti
Najtanjih zvukova
To ludi naučnik pravi u mojoj glavi
Tebe od sna i sjećanja

Ko lud idem kod načih starih mjesta
Gori li joč svjetlo jeli izašla
Skriven iza parka buljim u tebe
I tvog novog frajera

Ti si zmija ti si pile, ti si agent tajne sile
Ti si bura i ti si svila, ti si šetnja, ti si vila
Ti si ocat, ti si bol, nekad prava, nekad fol
Ti si putnik, ti si zid, ti si dan i ti si stid

Ti imaš figuru koja lići na mene
I koju iglom ubadaš
I onda bilo gdje pred zdravim ljudima
Lice krijem rukama

Cigarom progorena zavijesa
U sobi čudnih zvukova
To ludi naučnik pravi u mojoj glavi
Tebe od sna i sjećanja

Ti si zmija ti si pile, ti si agent tajne sile
Ti si bura i ti si svila, ti si šetnja, ti si vila
Ti si ocat, ti si bol, nekad prava, nekad fol
Ti si putnik, ti si zid, ti si dan i ti si stid

Ti si vatra i ti si led, ti si super i ti si med
Ti si ugljen a i žar, ti si vatra, a i dar
Ti si zmija ti si pile, ti si agent tajne sile
Ti si putnik ti si zid, ti si dan ti si stid

Ti me gušiš ti me daviš, ti me rušiš, ti me slaviš",Agent tajne sile,https://cuspajz.com//tekstovi-pjesama/pjesma/zabranjeno-pusenje/agent-tajne-sile.html,Zabranjeno Pušenje,Agent Tajne Sile,3:26,Agent Tajne Sile,,Sejo Sexon,Sejo Sexon,nan-Agent Tajne Sile/2009.0-The Ultimate Collection
3,TkHYG/uZ_1_3,Zabranjeno Pušenje,Zabranjeno pušenje,Agregat,12622,"Fuada Midzica 19, zgrada k'o i druge
nekom kazes vozdra, nekom dobar dan
nikom' nisi pogled'o u dusu
nikog' nisi zvao kad bi bio sam

Al' vel'ku igru zaigrase igraci
a na nebu se javi losi znak
ljudi postase nemirni i cudni
na nesrecu i suze zamirisa zrak
 
Huk topova i saptaji u mraku
gdje to puca, kad ce doci red na nas
kad jedno jutro bahnu Zoka s elektromotorom
„Ej, raja, hajmo pravit agregat

Ref.
Sad ste donji veliki igraci
u nasa srca unijeli ste hladnocu i mrak
al' na Kosevu ce opet gorit svjetlo
Fuada Midzica 19 pravi agregat

I Fahro rece „Neka bude svjetlo“
agregat nek' tisinu zaore
da palimo lampe i masine
da palimo televizore

Trci, trazi, skupljaj materijal
zivot se opet vracao u nas
ruka ruci ljudi cista srca
Fuada Midzica 19 pravi agregat

Ref.

Sad ste donji veliki igraci
mi smo braca, mi smo armija
ruka ruci ljudi cista srca
Fuada Midzica 19 pravi agregat","https://tekstovi.net/2,550,20876.html",,,,,,,,,,,,,,,,,,,,,Zabranjeno Pušenje,Agregat,,Hodi Da Ti Čiko Nešto Da,,,,nan-Hodi Da Ti Čiko Nešto Da/2009.0-The Ultimate Collection
4,TkHYG/uZ_1_4,Zabranjeno Pušenje,Zabranjeno pušenje,Anarhija all over Bascarsija,19479,"Sejo se danas super osjeca
sinoc je na ulici razbio hipika
mali je pokrio lice rukama
ali je ostao bez bubrega

Sejo se malo muci dok razmislja
ali sinoc ga nije izradila riba
otpucao je odmah dva samara
kad ga je za mecu slagala
 
Anarhija all over Bascarsija
Sejo se danas super osjeca
2x

Sejo voli Hanku i Sabana
nervira ga ono A po zidovima
Sejo je sinoc razbio hipika
Sejo je junak s Vratnika

New Primitives all over Bascarsija
Sejo se gnusa zapada
2x","https://tekstovi.net/2,550,8211.html",N.karajlić,Anarhija all over Baščaršija,Anarchy all over Bascarcija,,"Sejo se danas super osjeća,
1
Sinoć je na ulici razbio hipika
Mali je pokrio lice rukama,
Ali je ostao bez bubrega. Sejo se malo muči dok razmišlja,
Ali sinoć ga nije izradila riba
Otpučao je odmah dva šamara,
Kad ga je za mecu slagala. Anarhija all over Bascarsija,
Sejo se danas super osjeća. Anarhija all over Bascarsija,
Sejo se danas super osjeća. Sejo voli Hanku i Šabana,
Nervira ga ono A po zidovima
Sejo je sinoć razbio hipika,
Sejo je junak s Vratnika. New Primitives all over Bascarsija,
Sejo se gnuša Zapada. New Primitives all over Bascarsija,
Sejo se gnuša Zapada","Sejo is feeling great today,
Last night he beated the hippie on the street,
The kid used hands to cover his face,
but still he got punched to the kidneys. Sejo is struggling a bit while thinking,
but last night he did not get fooled by chick,
two slaps she got instantly
when she lied about her period.. Anarchy all over Bascarsija
Sejo is feeling great today,. Sejo likes Hanka and Saban,
That ""A"" on the walls gets on his nervs,
Sejo beated the hippie last night,
Sejo is a hero from Vratnik.. New Primitives all over Bascarsija
Sejo detest the West. (2x)",https://lyricstranslate.com/en/anarhija-all-over-bascarsija-anarchy-all-over-bascarcija.html,,,,,,,,,,,"Sejo se danas super osjeća
Sinoć je na ulici razbio hipika
Mali je pokrio lice rukama
Ali je ostao bez bubrega

Sejo se malo muči dok razmišlja
Sinoć ga nije izradila riba
Opuco joj je odmah dva šamara
Kad ga je za mecu slagala

Anarhija all over Baščaršija...

Sejo voli Hanku i Šabana,
Nervira ga ono ""A"" po zidovima
Sejo je jučer razbio hipika
Sejo je junak s Vratnika

New primitivs all over Baščaršija
Sejo se gnuša zapada

Anarhija all over Baščaršija",Anarhija all over Baščaršija,https://cuspajz.com//tekstovi-pjesama/pjesma/zabranjeno-pusenje/anarhija-all-over-bascarsija.html,Zabranjeno Pušenje,Anarhija All Over Baščaršija,,Grupa Za Vas,1983.0,,,1983.0-Grupa Za Vas/nan-Das Ist Walter/nan-Najveći Hitovi/nan-Na Straži Pored Prizrena/2009.0-The Ultimate Collection/nan-The Best Of/0.0-Das Ist Walter
5,TkHYG/uZ_1_5,Zabranjeno Pušenje,Zabranjeno pušenje,Arizona dream (duet Ivanka Mazurkijevic),46069,"Vozio sam starog Deutza
slus'o Cecu, cesk'o jajca
kratka rijec, a slozen um
kap slobode, ravan drum
malo sitne sane, tura pica za jarane
tako zivjeli samo mi na Arizona pijaci
 
I parkiram svoj Deutz
pred gazda Mehin plac
i vidim novosti
nik'o kafic, nik'o gril
sto bi rekli skeptici
bofl roba, blato, jad
al' tu si jaro mog'o vidjet'
tu se radja grad

Kad pojavi se ona
u jakni od najlona
moj mali andjeo 
sa dupljak Rolexom
kaze, Meho juce pao
al' ti nemoj skrletit'
nego parkiraj se tu
os sta pojest', os sta pit'

Rekoh sebi super riba
uto zacvili getriba
ko svaki maco tip
dobra vibra, al' los trip
prebacih u brzinu
i smotah u krivinu
da me ne bi spopali
ljubav i ti folovi
ostade u prasini, samo glas joj zazvoni
ako opet prodjes svrati ponekad

Ref.
Navrati ponekad, navrati ponekad
te su rijeci bile vazne
one nisu bile lazne
al' ponekad promaknu

Navrati ponekad, navrati ponekad
u glavi jos mi bubnje
e pa, Miki, eto sumnje
ti bi nekom vjerov'o

Bio sam kralj cesta
od Neuma do Novog Mesta
znao sve kafane
marisane i muriju
malo sitne sane
tura pica za jarane
sa svakim djeli sve
tugu cuvaj za sebe

Al' navece kad bih leg'o
i u glavi sve se sleglo
kilometri, gradovi
zasijao njen bi lik
u toj mojoj viziji
ko u spanskoj seriji
rekla bi mi ona
kao onaj dan navrati ponekad

Ref.

Jednog mi dana pukne film
nasred ceste 43
i okrenem svoj Deutz
pravac gazda Mehin plac
i vidim novisti, nik'o kafic, nik'o gril
za nju cujem nasla srecu, nasla dom

I danas vozim Deutza
slusam Cecu, ceskam jajca
s tim sto sada znam
da kad srecu ugledam
ne prebacujem u brzinu
i ne fatam krivinu
i neke rijeci vise cijenim sad
kao na primjer

Ref.

Ljuljaj, ne ljuljaj
Doboj, Tuzla, Karakaj
Derventa, Kalesija
srcu mome najmilija","https://tekstovi.net/2,550,8566.html",Davor Sučić,Arizona Dream,Arizona Dream,Bog vozi Mercedes,"Vozio sam starog Deutza
Sluš'o Cecu, češk'o jajca
Kratka riječ, a složen um,
Kap slobode, ravan drum
Malo sitne šane
Tura pića za jarane
Tako živjeli smo mi
Na Arizona pijaci. I parkiram svoj Deutz
Pred gazda Mehin plac
I vidim novosti
Nik'o kafić, nik'o grill
Što bi rekli skeptici
Bofl roba, blato, jad,
Al' tu si jaro mog'o vidjet'
Tu se rađa grad. Kad pojavi se ona
U jakni od najlona
Moj mali anđeo
S dupljak Rolexom
Kaže: ""Meho juče' pao
Al' ti nemoj srkletit'
Nego parkiraj se tu
Oš šta pojest', oš šta pit'?"". Rekoh sebi super riba
Uto zacvili getriba
K'o svki mačo tip
Dobra vibra, al' loš trip
Prebacih u brzinu
I smotah u krivinu
Da me ne bi spopali
Ljubav i ti folovi. Ostade u prašini
Samo glas joj zazvoni
""Ako opet prođeš
svrati ponekad"". Navrati ponekad, navrati ponekad
Te su riječi bile važne,
One nisu bile lažne,
Al' ponekad promaknu. Navrati ponekad, navrati ponekad
U glavi još mi bubnje
E pa Miki eto sumnje
Ti bi nekom vjerov'o. Bio sam kralj cesta
Od Neuma do Novog Mesta
Znao sve kafane, marisane
I muriju
Malo sitne šane
Tura pića za jarane
Sa svakim dijeli sve
Tugu čuvaj za sebe. Al' naveče' kad bih leg'o,
I u glavi sve se sleglo,
Kilometri, gradovi,
Zasijao njen bi lik
U toj mojoj viziji
K'o u španskoj seriji
Rekla bi mi ona
Kao onaj dan: ""Navrati ponekad"". Navrati ponekad, navrati ponekad
Te su riječi bile važne
One nisu bile lažne
Al' ponekad promaknu. Jednog mi dana pukne film
Nasred ceste 43
I okrenem svoj Deutz
Pravac gazda Mehin plac
I vidim novosti
Nik'o kafić, nik'o grill
Za nju čujem
Našla sreću, našla dom. I danas vozim Deutza
Slušam Cecu, češkam jajca
S tim što sada znam
Da kad sreću ugledam
Ne prebacujem u brzinu,
I ne fatam krivinu
I neke riječi više cijenim sad
Kao na primjer:. Navrati ponekad, navrati ponekad
Te su riječi bile važne,
One nisu bile lažne
Al' ponekad promaknu. Navrati ponekad, navrati ponekad
U glavi još mi bubnje
E pa Miki eto sumnje
Ti bi nekom vjerov'o. ""Ljuljaj, ne ljuljaj. Doboj, Tuzla, Karakaj.
Derventa i Kalesija srcu mome najmilija... ""","I drove an old Deutz,
heard Ceca Songs, scratched my balls.
Short word, complex brain,
a drop of freedom, even road.
A little bit of small entrenchments,
a round of drinks for my friends,
that is how we lived
at the Arizona market.. I park my Deutz
in front of the place of boss Meho.
And I see the news,
new club, new grill
skeptical people would say
trash goods, mud, sorrow
but, my friend, you could see it
here a city is born.. When she appears
in a nylon jacket,
my little angel
with double Rolex.
She says ""Meho fell yesterday,
but you don't bother
just park here,
something to eat or drink?"". I told myself ""What a girl""
and just then the transmissions started squeaking.
As every macho man,
good vibration, but a bad trip.
I changed the gear up
and took the curve
so that love and similar things
do not overtake me.. She stayed in the dust,
only her voice rang
""If you are here again,
come around sometimes."". Come around sometimes, come around sometimes,
these words were important,
they were not false,
but sometimes you miss them.. Come around sometimes, come around sometimes,
this voice is still in my head.
So, Miki, doubt Comes,
you would believe someone.. I was the king of the roads
between Neum and Novo Mesto.
I knew every pub
and the cops.
A little bit of small entrenchments,
a round of drinks for my friends,
that is how we lived
at the Arizona market.. But at night when I would go to bed
and everything would settle down in my head
kilometres, cities,
her face would shine
in my vision
and as in a Latin soap opera
she would tell me
as that day ""Come around sometimes"".. Come around sometimes, come around sometimes,
these words were important,
they were not false,
but sometimes you miss them.. One day I could not stand it anymore
in the middle of road 43,
I turned back my Deutz
in direction of the place of boss Meho.
And I see the news,
new club, new grill,
I hear about her,
she found her luck, her home.. Today I also drive I Deutz
hear Ceca Songs, scratch my balls.
With the difference that now I know
that when I face luck
I don't change the gears up,
I don't take the curve
and now I value some words more.
As for example..... Come around sometimes, come around sometimes,
these words were important,
they were not false,
but sometimes you miss them.. Come around sometimes, come around sometimes,
this voice is still in my head.
So, Miki, doubt Comes,
you would believe someone.. Rock, don't rock, Doboj, Tuzla, Karakaj,
Derventa and Kalesija are the favourite ones of my heart.",https://lyricstranslate.com/en/arizona-dream-arizona-dream.html,,,,,,,,,,,,,,Zabranjeno Pušenje,Arizona Dream,4:47,Bog Vozi Mercedes,,,,nan-Bog Vozi Mercedes
6,TkHYG/uZ_1_6,Zabranjeno Pušenje,Zabranjeno pušenje,Balada o Gigi Bosnicu,6748,"KK Kosevo je bila ekipa solidna
Boro, Skeli, Cuba, Trile
u dusu svak se zna
al' drmala je tom fildzan ligom

Zbog legendarnog kapitena
Gige Bosnica
bilo je to zlatno doba
naseg basketa
 
Rusi poslase u Sibir
5-6 trenera
a mi se kladili jesu'l rolinzi
bolji kod Gige il' kod Delibasica

23-eg maja
protiv KK ""Alhosa""
dosli da ga vide ljudi
malo vazniji

Al' Gigo je svu noc
sa rajom ruzio
tog dana nije bio
najprecizniji

Ref.
I tako malo rada
a puno talenta
malo povrede
a malo ""Vechia""

Tek jednog dana
Gigo Bosnic zakuca
na vrata zaboravljenih
asova

Tih dana mu se u glavi
desi neki kvar
prica o politici
za nacionalnu stvar

Zavrce ture na sanku
kaze radi za stranku
procenat ispod 31
iso je na Gazimestan

Ref.

Tek osvanu Gigo tog aprila
kraj haubice
konacno je imo
cijeli grad ispod sebe

Za sve dosudjene korake
za sve sudijske nepravde
za sve promasene zicere
za sve sto ga nisu voljele
za Kosevo, za Vratnik, Maltu

Za citav svijet
Gigo Bosnic puni sad
kalibar 155
u rovu, u mraku

Kraj terena ""Koseva""
izgorile su table
pala je konstrukcija
al' samo jednu stvar

Bi' jos da upitam
bili ta prica bila drugacija
da je usla ona trica protiv
KK ""Alhosa""

Ref.","https://tekstovi.net/2,550,41896.html",,Balada o Gigi Bosniću,Ballad about Gigo Bosnić,,"KK Koševo je bila ekipa solidna
1
Boro, Skeli, Cuba, Trile
U dušu svak se zna,
Al' drmala je tom fildžan ligom
Zbog legendarnog kapitena Gige Bosnića. Bilo je to zlatno doba našeg basketa
Rusi poslaše u Sibir pet-šest trenera
A mi se kladili jesu'l rolinzi
Bolji kod Gige il' kod Delibašića. 23-eg maja protiv KK ""Alhosa""
Došli da ga vide ljudi malo važniji
Al' Gigo je svu noć sa rajom ružio
Toga dana nije bio najprecizniji. I tako malo rada puno talenta
Malo povrede a malo ""Vecchia""
Tek jednog dana Gigo Bosnić zakuca
Na vrata zaboravljenih asova. Tih dana mu se u glavi desi neki kvar
Priča o politici, za nacionalnu stvar
Zavrće ture na šanku, kažu radi za stranku
Procenat ispod 31, išo je na Gazimestan. I tako malo rada puno talenta
Malo povrede a malo ""Vecchia""
Tek osvanu Gigo tog aprila kraj haubice
Konačno je imao cijeli grad ispod sebe. Za sve dosuđene korake
Za sve sudijske nepravde
Za sve promašene zicere
Za sve što ga nisu voljele
Za Kosevo, za Vratnik, Maltu
Za čitav svijet
Gigo Bosnić puni sad
Kalibar 155. U rovu u mraku, kraj terena ""Koševa""
Izgorile su table, pala je konstrukcija
Al' samo jednu stvar bi' još da upitam:
Bi li priča ta bila drugačija
Da je ušla ona trica protiv KK ""Alhosa""?. I tako malo rada...","Basketball club ""Koševo"" was a good team
Boro, Skeli, Cuba, Trile
We know everyone by heart
But they ruled that ""fildžan"" league
Because of legendary captain, Gigo Bosnić. It was the golden age of our basketball
Russians sent 5-6 coaches to the Siberia
And we discussed who had better rollings -
Gigo or Delibašić. On May 23rd, against Basketball club ""Alhos""
Very important people came to see him
But Gigo partied with his crew the whole night
He wasn't very precise that day. A little bit of effort and a lot of talent
A few injuries and few sips of ""Vecchia""
Suddenly, Gigo Bosnić knocked on the door
Of the forgotten champions. Something happened inside his head
He started talking about politics, about nationalities
He is buying everybody drinks, he says that he works for the party
The percentage under 31, he visited Gazimestan. A little bit of effort and a lot of talent
A few injuries and few sips of ""Vecchia""
That April, Gigo found himself next to the howitzer
He finally had the entire town beneath him. For all of the steps
For every injustice by the referees
For every missed point
For every girl that didn't like him
For Koševo, for Vratnik, for Malta
For the entire world
Gigo Bosnić is now loading caliber 155. In the trench, in dark, next to the ""Koševo"" court
Scoreboards were burnt, the construction had fallen
And I just want to ask one thing:
Would it all be different
If he scored that 3 points against ""Alhos""?. A little bit of effort...",https://lyricstranslate.com/en/balada-o-gigi-bosnicu-ballad-about-gigo-bosnic.html,,,,,,,,,,,"KK Koševo je bila ekipa solidna
Boro, Skeli, Cuba, Trile
U dušu svak se zna,
Al' drmala je tom fildžan ligom
Zbog legendarnog kapitena Gige Bosnića

Bilo je to zlatno doba našeg basketa
Rusi poslaše u Sibir pet-šest trenera
A mi se kladili jesu'l rolinzi
Bolji kod Gige il' kod Delibašića

23-eg maja protiv KK ""Alhosa""
Došli da ga vide ljudi malo važniji
Al' Gigo je svu noć sa rajom ružio
Toga dana nije bio najprecizniji

I tako malo rada puno talenta
Malo povrede a malo ""Vecchia""
Tek jednog dana Gigo Bosnić zakuca
Na vrata zaboravljenih asova

Tih dana mu se u glavi desi neki kvar
Priča o politici, za nacionalnu stvar
Zavrće ture na šanku, kažu radi za stranku
Procenat ispod 31, išo je na Gazimestan

I tako malo rada puno talenta
Malo povrede a malo ""Vecchia""
Tek osvanu Gigo tog aprila kraj haubice
Konačno je imao cijeli grad ispod sebe

Za sve dosuđene korake
Za sve sudijske nepravde
Za sve promašene zicere
Za sve što ga nisu voljele
Za Kosevo, za Vratnik, Maltu
Za čitav svijet
Gigo Bosnić puni sad
Kalibar 155

U rovu u mraku, kraj terena ""Koševa""
Izgorile su table, pala je konstrukcija
Al' samo jednu stvar bi' još da upitam:
Bi li priča ta bila drugačija
Da je ušla ona trica protiv KK ""Alhosa""?

I tako malo rada...",Balada o Gigi Bosniću,https://cuspajz.com//tekstovi-pjesama/pjesma/zabranjeno-pusenje/balada-o-gigi-bosnicu.html,Zabranjeno Pušenje,Balada O Gigi Bosniću,4:58,Fildžan Viška,,,,nan-Fildžan Viška
