Song_ID,Artist,Artist_diskografija,Song_tekstovinet,Views_tekstovinet,Lyrics_tekstovinet,Url_tekstovinet,Writer_lyricstranslate,Song_lyricstranslate,EngTitle_lyricstranslate,Album_lyricstranslate,Lyrics_lyricstranslate,EngLyrics_lyricstranslate,Url_lyricstranslate,Skladba_diskografija,Stihovi_diskografija,Izvedba_diskografija,Album_1_diskografija,Album_2_diskografija,Url_diskografija,Song_diskografija,Aranžman_diskografija,Album_3_diskografija
YdU8F5rG_1_43,Jelena Rozga,Jelena Rozga,Sve se meni cini,53286,"Jos si uvijek ljubav moja
sreca moja jedina
sto po srcu i u ponoc
i u podne isto udara

Ref.
Sve se meni cini da
volim te bez razloga
al' ne mogu protiv sebe ja
nada umre posljednja
 
Sve se meni cini da
volim te bez razloga
al' jos uvijek sebe tjesim
da to nije istina

Na tebi se ne bi reklo
da su prosle godine
na meni se one vide
vidi ko me dobro poznaje

Ref.

Ref.","https://tekstovi.net/2,1156,19969.html",,Sve se meni čini,Everything seems to me,Oprosti mala,"Još si uvijek ljubav moja
1
Sreća moja jedina
Što po srcu i u ponoć
I u podne isto udara. Sve se meni čini da
volim te bez razloga
Al' ne mogu protiv sebe ja
Nada umre posljednja. Sve se meni čini da
Volim te bez razloga
Al' još uvijek sebe tješim
Da to nije istina. Na tebi se ne bi reklo
Da su prošle godine
Na meni se one vide
Vidi 'ko me dobro poznaje. Sve se meni čini da
volim te bez razloga
Al' ne mogu protiv sebe ja
Nada umre posljednja. Sve se meni čini da
Volim te bez razloga
Al' još uvijek sebe tješim
Da to nije istina. Nada umre posljednja ...","You're still my love
My only happiness
That's been hitting my heart
During the midnight and day. Everything seems to me that
I love you without a reason
But I can't go against myself
Hope dies last. Everything seems to me that
I love you without a reason
But I'm still trying to convince myself
That it's not true. No one would be able to tell
That you have aged
But you can see I have aged
Those who know me well can see. Everything seems to me that
I love you without a reason
But I can't go against myself
Hope dies last. Everything seems to me that
I love you without a reason
But I'm still trying to convince myself
That it's not true. Hope dies last...",https://lyricstranslate.com/en/sve-se-meni-%C4%8Dini-everything-seems-me.html,['Tonči Huljić'],['Vjekoslava Huljić'],['Jelena Rozga'],,,https://diskografija.com/pjesma/sve-se-meni-cini-9892.htm,Sve se meni čini,['Remi Kazinoti'],
YdU8F5rG_1_44,Jelena Rozga,Jelena Rozga,"Svega ima, al' bi jos",19759,"Dobro dos'o u moj stan
neces tako brzo van
a kad sreca meni da svoj glas
nece zaspat' nijedno od nas, od nas

Ponavljamo gradivo
do kraja pa nanovo
ubijamo se od ucenja
ma nema kave, nema predaha
 
Ref.
Ma tko mi zvoni
zvoni, zvoni cijeli dan
mene nema, ponavljam
jer na sedmom nebu sam

I svega ima, ima, ima
al' bi jos, i jos, i jos
pa da sutra ne kazem
da je zivot bio los","https://tekstovi.net/2,1156,31337.html",,"Svega ima, al' bi još",There's All Kinds of Things Here But I Want More,,"Dobro doš'o u moj stan
1
nećeš tako brzo van,
a kad sreća meni da svoj glas
neće zaspati ni jedno od nas,
od nas.... Ponavljamo gradivo
do kraja pa nanovo,
ubijamo se od učenja
ma nema kave nema predaha. Ma tko mi zvoni
zvoni, zvoni cijeli dan
mene nema ponavljam
jer na sedmom nebu sam,. I svega ima
ima, ima al' bi još i još i još,
pa da sutra ne kažem
da je život bio loš
da je život bio loš","Welcome to my apartment
you won't get out that easily,
and when I'm happy that my voice
won't make neither of us fall asleep
neither of us...
We're repeating the same material
till the end and all over again,
we're dying from learning
well, if there's no coffee, there's no respite
Well, who's ringing my door bell
ringing, ringing it for the whole day
and I'm not here again
'cause I'm on the 1seventh heaven
And there's all kinds of things here
there is, there is, but I want more and more and more,
so that tomorrow I won't say
that life was bad
that life was bad",https://lyricstranslate.com/en/svega-ima-al-bi-jo%C5%A1-theres-all-kinds-things-here-i-want-more.html,,,['Jelena Rozga'],,,https://diskografija.com/pjesma/svega-ima-al-bi-jos-14703.htm,"Svega ima, al' bi još",,
YdU8F5rG_1_45,Jelena Rozga,Jelena Rozga,Sveto pismo,6610,"Skoro smo naucili
 govor ljubavi
znali ga, pa ne znali
 i izgubili

Na vrh jezika bilo nam je
kako ostat', a isli dalje
tako smo se lako predali
nismo to, nismo to trebali
 
Ref.
Bila nam je ljubav Sveto pismo
bila nam je, ali vise nismo
ono sto smo bili 
sve pokvarili smo

Ova ljubav nam iz ruke jela
prvo dala onda oduzela
bez tebe ne mogu
 a s' tobom ne valja

Jer smo ti, jer smo ti, ti i ja
k'o bonaca i mecava

Na vrh jezika bilo nam je
kako ostat’, a isli dalje
tako smo se lako predali
nismo to, nismo to trebali

Sto ce meni sada netko treci
kad si dao ti ime sreci
tu je tocka, zatvara se krug
al' uzalud, luda ja i ti lud

Ref.","https://tekstovi.net/2,1156,59731.html",,Sveto pismo,Scripture,,"Skoro smo naučili, govor ljubavi
1
Znali ga, pa ne znali, i izgubili
Na vrh jezika bilo nam je
Kako ostat’, a išli dalje
Tako smo se lako predali,
Nismo to, nismo to trebali. Bila nam je ljubav Sveto pismo
Bila nam je, ali više nismo
Ono što smo bili sve pokvarili smo
Nismo to, nismo to, ti i ja. Ova ljubav nam iz ruke jela
Prvo dala onda oduzela
Bez tebe ne mogu, a s’ tobom ne valja
Jer smo ti, jer smo ti, ti i ja
K’o bonaca i mećava. Na vrh jezika bilo nam je
Kako ostat’, a išli dalje
Tako smo se lako predali,
Nismo to, nismo to trebali. Što će meni sada netko treći
Kad si dao ti ime sreći
Tu je točka zatvara se krug
Al’ uzalud, luda ja i ti lud. Bila nam je ljubav Sveto pismo
Bila nam je, ali više nismo
Ono što smo bili sve pokvarili smo
Nismo to, nismo to, ti i ja. Ova ljubav nam iz ruke jela
Prvo dala onda oduzela
Bez tebe ne mogu, a s’ tobom ne valja
Jer smo ti, jer smo ti, ti i ja
K’o bonaca i mećava. Bila nam je ljubav Sveto pismo
Bila nam je, ali više nismo
Ono što smo bili sve pokvarili smo
Nismo to, nismo to, ti i ja. Ova ljubav nam iz ruke jela
Prvo dala onda oduzela
Bez tebe ne mogu, a s’ tobom ne valja
Jer smo ti, jer smo ti, ti i ja
K’o bonaca i mećava","We almost learned, the speech of love
We knew him, so we didn't know, and we lost
It was on top of our tongues
How to stay, and we moved on
We gave up so easily
We didn't, we didn't need that. Love was Scripture for us
She was, but we are not anymore
What we were, we spoiled everything
We are not this, we are not this, you and me. This love ate from our hands
First she gave, then taken away
I can't without you, and it's wrong with you
Because you, because you, you and me are
Like calm and blizzard. It was on top of our tongues
How to stay, and we moved on
We gave up so easily
We didn't, we didn't need that. Why do I need someone else now?
When you named happiness
There is a point, the circle closes
But in vain, I am crazy and you are crazy. Love was Scripture for us
She was, but we are not anymore
What we were, we spoiled everything
We are not this, we are not this, you and me. This love ate from our hands
First she gave, then taken away
I can't without you, and it's wrong with you
Because you, because you, you and me are
Like calm and blizzard. Love was Scripture for us
She was, but we are not anymore
What we were, we spoiled everything
We are not this, we are not this, you and me. This love ate from our hands
First she gave, then taken away
I can't without you, and it's wrong with you
Because you, because you, you and me are
Like calm and blizzard",https://lyricstranslate.com/en/sveto-pismo-scripture.html,,,,,,,,,
YdU8F5rG_1_46,Jelena Rozga,Jelena Rozga,Svjetla neona,2862,"Mozda sam u pravu, a mozda u krivu
al' nisam vise zena za idilu
ne mogu to gledati, izvoli mi predati
kljuceve zivota mog

Ti svako zlato pretvaras u blato 
cinis to hladnokrvno 
i jednom prodje svaka nocna mora
proci ces i ti kao glavobolja
 
Ref.
Svjetla neona lice otkrivaju
caste me picem svi koji ne smiju
sve pase i treba mi 
ovakva noc da me pokvari

Srce si moje benzinom polio
nasmijao se, sibicu bacio
i nocas gorit ce grad
treba mi mlad, lijep i jak
a ne manijak

Mozda sam u pravu, a mozda u krivu
al' nisam vise zena za idilu
i jednom prodje svaka nocna mora
proci ces i ti kao glavobolja

Ref.

Ref. 2x

I nocas gorit ce grad
treba mi mlad, lijep i jak
a ne manijak","https://tekstovi.net/2,1156,54424.html",,Svjetla neona,Neon lights,,"Možda sam u pravu, a možda u krivu,
1
Al' nisam više žena za idilu.
Ne mogu to gledati, izvoli mi predati
ključeve života mog.. Ti svako zlato pretvaraš u blato,
činiš to hladnokrvno.
I jednom prođe svaka noćna mora,
proći ćeš i ti kao glavobolja.. Svjetla neona lice otkrivaju,
Časte me pićem svi koji ne smiju,
sve paše i treba mi
ovakva noć da me pokvari.. Srce si moje benzinom polio,
nasmijao se, šibicu bacio.
I noćas gorit će grad,
treba mi mlad, lijep i jak, a ne manijak.. Možda sam u pravu, a možda u krivu,
al' nisam vise žena za idilu.
I jednom prođe svaka noćna mora,
proći ćeš i ti kao glavobolja.","Maybe I'm right, and maybe I'm wrong,
But I'm not a woman for idyll anymore.
I can't watch it, excuse me and give me back
the keys to my life.. You transform every gold to mud,
you make it coolly (with cold blood)
And once every nightmare will pass by,
You'll also pass by like a headache.. Neon lights reveal faces,
Everyone who shouldn't do that offers (treats) me drinks
Everything fits and I need
Such night to spoil me.. You poured benzine (gasoline) on my heart,
You laughed, threw a match.
And tonight city will be burning,
I need a young, pretty and strong one, not a maniac.. Maybe I'm right, and maybe I'm wrong,
But I'm not a woman for idyll anymore.
I can't watch it, excuse me and give me back
the keys to my life.",https://lyricstranslate.com/en/svjetla-neona-neon-lights.html,,,,,,,,,
YdU8F5rG_1_47,Jelena Rozga,Jelena Rozga,Trosi i uzivaj,593,"Ratujem s tobom za sve
najdraza rijec mi je ne
i vec neko vrijeme trazis mi zamjene
pitam se je l' do mene

I samo te molim 
da te zadovoljim 
jos jednom te zamolim
 
Ref.
Bar jednu dvije noci mi ostavi
da vidis sve bez cega ces ostati
jer ova je ljubav lopovskog roda
sve mi ukrade i sve tebi proda
nista me ne pitaj trosi i uzivaj

Par slova rekla bi' ti
ne mogu docekati
i vec neko vreme trazis mi zamjene
pitam se je l' do mene

Ref. 2x","https://tekstovi.net/2,1156,63013.html",,,,,,,,,,,,,,,,
YdU8F5rG_1_48,Jelena Rozga,Jelena Rozga,Tsunami,50178,"Tu nema pravde
tu nema kruha
tu gdje je prosla tvoja ruka

Ti ides vani ko Tsunami
i drugu grlis oko struka
ti ides kuci pjevajuci
 
A ja moram biti sama 
ma jos je dobra pamet moja
ja ostavljam te ovih dana
ostavljam te ovih dana

Ref.
Ti ne znas da sam tu
pa ona pijana do pola 
ti plese oko stola i vidis samo nju 
a ja ne dam da pravis me budalom
ni-na 

A ti bi malo jednu, pa drugu, pa dvije
a tako mili odlazi do vraga sve
i nema niceg izmedju tebe i nje
ako tebe pita, ma vise nisi bitan

Ja necu dalje jer nemas sluha
i ne slusas me ni trenutka

Ref.","https://tekstovi.net/2,1156,47502.html",,Tsunami,Tsunami,,"Tu nema pravde,
1
tu nema kruha,
tu gdje je prošla tvoja ruka
Ti ideš vani ko' tsunami
i drugu grliš oko struka
Ti ideš kući, pjevajući
a ja moram biti sama
Ma još je dobra pamet moja
ja ostavljam te ovih dana
ostavljam te ovih dana. REF: Ti ne znaš da sam tu
a ona, pijana do pola
ti pleše oko stola
ti vidiš samo nju
a ja ne dam
da praviš me budalom ni dan
a ti bi malo
Jednu, pa drugu, pa dvije
a tako mili odlazi do vraga sve
i nema ničeg između tebe i nje
ako tebe pitam
al' više nisi bitan. Ja neću dalje
jer nemaš sluha
i ne slušaš me ni trenutka
Ti ideš vani ko' tsunami
i drugu grliš oko struka
Ti ideš kući, pjevajući
a ja moram biti sama
Ma još je dobra pamet moja
ja ostavljam te ovih dana
ostavljam te ovih dana. Ref. x2","There's no justice here
there's no bread here
where your hand passed along
you go out like a tsunami
and you're holding someone else by the waist
you go home singing
but I have to be alone
my mind is still sane
I'm leaving you these days
leaving you these days. Ref.
You don't know that I'm here
but she is dancing around your
table halfway drunk
you only see her
but I won't let you make
a fool out of me at all
but you like to be with one
then the other, then with two
this way, my dear everything will go to hell
and there's nothing between
you and her if I ask you
but you're not important anymore. I won't go further
because you lack hearing
and you don't listen to me at all
you go out like a tsunami
and you're holding someone else by the waist
you go home singing
but I have to be alone
my mind is still sane
I'm leaving you these days
leaving you these days",https://lyricstranslate.com/en/tsunami-tsunami.html-1,,,['Jelena Rozga'],,,https://diskografija.com/pjesma/tsunami-24787.htm,Tsunami,,
YdU8F5rG_1_49,Jelena Rozga,Jelena Rozga,Udajem se,7920,"Sto jos imam za izgubiti
kad sve zbrojim, nije bog zna sto
svoje snove, svoje nade, vec sam prezalila
one noci kad sam te prekrizila

On je dobar covjek, bolji od tebe
dao mi je sve sto moze dati
pristala sam, sto sam mogla, dusu prevarila
tek da ne bi u samoci ostarila
 
Ref.
Udajem se, sreco moja 
ove subote
udajem se, tugo moja 
al' za tebe ne
idem protiv srca svoga
udajem se za drugoga
kad me za se nisi htio ti

Sto jos imam za izgubiti
kad sve zbrojim, nije bog zna sto
svoje snove, svoje nade, vec sam prezalila
one noci kad sam te prekrizila

Ref.2x

Ne dolazi na vjencanje
nisi pozvan ti
pusti da bar tih par sati
na te ne mislim

Ref.","https://tekstovi.net/2,1156,51390.html",,Udajem se,I'm Getting Married,,"Što još imam za izgubiti,
1
Kad sve zbrojim, nije bogzna što,
Svoje snove, svoje nade, već sam prežalila
One noći kad sam te prekrižila.
On je dobar čovjek, bolji od tebe
Dao mi je sve što može dati
Pristala sam, što sam mogla, dušu prevarila
Tek da ne bi u samoći ostarila.. Udajem se, srećo moja
Ove subote
Udajem se, tugo moja
Al' za tebe ne...
Idem protiv srca svoga
Udajem se za drugoga
Kad me za se nisi htio ti.... Ne dolazi na vjenčanje
Nisi pozvan ti
Pusti da bar tih par sati
Na te ne mislim...","What else do I have to lose?
When I add it all up, it's not worth a mention.
My dreams, my hopes, I've got over all that already
On the night when I took you off my list.
He's a good man, better than you
He gave me all he can give.
I said yes, what could have I done? I tricked my soul
Just so I wouldn't grow old alone.. I'm getting married, my happiness
This saturday
I'm getting married, my sadness,
But not for you...
I'm going against my heart
I'm marrying another man
Since you didn't want me for yourself..... Don't come to the wedding
You're not invited
Let go of me so at least for those few hours
I wouldn't think of you...",https://lyricstranslate.com/en/udajem-se-im-getting-married.html,,,['Jelena Rozga'],,,https://diskografija.com/pjesma/udajem-se-26572.htm,Udajem se,,
YdU8F5rG_1_50,Jelena Rozga,Jelena Rozga,Vrsnjaci moji (zlatokosa),33641,"Ne kucaj, ne pitaj
davno sam rekla moze
samo ukazi se, pokazi cudo Bozje
stoljece cekam te

Podrume, tavane, stanove
sve sam prosla
i hladan kaput samoce me puno kosta
stoljece volim te
 
Ref. 2x
Vrsnjaci moji, i tvoji, ko da ne stare
kroz zivot gaze u troje
a ti mi putuj, ponekad pisi, javi se
sjeti se zlatokose
","https://tekstovi.net/2,1156,19899.html",,Vršnjaci moji,My peers,Oprosti mala,"Ne kucaj, ne pitaj
1
Davno sam rekla može
Samo ukaži se, pokaži čudo Božje
Stoljeće čekam te. Podrume, tavane, stanove
Sve sam prošla
I hladan kaput samoće me puno košta
Stoljeće volim te. Vršnjaci moji, i tvoji, k'o da ne stare
Kroz život gaze utroje
A ti mi putuj, ponekad piši, javi se
Sjeti se zlatokose. Vršnjaci moji, i tvoji, k'o da ne stare
Kroz život gaze utroje
A ti mi putuj, ponekad piši, javi se
Sjeti se zlatokose","Don't knock, don't ask
I said yes a long time ago
just show yourself, show God´s miracle
I've been waiting for you for a century. Basements, attics, apartments
I searched it all
and a cold coat of solitude costs me a lot
I love you for a century. My peers, they don´t seem getting old
they go in threes through life
and you travel, sometimes write, call me
remember the golden-haired. My peers, they don´t seem getting old
they go in threes through life
and you travel, sometimes write, call me
remember the golden-haired",https://lyricstranslate.com/en/vr%C5%A1njaci-moji-my-peers.html,['Tonči Huljić'],['Vjekoslava Huljić'],['Jelena Rozga'],,,https://diskografija.com/pjesma/vrsnjaci-moji-zlatokosa-9891.htm,Vršnjaci moji (zlatokosa),['Remi Kazinoti'],
YdU8F5rG_1_51,Jelena Rozga,Jelena Rozga,Zanemari,49267,"Na mome tijelu
biljezi se sve
najludje noci tvoje
kraj mene

Kao prvo sve si moje
kao drugo isto to
kao trece cu ponovit
ako treba strostruko
 
Zivim jos u uvjerenju
da ces ostat kraj mene
ti zamotaj u salvetu srce
da po putu ne, ne ispadne

Ref.
Srest cemo se kad budemo stari
onda kada ostanemo sami
kad nam bude tesko ic' po cesti
morat cemo jer se treba sresti
morat cemo, morat cemo jer se treba sresti

Srest cemo se kad umre i nada
i bit cemo mladi kao sada
kada svatko sa strane nastavi
i okrene se zadnji kljuc u bravi
a to sto se, sto se stari samo zanemari

Na mome tijelu
k'o na staklu se
sve zivo vidi
tesko brise se

Kao prvo sve si moje
kao drugo isto to
kao trece cu ponovit
ako treba strostruko

Zivim jos u uvjerenju
da ces ostat kraj mene
ti zamotaj u salvetu srce
da po putu ne, ne ispadne

Ref.","https://tekstovi.net/2,1156,32398.html",,Zanemari,Just Ignore,,"Na mome tijelu
1
bilježi se sve
najluđe noći tvoje
kraj mene. Kao prvo sve si moje
kao drugo isto to
kao treće ću ponovit
ako treba strostruko. Živim još u uvjerenju
da ćeš ostat kraj mene
ti zamotaj u salvetu srce
da po putu ne, ne ispadne. Ref.
Srest ćemo se kad budemo stari
onda kada ostanemo sami
kad nam bude teško ić' po cesti
morat ćemo jer se treba sresti
morat ćemo, morat ćemo jer se treba sresti. Srest ćemo se kad umre i nada
i bit ćemo mladi kao sada
kada svatko sa strane nastavi
i okrene se zadnji ključ u bravi
a to što se, što se stari samo zanemari. Na mome tijelu
k'o na staklu se
sve živo vidi
teško briše se. Kao prvo sve si moje
kao drugo isto to
kao treće ću ponovit
ako treba strostruko. Živim još u uvjerenju
da ćeš ostat kraj mene
ti zamotaj u salvetu srce
da po putu ne, ne ispadne","On my body
everything is marked
your craziest nights
next to me. First of all you are my everything
second again the same
third I will repeat it
if necessary even hundred times. I still live in the certainty
that you will stand by me
wrap your heart in a napkin
so it doesn't fall out on the way,
doesn't fall out. Chorus:. When we grow old, we'll meet again,
when we remain alone
when it will be hard for us to walk the street
we'll have to because we have to meet
we'll have to, because we have to meet. We'll meet even when all hope dies
and we'll be young just like we are now
when everybody continues on his side
and the last key turns in the lock
just ignore the fact of growing old. On my body,
just like on glass
everything can be seen
it's hard to erase. First of all, you're my everything.... I still live in the certainty...",https://lyricstranslate.com/en/zanemari-just-ignore.html,['Tonči Huljić'],['Vjekoslava Huljić'],['Jelena Rozga'],2012 - CMC Festival 2012,2012 - Vrući ljetni hitovi 2012,https://diskografija.com/pjesma/zanemari-15853.htm,Zanemari,['Remi Kazinoti'],
YdU8F5rG_1_52,Jelena Rozga,Jelena Rozga,Zileti,4357,"Ref.
Kako da se radujem 
sama novim ljetima 
lete suze kao da 
gadjam se ziletima 

Znas li da smo sada mi 
dvoje sto se rastaju 
a mogli smo gledati djecu
 kako nam odrastaju
 
Navila sam sat za hrabre 
ali nitko budan nije 
srce ti se iza ponosa
 vjesto krije

Sama, sama, skoro podne 
tebe nema preko puta 
kava ti se vec
 ohladila deset puta

Kasnis na mjesto 
gdje skupa sanjamo 
kako kroz kucu djecije korake
 nemirne ganjamo

Ref. 

Kasnis na mjesto gdje 
svoje dlanove stavis pod moje
 pa sretni pravimo 
za zivot planove

Ref. 

Lako bi da si
 zub sto boli 
a sto ce zena koja
 tesko prestaje da voli 

Ref.","https://tekstovi.net/2,1156,53764.html",,Žileti,Razor Blades,Moderna žena (2016),"Kako da se radujem
1
Sama novim ljetima?
Lete suze kao da,
Gađam se žiletima.. Znaš li da smo sada mi
dvoje što se rastaju?
A mogli smo gledati djecu
kako nam odrastaju... ooo.... Navila sam sat za hrabre
Ali niko budan nije,
Srce ti se iza ponosa vješto krije. Sama sam, a skoro podne
Tebe nema preko puta
Kava ti se već ohladila deset puta. Kasniš na mjesto gdje skupa sanjamo,
Kako kroz kuću dječje korake
Nemirne ganjamo.... Kako da se radujem
Sama novim ljetima?
Lete suze kao da,
Gađam se žiletima.. Znaš li da smo sada mi
dvoje što se rastaju?
A mogli smo gledati djecu
kako nam odrastaju... ooo.... Kasniš na mjesto gdje svoje
Staviš pod moje
Pa sretni pravimo
Za život planove.... Kako da se radujem
Sama novim ljetima?
Lete suze kao da,
Gađam se žiletima.. Znaš li da smo sada mi
dvoje što se rastaju?
A mogli smo gledati djecu
kako nam odrastaju... ooo.... Ooo, lako bi da si zub što boli
Ooo, a što će žena koja teško
Prestaje da voli","How am I supposed to be happy
About the new summers alone?
Tears fly as if I am
Aiming at myself with razor blades.. Do you know that we are now
Two people who are parting?
And we could have watched our children
Growing up...oooo.... I've set the clock for the brave ones
But there's no one awake,
Your heart skillfully hides itself in pride. I'm alone, and it's almost noon
You're not across me
You're coffee has gone cold ten times already. You're late to the place where we dream together
Of us chasing playful children's steps
Through the house.... How am I supposed to be happy
About the new summers alone?
Tears fly as if I am
Aiming at myself with razor blades. Do you know that we are now
Two people who are parting?
And we could have watched our children
Growing up...oooo.... You're late to the place where you make
Yours mine
And then we happily make
Plans for life.... How am I supposed to be happy
About the new summers alone?
Tears fly as if I am
Aiming at myself with razor blades. Do you know that we are now
Two people who are parting?
And we could have watched our children
Growing up...oooo.... Ooo, it would be easy if you were a tooth aching
Ooo, and what should a woman who does not
Give up loving easily do?",https://lyricstranslate.com/en/%C5%BEileti-razor-blades.html,,,,,,,,,
