Song_ID,Artist,Artist_diskografija,Song_tekstovinet,Views_tekstovinet,Lyrics_tekstovinet,Url_tekstovinet,Writer_lyricstranslate,Song_lyricstranslate,EngTitle_lyricstranslate,Album_lyricstranslate,Lyrics_lyricstranslate,EngLyrics_lyricstranslate,Url_lyricstranslate,Izvedba_diskografija,Url_diskografija,Song_diskografija
BBRKiV88_1_9,Mia Dimšić,Mia Dimšić,Nije vazno,1524,"Svakoga jutra
isti zvuk me probudi
i miris tvoje meke kose
ali kraj mene nisi ti

Napravim jaku kavu
za nas oboje
ja svoju casu sporo pijem
a tvoja puna ostaje
 
Dan po dan prihvacam
da te nema vise
nema vise tu
da te nema vise tu

Ref.
Nije vazno, kada suze krenu
tko je od nas kriv
one su samo zadnji znak
da nesto lijepo prolazi

Nije vazno koliko tuga sada
po nas dolazi
ona ce proci kao vlak
samo mi budi sretan ti

Nekad ti pisem pisma
koja ne saljem
nekako uvijek bude lakse
da se od svega sakrijem

I kad se negdje jednom
opet sretnemo
bit' cemo mozda samo stranci
a sve o nama zna' cemo

Ref.","https://tekstovi.net/2,4413,57447.html",,Nije važno,It's not important,Život nije siv,"Svakoga jutra isti zvuk me probudi,
1
I miris tvoje meke kose, ali kraj mene nisi ti.
Napravim jaku kavu za nas oboje,
Ja svoju čašu sporo pijem, al' tvoja puna ostane.. Dan po dan prihvaćam,
Da te nema više, nema više tu,
Da te nema više tu.. Nije važno kada suze krenu tko je od nas kriv,
One su samo zadnji znak
Da nešto lijepo prolazi.
Nije važno koliko tuga sada po nas dolazi,
One će proći kao vlak,
Samo mi budi sretan ti.. Nekad ti pišem pisma koja ne šaljem,
Nekako uvijek bude lakše, tu se od svega sakrijem.
I kad se jednom negdje opet sretnemo,
Bit ćemo možda samo stranci, al' sve o nama znat ćemo.. Dan po dan prihvaćam,
Da te nema više, nema više tu,
Da te nema više tu.. Nije važno kada suze krenu tko je od nas kriv,
One su samo zadnji znak
Da nešto lijepo prolazi.
Nije važno koliko tuga sada po nas dolazi,
One će proći kao vlak,
Samo mi budi sretan ti.","The same sounds wakes me every morning,
And the smell of your soft hair, but you're not beside me.
I'm making bitter coffee for the both of us,
I'm drinking my cup slowly, but yours stays full.. Day by day, I accept the fact
That you're not here anymore, that you're not here anymore,
That you're not here anymore.. When the tears start following, it doesn't matter which one of us is to blame,
They're just the final sign
That something beautiful is coming to an end.
It doesn't matter how much sadness is coming for us,
It will pass by like a train,
Just be happy for me.. Sometimes I write you letters which I don't send,
It somehow always makes it easier for me, I hide myself from everything in them.
And when we one meet again somewhere,
Maybe we'll be strangers, but we'll know everything about each other.. Day by day, I accept the fact
That you're not here anymore, that you're not here anymore,
That you're not here anymore.. When the tears start following, it doesn't matter which one of us is to blame,
They're just the final sign
That something beautiful is coming to an end.
It doesn't matter how much sadness is coming for us,
It will pass by like a train,
Just be happy for me.",https://lyricstranslate.com/en/nije-va%C5%BEno-its-not-important.html,,,
BBRKiV88_1_10,Mia Dimšić,Mia Dimšić,Ovaj grad,1164,"Predivan je ovaj grad
al' vec dugo nije moj
plava ploca ulice
kraj nje parni kucni broj

I onaj zvuk kada
vlak starom prugom prosece
bas svaki put laju psi
k'o da prate putnike
 
Ref.
I ne znam ti vise ni rec'
koliko dugo tu stojim
k'o da maknut' se bojim
neko nevrijeme se sprema

U ovaj je maleni grad
toliko stvari vec stalo
al' mi postaje malo
i za moje snove
mjesta vise nema

S druge strane ograde
zive novi susjedi
kad se vrata otvore
ponadam se da si ti

I dajem sve od sebe
al' osjecaj mi govori
znam, ako sad ne odem
ostat' cu u proslosti

Ref.

Jos ju vidim tu, staru ulicu
sve te bitne male detalje
srce puno sna, ako usporis
cesta samo vuce jos dalje

Ref.

U ovaj je maleni grad
toliko stvari vec stalo
al' mi postaje malo
i za moje snove
mjesta vise nema","https://tekstovi.net/2,4413,60817.html",,Ovaj grad,This town,Sretan put (2019),"Predivan je ovaj grad
Al' već dugo nije moj
Plava ploča ulice
Kraj nje parni kućni broj. I onaj zvuk kada vlak starom prugom prošeće
Baš svaki put laju psi k'o da prate putnike. I ne znam ti više ni reć'
Koliko dugo tu stojim
Ko da maknut' se bojim
Neko nevrijeme se sprema
U ovaj je maleni grad
Toliko stvari već stalo
Al' mi postaje malo
I za moje snove mjesta više nema. S druge strane ograde
Žive novi susjedi
Kad se vrata otvore
Ponadam se da si ti. I dajem sve od sebe, al' osjećaj mi govori
Znam, ako sad ne odem, ostat ću u prošlosti. I ne znam ti više ni reć'
Koliko dugo tu stojim
Ko da maknut' se bojim
Neko nevrijeme se sprema
U ovaj je maleni grad
Toliko stvari već stalo
Al' mi postaje malo
I za moje snove mjesta više nema. Još ju vidim tu
Staru ulicu
Sve te bitne male detalje
Srce puno sna
Ako usporiš
Cesta samo vuče još dalje. I ne znam ti više ni reć'
Koliko dugo tu stojim
Ko da maknut' se bojim
Neko nevrijeme se sprema
U ovaj je maleni grad
Toliko stvari već stalo
Al' mi postaje malo
I za moje snove mjesta više nema. U ovaj je maleni grad
Toliko stvari već stalo
Al' mi postaje malo
I za moje snove mjesta više nema","This town is beautiful
But for a long time it isn't mine
A blue street sign
Next to it, an even house number. And that sound when the train walks on the old railroad
Every single time the dogs bark like they're following the passangers. And I don't know how to tell you anymore
For how long I've been standing here
Like I'm scared to move
Some bad weather is incoming
In this small town
A lot of stuff has already fit
But it's getting small to me
And there's no more space for my dreams. From the other side of the fence
New neighbours live
When the doors open
I hope it's you. And I'm giving my best, but my feeling's telling me
I know, if I don't go now, I will stay in the past. And I don't know how to tell you anymore
For how long I've been standing here
Like I'm scared to move
Some bad weather is incoming
In this small town
A lot of stuff has already fit
But it's getting small to me
And there's no more space for my dreams. I can still see
The old street here
All the important small details
A heart full of dreams
If you slow down
The road just drags on more. And I don't know how to tell you anymore
For how long I've been standing here
Like I'm scared to move
Some bad weather is incoming
In this small town
A lot of stuff has already fit
But it's getting small to me
And there's no more space for my dreams. In this small town
A lot of stuff has already fit
But it's getting small to me
And there's no more space for my dreams",https://lyricstranslate.com/en/ovaj-grad-town.html,,,
BBRKiV88_1_11,Mia Dimšić,Mia Dimšić,Pomalo slucajno,636,"Kad sam tebe upoznala
moram priznati mislila sam
da si malo neobican lik

S izmisljenim pricama
al' nakon dva tri razgovora
nestao je svaki upitnik
 
I mozda stvari uvijek krenu
cudnim tempom za sve nas
jer tako malo slusamo
svoj unutarnji glas
i bojimo se priznati si to

Ref.
Sve je pomalo slucajno
gdje je car u tome
da na prvu uvijek znamo sve

Sve je pomalo slucajno
svaki mali potez kistom
slici daje smisao

Noc je bila, nikad kraca
plesali smo sami dugo
dok na grane hvatao se mraz

Rekao si, sad smo ovdje
sutra tko zna sto nas ceka
svaki dan je novi putokaz

Ref.

Sve na svoje dodje, znam
kada manje razmisljam
sve na svoje dodje, znam
nekad o tom manje razmisljam

Ref.","https://tekstovi.net/2,4413,61862.html",,Pomalo slučajno,,Sretan put,"Kad sam tebe upoznala
moram priznati mislila sam
da si malo neobičan lik. S izmišljenim pričama
al’ nakon dva tri razgovora
nestao je svaki upitnik. I možda stvari uvijek krenu
čudnim tempom za sve nas
jer tako malo slušamo
svoj unutarnji glas
i bojimo se priznati si to. Refren: sve je pomalo slučajno
gdje je čar u tome
da na prvu uvijek znamo sve. Sve je pomalo slučajno
svaki mali potez kistom
slici daje smisao. Noć je bila, nikad kraća
plesali smo sami dugo
dok na grane hvatao se mraz. Rekao si, sad smo ovdje
sutra tko zna sto nas čeka
svaki dan je novi putokaz. Refren 1x. Sve na svoje dođe, znam
kada manje razmisljam
sve na svoje dođe, znam
nekad o tom manje razmišljam. Refren 1x",,https://lyricstranslate.com/en/mia-dimsic-pomalo-slucajno-lyrics.html,,,
BBRKiV88_1_12,Mia Dimšić,Mia Dimšić,Pomice se sat,1065,"Vrijeme je da skupim stvari
nadjem neki mali stan
maknem onaj kufer stari
malo cesce idem van

Desna noga je vec presla prag
lijeva naivno jos ceka znak
ali ne moze se unatrag
dok se sumrak pretvara u mrak
 
Ref.
Kao da lagano dani se skracuju
ove se nedjelje pomice sat
rujan kad krene, rascvjetalo vene
ma, trebala sam to znat'

Od svih mogucih imena
za ovakav zagrljaj
dok se sulja treca smjena
najpogresnije je kraj

Stoput rekla sam si istu stvar
dok sam prelazila ovaj prag
da si malo gori bio bar
da mi barem nisi tako drag

Ref.

U stan cu preseliti staru gitaru
i klavir cu zgurat' u kut
pa kad ti se svira
kad negdje si blizu
naleti bar jos koji put
naleti bar jos koji put

Ref.

Kao da lagano dani se skracuju
ove nedjelje pomice se sat
vjeruj mi, htjela sam
al' nisam uspjela
vise od ovog dat'

Jer pomice nam se sat  
jer pomice nam se sat","https://tekstovi.net/2,4413,60824.html",,Pomiče se sat,,Sretan put,"Vrijeme je da skupim stvari,
Nađem neki mali stan,
Maknem onaj kofer stari,
Malo češće idem van.. Desna noga je već prešla prag,
Lijeva naivno još čeka znak,
Ali ne može se unatrag,
Dok se sumrak pretvara u mrak.. Kao da lagano dani se skraćuju,
Ove se nedjelje pomiče sat.
Rujan kad krene, rascvjetalo vene,
Ma trebala sam to znat'.. Od svih mogućih imena
Za ovakav zagrljaj,
Dok se šulja treća smjena
Najpogrešnije je kraj.. Stoput rekla sam si istu stvar
Dok sam prelazila ovaj prag.
Da si malo gori bio bar
Da mi barem nisi tako drag.. Kao da lagano dani se skraćuju,
Ove se nedjelje pomiče sat.
Rujan kad krene, rascvjetalo vene,
Ma trebala sam to znat'.. U stan ću preseliti staru gitaru,
I klavir ću zgurat u kut.
Pa kad ti se svira, kad negdje si blizu,
Naleti bar još koji put.. Kao da lagano dani se skraćuju,
Ove se nedjelje pomiče sat.
Rujan kad krene rascvjetalo vene,
Ma trebala sam to znat'.. Kao da lagano dani se skraćuju,
Ove se nedjelje pomiče sat.
Vjeruj mi, htjela sam al nisam uspjela
Više od ovog dat'.
Jer pomiče nam se sat...",,https://lyricstranslate.com/en/mia-dim%C5%A1i%C4%87-pomi%C4%8De-se-sat-lyrics.html,,,
BBRKiV88_1_13,Mia Dimšić,Mia Dimšić,Sanjaj me,933,"Ja nisam vidjela
da dosao je kraj
da pogled krijemo
i nestaje sjaj

A bio si mi sve
i noc, i dan
tvoje dodire
i sada osjecam
 
Ref.
Ne znam kuda putujem
kakva jutra magle donose
zbogom budi, volim te
bar ponekad sanjaj me

Kad kisa prestane
i sunce izadje
mozda ljubav tad
i nas pronadje

Ali, najteze je stat'
i priznat' pred sobom
da nema vise nas
i zivjet' s istinom

Ref.

Negdje mora biti mjesto
gdje oduvijek pripadam
srce znati ce 
kad ga ugledam

Jucer postoji zbog sutra
zato za sve hvala ti
sada moram dalje
sebe pronaci

Ref. 2x

Bar ponekad sanjaj me","https://tekstovi.net/2,4413,60821.html",,Sanjaj me,Dream of me,Život nije siv,"Ja nisam vidjela
1
Da došao je kraj
Da pogled krijemo
I nestaje sjaj. A bio si mi sve
I noć i dan
Tvoje dodire
I sada osjećam. Ne znam kuda putujem
Kakva jutra magle donose
Zbogom budi, volim te
Bar ponekad sanjaj me. Kad kiša prestane
I sunce izađe
Možda ljubav tad
I nas pronađe. Al' najteže je stat'
I priznat' pred sobom
Da nema više nas
I živjet s istinom. Ne znam kuda putujem
Kakva jutra magle donose
Zbogom budi, volim te
Bar ponekad sanjaj me. Negdje mora biti mjesto
Gdje oduvijek pripadam
Srce znati će kad ga ugledam. Jučer postoji zbog sutra
Zato za sve hvala ti
Sada moram dalje, sebe pronaći. Ne znam kuda putujem
Kakva jutra magle donose
Zbogom budi, volim te
Bar ponekad sanjaj me. Ne znam kuda putujem
Kakva jutra magle donose
Zbogom budi, volim te
Bar ponekad sanjaj me. Bar ponekad sanjaj me","I didn't see
that the end had came
that we hide the view
and the glow disappears. You was everything to me
Both (at) night and (in) the morning
I still feel your touches. I don't know where to tavel
How morning bears fogs
Good bye ,I love you
Atleast sometimes dream of me. When rain stops
and the sun comes out
Maybe then love will find us. But the hardest (part) is staying and admitting in front of you
That there is no more us and live with the truth. I don't kow where to travel
How morning bears fogs
Good bye ,I love you
Atleast sometimes dream of me. There must be a place somewhere
Where I belong to from the beginning
(My) heart will know when I see it. Yesterday exists because of tomorrows
Thank you for everything
Now I have to go away, find myself. I don't kow where to travel
How morning bears fogs
Good bye ,I love you
Atleast sometimes dream of me. I don't kow where to travel
How morning bears fogs
Good bye ,I love you
Atleast sometimes dream of me. Atleast sometimes dream of me",https://lyricstranslate.com/en/sanjaj-me-dream-me.html-1,,,
BBRKiV88_1_14,Mia Dimšić,Mia Dimšić,Slobodna,4125,"Korak naprijed, nazad dva
to me bas ne zanima
poslije pada opet pad
pogledaj gdje smo sad

Ako kazem odlazim
bi' cu kriva, zivim s tim
ako kazem ostajem
na tvoj rat pristajem
 
Ref.
Od danas novu stranu listam bez tebe
predugo si bio sve
ovo tvoj je poraz, moja pobjeda
zapamti to, konacno, /slobodna/

S tvoje strane svemira
uvukla se dosada
svaki dan je isto siv
netko drugi uvijek kriv

Lose vijesti posvuda
samo bol i osuda
mene zovu gradovi
gdje su svi sretniji

Ref.

Letim, letim letim, letim svojim krilima
Sunce ljepse sjaji iznad tmurnih oblaka
gledam, gledam, gledam, gledam svojim ocima
proljece, tece venama

Ref. 2x","https://tekstovi.net/2,4413,53292.html",,Slobodna,Free,Život nije siv (2017),"korak naprijed, nazad dva
1
to me baš ne zanima
poslije pada opet pad
pogledaj gdje smo sad. ako kažem odlazim
bi' ću kriva, živim s tim
ako kažem ostajem
na tvoj rat pristajem. od danas novu stranu listam bez tebe
predugo si bio sve
ovo tvoj je poraz, moja pobjeda
zapamti to
konačno
slobodna. s tvoje strane svemira
uvukla se dosada
svaki dan je isto siv
netko drugi uvijek kriv. loše vijesti posvuda
samo bol i osuda
mene zovu gradovi
gdje su svi sretniji
od danas novu stranu listam bez tebe
predugo si bio sve
ovo tvoj je poraz, moja pobjeda
zapamti to
konačno.... letim, letim letim, letim svojim krilima
sunce ljepše sjaji iznad tmurnih oblaka
gledam, gledam, gledam, gledam svojim očima
proljeće, teće venama. od danas novu stranu listam bez tebe
predugo si bio sve
ovo tvoj je poraz, moja pobjeda
zapamti to
konačno. od danas novu stranu listam bez tebe
predugo si bio sve
ovo tvoj je poraz, moja pobjeda
zapamti to
konačno
slobodna","one step forward, two steps back
it doesn’t really interest me
after falling, fall again
look where we are now. if I tell you that I’m leaving
I’m to blame, I’ll live with that.
if I tell you that I’m staying
I concede to your war. from today I turn a new page without you
for too long you’ve been everything
this is your defeat, my victory
remember that
finally
free. from your side of the universe
boredom has crept in
every day is the same grey
someone else is always to blame. bad news everywhere
only pain and condemnation
cities call me
where everyone is happier
from today I turn a new page without you
for too long you’ve been everything
this is your defeat, my victory
remember that
finally. flying, flying, flying, flying on my wings
sun shining brighter above the gloomy clouds
looking, looking, looking, looking with my eyes
spring, flowing in veins. from today I turn a new page without you
for too long you’ve been everything
this is your defeat, my victory
remember this
finally. from today I turn a new page without you
for too long you’ve been everything
this is your defeat, my victory
remember this
finally
free",https://lyricstranslate.com/en/slobodna-free.html-1,['Mia Dimšić'],https://diskografija.com/pjesma/slobodna-26582.htm,Slobodna
BBRKiV88_1_15,Mia Dimšić,Mia Dimšić,Sretan put,1938,"Pitaj me koja karta sad me ceka
pitaj me kuda ptice odlaze
ne znam jos, ne znam jos, sva su mjesta predaleka
vrijeme je da saznam sve

Pitaj me gdje jos do sad nisam bila
pitaj me, mjesta cu nabrajati
ne znam jos, ne znam jos gdje ce odnijeti me krila
al’ cu ti se javljati
 
Ref.
Sretan put, dvije su rijeci meni najdraze
bilo kud, samo nek' se putuje
sretan put, tebi uvijek brzo vracam se
kod kuce je najbolje

Pitaj me gdje se prve zore bude
pitaj me koji tren bi vratila
ne znam jos, ne znam jos sve te ulice i ljude
zauvijek bi pratila

Ref.

Samo u glavi su nam granice
gledaj me, mogu bas sve
i ne odustajem dok ne obidjem sve stanice

Ref.

Jer te volim, jer te volim, jer te volim najvise
i znam da znas
uvijek tebi brzo vracam se
kod kuce je najbolje","https://tekstovi.net/2,4413,61415.html",,Sretan put,,Sretan put,"Pitaj me koja karta sad me čeka,
Pitaj me kuda ptice odlaze.
Ne znam još, ne znam još, sva su mjesta predaleka,
Vrijeme je da saznam sve.. Pitaj me gdje još dosad nisam bila,
Pitaj me, mjesta ću nabrajati.
Ne znam još, ne znam još gdje će odnijeti me krila,
Al’ ću ti se javljati.. Refren:
Sretan put, dvije su riječi meni najdraže
Bilo kud, samo nek se putuje.
Sretan put, tebi uvijek brzo vraćam se
Kod kuće je najbolje.. Pitaj me gdje se prve zore bude,
Pitaj me koji tren bi vratila.
Ne znam još, ne znam još, sve te ulice i ljude
Zauvijek bi pratila.. Refren:
Sretan put, dvije su riječi meni najdraže
Bilo kud, samo nek se putuje.
Sretan put, tebi uvijek brzo vraćam se
Kod kuće je najbolje.. Samo u glavi su nam granice,
Gledaj me, mogu baš sve.
I ne odustajem dok ne obiđem sve stanice.. Refren:
Sretan put, dvije su riječi meni najdraže
Bilo kud, samo nek se putuje.
Sretan put, tebi uvijek brzo vraćam se
Kod kuće je najbolje.. Jer te volim, jer te volim, jer te volim najviše.
I znam da znaš uvijek tebi brzo vraćam se
Kod kuće je najbolje.",,https://lyricstranslate.com/en/mia-dim%C5%A1i%C4%87-sretan-put-lyrics.html,,,
BBRKiV88_1_16,Mia Dimšić,Mia Dimšić,"Sunce, oblak, vjetar",4156,"Ponekad mislima te dotaknem
i sve sto smeta na tren razmaknem
do mjesta gdje smo opet ti i ja

Tamo gdje ne vode se ratovi
gdje sve se radi s puno ljubavi
i svud se siri miris proljeca
 
Ref.
Plesem, sunce me grije
oblak s neba se smije
sreca tece kroz moj mali stan

Plesem, sunce me grije
oblak s neba se smije
nista nece pokvarit' mi dan

Ponekad osmijehom te zagrlim
jako te stisnem, nigdje ne zurim
s tobom i vrijeme brzo proleti

Tamo gdje ne postoje granice
i gdje se pisu sretne stranice
gdje nema tuga, samo radosti

Ref.

Kad mi nocu dasak vjetra
obraz poljubi
znam da me cuvas, znam da me vodis
znam, to si ti

Ref.

Nista nece pokvarit' mi dan","https://tekstovi.net/2,4413,54410.html",,"Sunce, oblak, vjetar","Sun, Cloud, Wind",Život nije siv (2017),"Ponekad mislima te dotaknem
1
i sve što smeta na tren razmaknem
do mjesta gdje smo opet ti i ja. Tamo gdje ne vode se ratovi
gdje sve se radi s puno ljubavi
i svud se širi miris proljeća. Plešem, sunce me grije
oblak s neba se smije
sreća teče kroz moj mali stan. Plešem, sunce me grije
oblak s neba se smije
ništa neće pokvarit' mi dan. Ponekad osmijehom te zagrlim
jako te stisnem, nigdje ne žurim
s tobom i vrijeme brzo proleti. Tamo gdje ne postoje granice
i gdje se pišu sretne stranice
gdje nema tuga, samo radosti. Plešem, sunce me grije
oblak s neba se smije
sreća teče kroz moj mali stan. Plešem, sunce me grije
oblak s neba se smije
ništa neće pokvarit' mi dan. Kad mi noću dašak vjetra obraz poljubi
znam da me čuvaš, znam da me vodiš
znam to si ti. Plešem, sunce me grije
oblak s neba se smije
sreća teče kroz moj mali stan. Plešem, sunce me grije
oblak s neba se smije
ništa neće pokvarit' mi dan. Ništa neće pokvarit' mi dan","Sometimes I touch with my thoughts
And all that stands in the way, I put aside for a moment
To the place where again it is you and I. There where no wars are being fought
Where everything is done with a lot of love
And the smell of spring spreads everywhere. I'm dancing, sun keeps me warm
A cloud smiles from the sky
Happiness flows through my little apartment. I'm dancing, sun keeps me warm
A cloud smiles from the sky
Nothing will spoil my day. Sometimes I hug you with a smile
I squeeze you real tight, I'm in no hurry to anywhere
With you, time flies by quickly too. There where's no boundaries
And where happy pages are being written
Where there's no sorrows, only joys. I'm dancing, sun keeps me warm
A cloud smiles from the sky
Happiness flows through my little apartment. I'm dancing, sun keeps me warm
A cloud smiles from the sky
Nothing will spoil my day. When breeze kisses my cheak in the night
I know you're guarding me, I know you're leading me
I know it's you. I'm dancing, sun keeps me warm
A cloud smiles from the sky
Happiness flows through my little apartment. I'm dancing, sun keeps me warm
A cloud smiles from the sky
Nothing will spoil my day. Nothing will spoil my day",https://lyricstranslate.com/en/sunce-oblak-vjetar-sun-cloud-wind.html,,,
BBRKiV88_1_17,Mia Dimšić,Mia Dimšić,Sva blaga ovog svijeta (feat. Marko Tolja),2458,"Ja pamtim svaki pogled tvoj
uvijek smo bili sretan broj
u ovoj igri oko nas

Ti znao si kuda ploviti
kad nas stignu valovi
i kada nebo digne glas
 
Tek sada vidim kako dobro je
kad tvoje ruke vode me

Ref.
Sva blaga ovog svijeta
i duga topla ljeta
gore na tvojim usnama

Nocas mi ljubav treba
vodi me sve do neba
dok more sapce zvijezdama

Ja, otkako tvoje oci znam
u nista drugo ne gledam
s tobom je lako prošlost prijec'

Ti, kad bacis sidro medju sne
i kada dodju nevolje
ljubav ce imat' zadnju rijec
korak po korak stize svitanje
sretniji s tobom postajem

Ref. 2x

Zvijezdama, zvijezdama, zvijezdama
dok more sapce zvijezdama","https://tekstovi.net/2,4413,59915.html",,Sva blaga ovog svijeta,All the Treasures in This World,Sretan put,"Ja, pamtim svaki pogled tvoj
uvijek smo bili sretan broj
u ovoj igri oko nas
ti, znao si kuda ploviti
kada nas stignu valovi
i kada nebo digne glas. Tek sada vidim kako dobro je
kad tvoje ruke vode me. Sva blaga ovog svijeta
i duga topla ljeta
gore na tvojim usnama
noćas mi ljubav treba
vodi me sve do neba
dok more šapće zvijezdama. Ja, otkako tvoje oči znam
u ništa drugo ne gledam
s tobom je lako prošlost prijeć
ti, kad baciš sidro među sne
i kada dođu nevolje
ljubav će imat zadnju riječ. Korak po korak stiže svitanje
sretniji s tobom postajem. Sva blaga ovog svijeta
i duga topla ljeta
gore na tvojim usnama
noćas mi ljubav treba
vodi me sve do neba
dok more šapće zvijezdama","I remember your every look
We were always a happy number
Inside this game around us
You knew where to sail
When vawes catch up with us
And when the sky becomes loud. Only now I see how good it is
When your hands guide me. All the treasures in this world
And long warm summers
Up there on your lips
I need love tonight
Take me all the way to the heaven
While the sea whispers to the stars. Me, ever since I've met your eyes
I haven't been looking at anything else
It is easy to get over past with you
You, when you throw an anchor between the dreams
And when bad times appear
Love will have the final say. Step by step dawn arrives
I become happier with you. All the treasures in this world
And long warm summers
Up there on your lips
I need love tonight
Take me all the way to the heaven
While the sea whispers to the stars",https://lyricstranslate.com/en/sva-blaga-ovog-svijeta-all-treasures-world.html,,,
