Song_ID,Artist,Artist_diskografija,Song_tekstovinet,Views_tekstovinet,Lyrics_tekstovinet,Url_tekstovinet,Writer_lyricstranslate,Song_lyricstranslate,EngTitle_lyricstranslate,Album_lyricstranslate,Lyrics_lyricstranslate,EngLyrics_lyricstranslate,Url_lyricstranslate,Izvedba_diskografija,Url_diskografija,Song_diskografija
BBRKiV88_1_18,Mia Dimšić,Mia Dimšić,Sve sam znala i prije,2899,"Sad mi dodjes
kao zito na suncu
gdje sve je zlatno
i sve izlazi na vidjelo

Nijednu sumnju ja sad
ne nosim sa sobom
tako sigurna u ljubav
samo ja sam s tobom
 
Ref. 2x
Sve sam znala i prije
sve sam znala, ali nisam vjerovala
sve sam znala i prije
ljubav moze slomiti
al' moze te i podici

Al' moze te i podici
sve sam znala i prije

Nitko ne moze mi
skinut osmijeh s lica
dok idem tebi
mogu satima putovati

Znam sto me ceka
kad na vrata dodjem
tu sam tvoja i nikom drugom
ja ne pripadam

Ref. 2x

Al' moze te i podici

Ref.

Ref.","https://tekstovi.net/2,4413,54329.html",,Sve sam znala i prije,Я все знала и прежде,,"Sad mi dođeš kao žito na suncu
1
gdje sve je zlatno i sve izlazi na vidjelo
nijednu sumnju ja sad ne nosim sa sobom
tako sigurna u ljubav samo ja sam s tobom. Sve sam znala i prije
sve sam znala, ali nisam vjerovala
sve sam znala i prije
ljubav može slomiti
al' može te i podići. Sve sam znala i prije
sve sam znala, ali nisam vjerovala
sve sam znala i prije
ljubav može slomiti
al' može te i podići. Al' može te i podići
sve sam znala i prije. Nitko ne može mi skinut' osmijeh s lica
dok idem tebi, mogu satima putovati
znam što me čeka kad na vrata dođem
tu sam tvoja i nikom drugom ja ne pripadam. Sve sam znala i prije
sve sam znala, ali nisam vjerovala
sve sam znala i prije
ljubav može slomiti
al' može te i podići. Sve sam znala i prije
sve sam znala, ali nisam vjerovala
sve sam znala i prije
ljubav može slomiti
al' može te i podići. Al' može te i podići. Sad mi dođeš kao žito na suncu
gdje sve je zlatno i sve izlazi na vidjelo. Ljubav može slomiti
al' može te i podići. Sve sam znala i prije
sve sam znala, ali nisam vjerovala
sve sam znala i prije
ljubav može slomiti
al' može te i podići","Ты приходишь ко мне, как солнце на поле пшеницы
Где все блестит как золото и все становится явным
Теперь я не ношу с собой сомненья
Только лишь с тобой я так уверена в любви. Я все знала и прежде
Я все знала, но не верила
Я все знала и прежде
Любовь может сломить
Но может и вознести тебя. Я все знала и прежде
Я все знала, но не верила
Я все знала и прежде
Любовь может сломить,
Но может и вознести тебя. Но может и вознести тебя
Я все знала и прежде. Никто не может убрать с моего лица улыбку
Пока я иду к тебе, я могу идти часами
Знаю, что меня ждет, когда приду к твоим дверям
Здесь я твоя и не принадлежу никому другому. Я все знала и прежде
Я все знала, но не верила
Я все знала и прежде
Любовь может сломить
Но может и вознести тебя. Я все знала и прежде
Я все знала, но не верила
Я все знала и прежде
Любовь может сломить,
Но может и вознести тебя. Но может и вознести тебя. Ты приходишь ко мне, как солнце на поле пшеницы
Где все блестит как золото и все становится явным. Любовь может сломить
Но может и вознести тебя. Я все знала и прежде
Я все знала, но не верила
Я все знала и прежде
Любовь может сломить
Но может и вознести тебя",https://lyricstranslate.com/en/sve-sam-znala-i-prije-%D1%8F-%D0%B2%D1%81%D0%B5-%D0%B7%D0%BD%D0%B0%D0%BB%D0%B0-%D0%B8-%D0%BF%D1%80%D0%B5%D0%B6%D0%B4%D0%B5.html,,,
BBRKiV88_1_19,Mia Dimšić,Mia Dimšić,Svjetionik,604,"Kao svjetionik vodi me na mjesto
s druge strane ovih zidova
kao modro more nosi me daleko
iza praznih pogleda

Ref.
Dan je kratak
da ti priznam istinu
nikad nisam mogla
imat' naviku
 
Bjezala sam tudjoj sjeni
kad bi bio blizu meni
a sada znam 
koliko si me volio

Kao vedro nebo 
digni me visoko
kao tvrda stijena
sakrij me od vjetra
iza svojih dodira

Ref. 2x","https://tekstovi.net/2,4413,60818.html",,Svjetionik,,Život nije siv,"Kao svjetionik vodi me na mjesto
S druge strane ovih zidova.
Kao modro more nosi me daleko
Iza praznih pogleda.. Dan je kratak da ti priznam istinu,
Nikad nisam mogla imat naviku.
Bježala sam tuđoj sjeni,
Kad bi bio blizu meni,
Sada znam koliko si me volio.. Kao vedro nebo digni me visoko
Iznad ovih kišnih oblaka.
Kao tvrda stijena sakrij me od vjetra
Iza svojih dodira.. Dan je kratak da ti priznam istinu,
Nikad nisam mogla imat naviku.
Bježala sam tuđoj sjeni,
Kad bi bio blizu meni,
Sada znam koliko si me volio.",,https://lyricstranslate.com/en/mia-dim%C5%A1i%C4%87-svjetionik-lyrics.html,,,
BBRKiV88_1_20,Mia Dimšić,Mia Dimšić,Tko je tu lud,456,"Kada i ako ostavis nekog
ili ne daj Boze netko tebe ostavi
brzo smisli neke dobre izlike
morat ces objasnit' sve

Jer, kad hodas sama
to zna biti drama
i svima cudno je
 
Ref.
Al' nemam vremena sad
za suze je to znak
ne kuzim zasto je tesko
od gubitka si sam

I bas me briga sto nemam argumente
tko te pita, svijete
za tvoj cijenjeni sud
i ne znam tko je tu lud

Sve cu ti reci
dobro se drzi
samo je mjesec pros'o
a ti ne places

Iz crnine prebrzo si izasla
mozda bas i nisi fer
moje isprike sto nisam isplakala
kokuza ovaj dan
al' nemam vremena sad

Ref.","https://tekstovi.net/2,4413,61853.html",,Tko je tu lud,,Sretan put,"Kada i ako ostaviš nekog
ili ne daj Bože netko tebe ostavi
brzo smisli neke dobre izlike
morat ćeš objasnit' sve. Jer, kad hodaš sama
to zna biti drama
i svima čudno je. Refren: al' nemam vremena sad
za suze je to znak
ne kužim zašto je teško
od gubitka si sam. I baš me briga što nemam argumente
tko te pita, svijete
za tvoj cijenjeni sud
i ne znam tko je tu lud. Sve ću ti reći
dobro se drži
samo je mjesec prošao
a ti ne plačeš. Iz crnine prebrzo si izašla
možda baš i nisi fer
moje isprike što nisam isplakala
sto suza ovaj dan
al' nemam vremena sad. Refren 1x",,https://lyricstranslate.com/en/mia-dimsic-tko-je-tu-lud-lyrics.html,,,
BBRKiV88_1_21,Mia Dimšić,Mia Dimšić,Unatrag,2206,"Sto puta krenem al' mi propadne plan
obrisat tvoje poruke
stvarno te volim ali nekako znam
nisu nam zelje jednake

Ref.
Unatrag
sve mi uvijek krene kad se tebi ponadam
bas si drag
jos si drazi kad te malo nigdje ne gledam
 
Vec dugo slutim nismo savrsen par
gubimo vrijeme uzalud
u tvojoj glavi sve je gotova stvar
a moj je zivot Hollywood

Ref.

Ne gledaj me tako, otic nije lako
znam da sve to znas, znam da sve to znas
doci ce na svoje ako ove boje
nekoj drugoj das, nekoj drugoj das

Ref. 3x","https://tekstovi.net/2,4413,61194.html",,Unatrag,Backwards,Sretan put,"Sto puta krenem al mi propadne plan
1
Obrisat tvoje poruke.
Stvarno te volim ali nekako znam,
Nisu nam želje jednake.. Unatrag sve mi uvijek krene
Kad si tebi ponadam.
Baš si drag, još si draži kad te malo
Nigdje ne gledam.. Već dugo slutim nismo savršen par
Gubimo vrijeme uzalud.
U tvojoj glavi sve je gotova stvar,
A moj je život Hollywood.. Unatrag sve mi uvijek krene
Kad si tebi ponadam.
Baš si drag, još si draži kad te malo
Nigdje ne gledam.. Ne gledaj me tako,
Otić nije lako,
Znam da sve to znaš, znam da sve to znaš.
Doći će na svoje,
Ako ove boje,
Nekoj drugoj daš, nekoj drugoj daš.. Unatrag sve mi uvijek krene
Kad si tebi ponadam.
Baš si drag, još si draži kad te malo
Nigdje ne gledam.","I've tried to delete your messages a hundred times
but I fail every single time.
I really love you, but somehow I know,
Our wants aren't the same.. Everything always takes me back
When I hope for you.
You're so dear, you're even dearer to me
When I don't really see you anywhere.. I've suspected for a while now that we're not a perfect match
We're losing time in vain.
Everything is a finished case in your head,
But my life is like Hollywood.. Everything always takes me back
When I hope for you.
You're so dear, you're even dearer to me
When I don't really see you anywhere.. Don't look at me like that,
Leaving is not easy,
I know that you know all of this, I know that you know all of this.
What goes around will comes around,
If you give these battles
To some other girl, to some other girl.. Everything always takes me back
When I hope for you.
You're so dear, you're even dearer to me
When I don't really see you anywhere.",https://lyricstranslate.com/en/unatrag-backwards.html,,,
BBRKiV88_1_22,Mia Dimšić,Mia Dimšić,Zivot nije siv,23664,"Bojis se da srecu necu nac'
vjeruj, za nju ne treba mi vrac
otvoreni dlan, vedre misli svaki dan 
dovest ce je takav je moj plan 

Znam da nisam ista kao ti 
nemam vise zasto bjezati 
oblak je moj dom, oblikujem ga po svom 
dosadno je kretati se tlom 
 
Ref.
Samo ovu pjesmu zelim 
samo ovaj ritam znam 
samo ovoj ludoj besmislici pripadam 

Sve je crno, sve je bijelo
ali zivot nije siv
sve je dobro dok si zdrav i dok si ziv 

Znas li zasto svijet jos nije tvoj
svemu trazis oznaku i broj 
i svatko ti je los, a ne poznajes ga jos
svakog svrstavas u neki kos

I blago meni sto si tako ljut
to je znak da biram dobar put
jer dok ti smeta sjaj znam da ne vidis mi kraj
kamo idem zato ne pitaj

Ref. 3x","https://tekstovi.net/2,4413,52435.html",,Život nije siv,Life isn't gray (dreary),Život nije siv,"Bojiš se da sreću neću nać?
1
Vjeruj, za nju ne treba mi vrač
Otvoreni dlan, vedre misli svaki dan
dovest će je, takav je moj plan. Znam da nisam ista kao ti
nemam više zašto bježati
Oblak je moj dom, oblikujem ga po svom
dosadno je kretati se tlom. Samo ovu pjesmu želim, samo ovaj ritam znam
samo ovoj ludoj besmislici pripadam
Sve je crno, sve je bijelo, ali život nije siv
Sve je dobro dok si zdrav i dok si živ. Znaš li zašto svijet još nije tvoj?
Svemu tražiš oznaku i broj
Svatko ti je loš, a ne poznaješ ga još
svakog svrstavaš u neki koš. Blago meni što si tako ljut
to je znak da biram dobar put
Jer dok ti smeta sjaj, znam da ne vidiš mi kraj
kamo idem zato ne pitaj. Samo ovu pjesmu želim, samo ovaj ritam znam
Samo ovoj ludoj besmislici pripadam
Sve je crno, sve je bijelo, ali život nije siv
Sve je dobro dok si zdrav i dok si živ. Samo ovu pjesmu želim, samo ovaj ritam znam
Samo ovoj ludoj besmislici pripadam
Sve je crno, sve je bijelo, ali život nije siv
Sve je dobro dok si zdrav i dok si živ. Samo ovu pjesmu želim, samo ovaj ritam znam
Samo ovoj ludoj besmislici pripadam
Sve je crno, sve je bijelo, ali život nije siv
Sve je dobro dok si zdrav i dok si živ. Sve je dobro dok si zdrav i dok si živ","Are you afraid that I will not find happiness?
Trust me, for happiness I don't need a fortune-teller
Palm that is opened, cheerful thoughts for every day
will bring happiness, that is at least my plan. I know that I'm not the same as you are
I don't have anything left to run from
Cloud is my home, I shape it by my will
It's boring to roam on the ground. Only that I want is this song, only that I know is this rhythm
Only this crazy ruck I belong,
All is black, all is white, but life isn't gray
All is good if you are healthy and while you are alive. Do you know why the world isn't still yours?
Because you are looking for a mark and number to everything
Everyone is bad to you, and you even don't know him/her
Everyone is evaluated (categorized) by you. I'm so blessed that you are so angry
that is a sign that I'm on the right way
Because while you are annoyed by the shine, I know you don't see that I'm endless
therefore you don't ask me where I'm going. Only that I want is this song, only that I know is this rhythm
Only this crazy ruck I belong,
All is black, all is white, but life isn't gray
All is good if you are healthy and while you are alive. Only that I want is this song, only that I know is this rhythm
Only this crazy ruck I belong,
All is black, all is white, but life isn't gray
All is good if you are healthy and while you are alive. Only that I want is this song, only that I know is this rhythm
Only this crazy ruck I belong,
All is black, all is white, but life isn't gray
All is good if you are healthy and while you are alive. All is good if you are healthy and while you are alive",https://lyricstranslate.com/en/%C5%BEivot-nije-siv-life-isnt-grey.html,['Mia Dimšić'],https://diskografija.com/pjesma/zivot-nije-siv-26772.htm,Život nije siv
BBRKiV88_1_23,Mia Dimšić,Mia Dimšić,Zlatnih krila (feat. Emanuel),131,"Zlatnih krila andjela si
Boze, k meni poslao
andjeo me svetom rijeci
Majkom Bozjom prozvao

Hvala, Visnji, tebi hvala
za tu milost toliku
a u suzi, u mom oku
citaj ljubav veliku

Slusaj srce, pjevaj srce
dobrom Kralju svojemu
pjevaj vijekom pjesmu lijepu
pjesmu svoju zahvalnu","https://tekstovi.net/2,4413,64735.html",,,,,,,,,,
