Song_ID,Artist,Artist_diskografija,Song_tekstovinet,Views_tekstovinet,Lyrics_tekstovinet,Url_tekstovinet,Writer_lyricstranslate,Song_lyricstranslate,EngTitle_lyricstranslate,Album_lyricstranslate,Lyrics_lyricstranslate,EngLyrics_lyricstranslate,Url_lyricstranslate,Izvedba_diskografija,Url_diskografija,Song_diskografija,Album_1_diskografija,Album_2_diskografija,Album_3_diskografija,Album_4_diskografija,Album_5_diskografija,Skladba_diskografija,Stihovi_diskografija,Aranžman_diskografija
nkaHNg1X_1_44,Petar Grašo,Petar Grašo,Utorak,151295,"Pred tebe razlit' cu svoju bol
k'o crno vino na bijeli stol
jos nosim onaj trag
sto boli al' je drag
a tebe nema i nema te

Prolazi jos jedan utorak
sve ide, znam
moram biti jak
al' cuvam jastuk nas
tek ako zalutas
a tebe nema i nema te

Ref.
I sve dok zivim
i dok imam glas
ja plakat' cu za nas
to me zivot okuje

I sve dok zivim
i dok imam glas
ja plakat' cu za nas
Boze daj da budem jak
da mi prodje utorak

Zivim k'o vuk 
ponosan i sam
ne znam za bol 
ljubav niti sram

Al' cuvam jastuk nas
tek ako zalutas
a tebe nema i nema te 

Ref. 2x","https://tekstovi.net/2,221,2694.html",,Utorak,Tuesday,,"Pred tebe razlit ću svoju bol
1
K'o crno vino na bijeli stol
Još nosim onaj trag
Što boli al' je drag
A tebe nema i nema te. Prolazi još jedan utorak
Sve ide, znam
Moram biti jak
Al' čuvam jastuk naš
Tek ako zalutaš
A tebe nema i nema te. I sve dok živim
I dok imam glas
Ja plakat ću za nas
To me život okuje
I sve dok živim
I dok imam glas
Ja plakat ću za nas
Bože daj da budem jak
Da mi prođe utorak. Živim k'o vuk ponosan i sam
Ne znam za bol, ljubav niti sram
Al' čuvam jastuk naš
Tek ako zalutaš
A tebe nema i nema te","I will spread all my pain in front of you
Like red vine over a white table
I still wear the stamp
Which hurts but is liked
And you're gone and you're gone.. Another tuesday passes by
Everything goes, I know
I have to be strong
But I hold on to our pillow
If you accidentally wander by
And you're gone and you're gone. And as long as I live
And as long as I have a voice
I will cry for us
Life put those chains on me
And as long as I live
And as long as I have a voice
I will cry for us
God, let me be strong
Let the tuesday go away. I live like a wolf, proud and alone
I know no pain, love or shame
Only if you accidentally wander by
And you're gone and you're gone",https://lyricstranslate.com/en/utorak-tuesday.html,['Petar Grašo'],https://diskografija.com/pjesma/utorak-1116.htm,Utorak,1999 - Utorak,2005 - Uvertira,2005 - Uvertira - uživo - Petar Grašo & Nina,,,,,
nkaHNg1X_1_45,Petar Grašo,Petar Grašo,Uvik isti,24096,"Nisan uvik bija
dobar za se
lipe bukune
drugima bi pustija

Al' nikad nisam minja
bandiru ni boje
samo prid ocem
ja bi glavu spustija
 
(I nek' sam)
Arcija i bancija
al' da mi srce sutra stane
blagoslovija bi sve te dane

Ref.
Ostat cu uvik isti
nikad se necu minjat
ostat cu uvik isti
u to se ne smi dirat

Kad budem ima dite
dispet ce isti imat
i ja san ka moj stari
ne dam se, ne dam minjat

A ovde vride stara pravila
i tu se dobro zna
il' imas dusu
il' si nula od covika

Ja nemam voje
nedosta dobre voje
kad oko srca
vec se skupja ruzina

I uvik prvi pate
neki dobri ljudi
i ti se pitas
zasto Bog ih uzima

Ref. 2x","https://tekstovi.net/2,221,45358.html",,Uvik isti,Always the same man,,"Nisan uvik bija dobar za se
1
Lipe bokune drugima bi pustija
Al' nikad nisan minja bandiru ni boje
Samo prid ocen ja bi glavu spustija
I arčija i bančija
Al da mi srce sutra stane,blagoslovija bi sve te dane. ostat ću uvik isti,nikad se neću minjat
ostat ću uvik isti,u to se ne smi dirat
kad buden ima dite,dišpet će isti imat
i ja san ka moj stari,ne dan se ,ne dan minjat
aaa ovde vride stara pravila, tu se dobro zna
il' i aš dušu il'si nula od čovika. Ja nemam bolje nego ostat dobre voje
Kad oko srca već se skupja ruzina
I uvik prvi parte neki dobri ljudi
I ti se pitaš zašto bog ih uzima. I nek san arčija i bančija
Al da mi srce sutra stane ,
Blagoslovija bi si sve te dane. ostat ću uvik isti...","I wasn't always good to myself
I'd leave the good things to others
But I never changed my flag or my colors
Only before my father I would ever bow my head
And I lived the life, had a good time
But if my heart stopped tomorrow, I'd bless all those days. I'll always remain the same man, I'll never change
I'll always remain the same man, no one can fight that
When I have a child, it will have the same spite as me
I'm like my father, I can't, I can't change.
Oooh old rules still apply here, it's well known
You either have a soul or you're no man. There's nothing better for me than keeping a good mood
While rust starts to gather around my heart
And the good people always leave first
And you're left wondering, why does God take them. And it's good that I lived the life
But if my heart stopped tomorrow
I'd bless all those days. I'll always remain the same man...",https://lyricstranslate.com/en/uvik-isti-always-same-man.html,['Petar Grašo'],https://diskografija.com/pjesma/uvik-isti-23530.htm,Uvik isti,,,,,,,,
nkaHNg1X_1_46,Petar Grašo,Petar Grašo,Vera od suvog zlata,57601,"Idem doma jer kasni je sat 
ona me ceka sva topla, sva meka 
da ne more spat' 
ja ljubin sve tise 
jer nista joj vise 
ja ne mogu dat' 
 
Nesto me gusi 
lezi na dusi 

Zna i ona da me je sram 
sta kraj nje san lega 
ramenima slega 
jer ne znam ni sam 
sta da joj kazen 
bez da joj lazen 
i tugu joj dan 

Nesto me gusi 
lezi na dusi 

Ja san volija nju 
duson i tilon 
sad se moran Sveton vodon 
polit' prid njon i sviton 

Ja san volija nju 
al' zatvaran vrata 
za ljubav falsu san da 
veru od suvog zlata 

Suti ona, sutin i ja 
i vec smo dugo 
jedno kraj drugog 
ka' noc i dan 
i nije mi lako zivit' ovako 
i bit' normalan","https://tekstovi.net/2,221,2489.html",,Vera od suvoga zlata,Wedding Ring Out Of Pure Gold,,"Idem doma, kasni je sat,
Ona me čeka, sva topla i meka,
Da ne more spat'.
Ja ljubin sve tiše,
Jer ništa joj više ja ne mogu dat'.. Nešto me guši...
Leži na duši.... Zna i ona da me je sram
Šta kraj nje san lega, ramenima slega.
Jer ne znam ni sam šta da joj kažen
Bez da joj lažen i tugu joj dan.. Nešto me guši...
Leži na duši.... (Pripjev)
Ja san volija nju dušon i tilon
Sad se moran Sveton vodon
Polit' prid njon i sviton
Ja san volija nju, al' zatvaran vrata
Za ljubav falšu san da
Veru od suvog zlata. Šuti ona, šutin i ja
I već smo dugo
Jedno kraj drugog ka' noć i dan.
I nije mi lako živit' ovako
I bit' normalan.. (Pripjev)","I'm going home, it's late,
She waits for me, all soft and warm,
Cause she can't sleep.
I kiss her more and more quiet,
Because there's nothing more I can give her.. Something is in my throat...
Lying on my soul.... She too knows I'm ashamed
For lying next to her, I I shruged my shoulders.
Because I don't know myself what to tell her
Without lying to her and giving her sadness.. Something is in my throat...
Lying on my soul.... (Chorus)
I loved her with my body and soul
Now I have to pour Holly water over myself
In front of her and the world
I loved her but I'm closing the door
In the name of a wrong love I gave
A wedding ring out of pure gold.. She keeps quiet, I keep quiet too
And it's been a long time that we are
Next to each other like night and day.
And it's not easy for me to live like this
And be normal.. (Chorus)",https://lyricstranslate.com/en/vera-od-suvoga-zlata-wedding-ring-out-pure-gold.html,,,,,,,,,,,
nkaHNg1X_1_47,Petar Grašo,Petar Grašo,Voli me,21646,"Ko pamti sve sve noci te
mamurluke i sjaj i godine lude
kroz svaki stih disem za njih
za moju mladost i za moje ljude

Ne nosim sat, sve more stat'
i sta se mene tice sta bude bice
srce se daje dok traje, traje
samo nam 'jubav ostaje
 
Ref.
Voli me, jer sam takvi kakvi jesam
voli me, lipo je lipo bit' za nekog vezan
voli me, jer sam takvi kakvi jesam
svaki je drugi za te covik pogresan

Ne nosim sat, sve more stat'
i da se opet rodim isto bi tija
s tobom se smija, sa drustvom pija
bija bi covik ka' sta sam bija

Ref.","https://tekstovi.net/2,221,58073.html",,Voli me,Love me,,"Ko pamti sve,
1
Sve noći te,
Mamurluke i sjaj i godine lude?
Kroz svaki stih
Dišem za njih,
Za moju mladost i za moje ljude.. Ne nosim sat,
sve more stat.
I šta se mene tiče,
Šta bude biće.
Srce se daje,
Dok traje, traje,
Samo nam jubav ostaje.. Refren
Voli me, jer sam takvi kakvi jesam.
Voli me, lipo je lipo bit za nekog vezan.
Voli me, jer sam takvi kakvi jesam.
Svaki je drugi za te čovik pogrešan.. Ne nosim sat, sve more stat
I da se opet rodim isto bi ti ja.
S tobom se smija,
Sa društvom pija,
Bija bi čovik ka šta sam bija.. Refren
Voli me, jer sam takvi kakvi jesam
Voli me, lipo je lipo bit za nekog vezan
Voli me, jer sam takvi kakvi jesam
Svaki je drugi za te čovik pogrešan","Who remembers all
All night that
Hangovers and shine and crazy years?
Through each verse
I breathe for them
For my youth and for my people. I don't wear a watch
Everything can stop
And what it matters to me
What is, it will be
The heart gives itself
While it lasts, it lasts
Only love remains to us. Chorus
Love me, because I'm like that what I am
Love me, it's nice being attached for somebody
Love me, because I'm like that what I am
Every other man is wrong for you. I don't wear a watch, everything can stop
And if I born again, you and I, we would the same
I would laugh with you
I would drink with company
I would be a man like I was. Chorus
Love me, because I'm like that what I am
Love me, it's nice being attached for somebody
Love me, because I'm like that what I am
Every other man is wrong for you",https://lyricstranslate.com/en/voli-me-love-me.html-5,,,,,,,,,,,
nkaHNg1X_1_48,Petar Grašo,Petar Grašo,Volim i postojim,138391,"Hej, ljubavi
zagrli me zagrli
nek' nitko nas nikada
ne razdvoji

Svaki dan, svaki sat
novi ljudi, novi rat
jednog dana zbog njih
ce cijela zemlja stat
 
Hej, ljubavi, sad smo ljudi odrasli
i grudi mi bude tvoji pogledi
potresi, nemiri, iza ugla vrebaju
a takvi k'o ti nam uvijek trebaju

Ref.
Zato sto godine prolaze
dvadeseti vijek, zivim po svome 
 i ljubim zauvijek
godine prolaze, nemam nista s tim
volim i postojim

Hej, ljubavi, zasto ne bi ja i ti
daleko od sviju negdje pobjegli
potresi, nemiri, iza ugla vrebaju
a takvi k'o ti nam uvijek trebaju

Ref. 4x","https://tekstovi.net/2,221,4519.html",,Volim i postojim,I Love And I Exist,,"Hej, ljubavi, zagrli me, zagrli!
1
Nek' nitko nas nikada ne razdvoji.. Svaki dan, svaki sat,
Novi ljudi, novi rat.
Jednog dana zbog njih će
Cijela zemlja stat.. Hej, ljubavi, sad smo ljudi odrasli
I grudi mi bude tvoji pogledi.
Potresi, nemiri, iza ugla vrebaju,
A takvi k'o ti nam uvijek trebaju.. (Pripjev)
Zato što godine prolaze, dvadeseti vijek,
Živim po svome i ljubim zauvijek.
Godine prolaze, nemam ništa s tim.
Volim i postojim.. Hej, ljubavi, zašto ne bi ja i ti
Daleko od sviju negdje pobjegli?
Potresi, nemiri, iza ugla vrebaju,
A takvi k'o ti nam uvijek trebaju.. (Pripjev x4)","Hey, love, hold me, hold me!
May no one ever tear us apart.. Each day, each hour,
New people, new war.
One day they'll make
The whole world stop.. Hey, love, now we're grown people,
And your glances wake my chest up.
Earthquakes, riots, lurking behind corners,
And we always need those like you.. (Chorus)
Because the years go by, the twentieth century,
I live my way and I love forever.
Years go by, I have nothing to do with that.
I love and I exist.. Hey, love, why wouldn't you and me
Elope somewhere far from everyone?
Earthquakes, riots, lurking behind corners,
And we always need those like you.. (Chorus x4)",https://lyricstranslate.com/en/volim-i-postojim-i-love-and-i-exist.html,['Petar Grašo'],https://diskografija.com/pjesma/volim-i-postojim-1099.htm,Volim i postojim,1997 - Mjesec iznad oblaka,2005 - Uvertira,,,,,,
nkaHNg1X_1_49,Petar Grašo,Petar Grašo,Vrbe,14071,"Dvije su vrbe 
pokraj rijeke tiho plakale
dok su se vlati ovim poljem 
tuzno svijale

Sjecam se Nina 
one jeseni kad si otisla
bio je vjetar, zar ne pamtis
 
Ref.
Tvoja je kosa 
poput grana bila nemirna
posljednje zbogom 
kad si rekla sva u suzama

Sjeti se Nina 
one jeseni kad si otisla
sjeti se vrba pokraj rijeke
pokraj rijeke...

Dvije su vrbe 
pokraj rijeke tiho plakale
dok su se vlati ovim poljem 
tuzno svijale

Sjecam se Nina 
one jeseni kad si otisla
bio je vjetar, zar ne pamtis
zar ne pamtis

Ref.","https://tekstovi.net/2,221,5775.html",,,,,,,,['Petar Grašo'],https://diskografija.com/pjesma/vrbe-22281.htm,Vrbe,,,,,,,,
